Question,Source Article Index,Question Type,Summary
How could the Distributional Preference Reward Model (DPRM) from abs-2402.09764v3 be used to train the team of LLM agents in I-Design (abs-2404.02838v1) to generate interior designs that align with a diverse set of user aesthetic preferences instead of a single style?,"abs-2402.09764v3,abs-2404.02838v1",Synthesis & Multi-Hop Reasoning,"Title: Aligning Crowd Feedback via Distributional Preference Reward Modeling 
Summary: Deep Reinforcement Learning is widely used for aligning Large Language Models
(LLM) with human preference. However, the conventional reward modelling is
predominantly dependent on human annotations provided by a select cohort of
individuals. Such dependence may unintentionally result in skewed models that
reflect the inclinations of these annotators, thereby failing to adequately
represent the wider population's expectations. We propose the Distributional
Preference Reward Model (DPRM), a simple yet effective framework to align large
language models with diverse human preferences. To this end, we characterize
multiple preferences by a categorical distribution and introduce a Bayesian
updater to accommodate shifted or new preferences. On top of that, we design an
optimal-transportation-based loss to calibrate DPRM to align with the
preference distribution. Finally, the expected reward is utilized to fine-tune
an LLM policy to generate responses favoured by the population. Our experiments
show that DPRM significantly enhances the alignment of LLMs with population
preference, yielding more accurate, unbiased, and contextually appropriate
responses. 

Title: I-Design: Personalized LLM Interior Designer 
Summary: Interior design allows us to be who we are and live how we want - each design
is as unique as our distinct personality. However, it is not trivial for
non-professionals to express and materialize this since it requires aligning
functional and visual expectations with the constraints of physical space; this
renders interior design a luxury. To make it more accessible, we present
I-Design, a personalized interior designer that allows users to generate and
visualize their design goals through natural language communication. I-Design
starts with a team of large language model agents that engage in dialogues and
logical reasoning with one another, transforming textual user input into
feasible scene graph designs with relative object relationships. Subsequently,
an effective placement algorithm determines optimal locations for each object
within the scene. The final design is then constructed in 3D by retrieving and
integrating assets from an existing object database. Additionally, we propose a
new evaluation protocol that utilizes a vision-language model and complements
the design pipeline. Extensive quantitative and qualitative experiments show
that I-Design outperforms existing methods in delivering high-quality 3D design
solutions and aligning with abstract concepts that match user input, showcasing
its advantages across detailed 3D arrangement and conceptual fidelity. 

"
"Considering the goal of achieving human-like alignment in abs-2411.04127v1, could ChatGPT's partial success in exhibiting empathy (abs-2308.03527v3) be used as a training signal for the 'Kindness' component of the proposed alignment framework?","abs-2411.04127v1,abs-2308.03527v3",Synthesis & Multi-Hop Reasoning,"Title: Combining Theory of Mind and Kindness for Self-Supervised Human-AI
  Alignment 
Summary: As artificial intelligence (AI) becomes deeply integrated into critical
infrastructures and everyday life, ensuring its safe deployment is one of
humanity's most urgent challenges. Current AI models prioritize task
optimization over safety, leading to risks of unintended harm. These risks are
difficult to address due to the competing interests of governments, businesses,
and advocacy groups, all of which have different priorities in the AI race.
Current alignment methods, such as reinforcement learning from human feedback
(RLHF), focus on extrinsic behaviors without instilling a genuine understanding
of human values. These models are vulnerable to manipulation and lack the
social intelligence necessary to infer the mental states and intentions of
others, raising concerns about their ability to safely and responsibly make
important decisions in complex and novel situations. Furthermore, the
divergence between extrinsic and intrinsic motivations in AI introduces the
risk of deceptive or harmful behaviors, particularly as systems become more
autonomous and intelligent. We propose a novel human-inspired approach which
aims to address these various concerns and help align competing objectives. 

Title: Exploring ChatGPT's Empathic Abilities 
Summary: Empathy is often understood as the ability to share and understand another
individual's state of mind or emotion. With the increasing use of chatbots in
various domains, e.g., children seeking help with homework, individuals looking
for medical advice, and people using the chatbot as a daily source of everyday
companionship, the importance of empathy in human-computer interaction has
become more apparent. Therefore, our study investigates the extent to which
ChatGPT based on GPT-3.5 can exhibit empathetic responses and emotional
expressions. We analyzed the following three aspects: (1) understanding and
expressing emotions, (2) parallel emotional response, and (3) empathic
personality. Thus, we not only evaluate ChatGPT on various empathy aspects and
compare it with human behavior but also show a possible way to analyze the
empathy of chatbots in general. Our results show, that in 91.7% of the cases,
ChatGPT was able to correctly identify emotions and produces appropriate
answers. In conversations, ChatGPT reacted with a parallel emotion in 70.7% of
cases. The empathic capabilities of ChatGPT were evaluated using a set of five
questionnaires covering different aspects of empathy. Even though the results
show, that the scores of ChatGPT are still worse than the average of healthy
humans, it scores better than people who have been diagnosed with Asperger
syndrome / high-functioning autism. 

"
"Based on the framework for neuro-symbolic execution of code (abs-2304.00989v2) and the concept of monosemantic experts in Monet (abs-2412.04139v2), could a more interpretable code execution model be built where individual 'experts' are trained to execute specific programming language commands or functions?","abs-2304.00989v2,abs-2412.04139v2",Synthesis & Multi-Hop Reasoning,"Title: Neuro-Symbolic Execution of Generic Source Code 
Summary: Can a Python program be executed statement-by-statement by neural networks
composed according to the source code? We formulate the Neuro-Symbolic
Execution Problem and introduce Neural Interpretation (NI), the first neural
model for the execution of generic source code that allows missing definitions.
NI preserves source code structure, where every variable has a vector encoding,
and every function executes a neural network. NI is a novel neural model of
computers with a compiler architecture that can assemble neural layers
""programmed"" by source code. NI is the first neural model capable of executing
Py150 dataset programs, including library functions without concrete inputs,
and it can be trained with flexible code understanding objectives. We
demonstrate white-box execution without concrete inputs for variable misuse
localization and repair. 

Title: Monet: Mixture of Monosemantic Experts for Transformers 
Summary: Understanding the internal computations of large language models (LLMs) is
crucial for aligning them with human values and preventing undesirable
behaviors like toxic content generation. However, mechanistic interpretability
is hindered by polysemanticity -- where individual neurons respond to multiple,
unrelated concepts. While Sparse Autoencoders (SAEs) have attempted to
disentangle these features through sparse dictionary learning, they have
compromised LLM performance due to reliance on post-hoc reconstruction loss. To
address this issue, we introduce Mixture of Monosemantic Experts for
Transformers (Monet) architecture, which incorporates sparse dictionary
learning directly into end-to-end Mixture-of-Experts pretraining. Our novel
expert decomposition method enables scaling the expert count to 262,144 per
layer while total parameters scale proportionally to the square root of the
number of experts. Our analyses demonstrate mutual exclusivity of knowledge
across experts and showcase the parametric knowledge encapsulated within
individual experts. Moreover, Monet allows knowledge manipulation over domains,
languages, and toxicity mitigation without degrading general performance. Our
pursuit of transparent LLMs highlights the potential of scaling expert counts
to enhance mechanistic interpretability and directly resect the internal
knowledge to fundamentally adjust model behavior. The source code and
pretrained checkpoints are available at https://github.com/dmis-lab/Monet. 

"
Can the principles of multimodal AI in education (abs-2312.06037v2) inform the development of the SubstationAI model (abs-2412.17077v1) to create a system that not only analyzes images but also integrates textual maintenance logs and auditory sensor data for fault diagnosis?,"abs-2312.06037v2,abs-2412.17077v1",Synthesis & Multi-Hop Reasoning,"Title: Multimodality of AI for Education: Towards Artificial General
  Intelligence 
Summary: This paper presents a comprehensive examination of how multimodal artificial
intelligence (AI) approaches are paving the way towards the realization of
Artificial General Intelligence (AGI) in educational contexts. It scrutinizes
the evolution and integration of AI in educational systems, emphasizing the
crucial role of multimodality, which encompasses auditory, visual, kinesthetic,
and linguistic modes of learning. This research delves deeply into the key
facets of AGI, including cognitive frameworks, advanced knowledge
representation, adaptive learning mechanisms, strategic planning, sophisticated
language processing, and the integration of diverse multimodal data sources. It
critically assesses AGI's transformative potential in reshaping educational
paradigms, focusing on enhancing teaching and learning effectiveness, filling
gaps in existing methodologies, and addressing ethical considerations and
responsible usage of AGI in educational settings. The paper also discusses the
implications of multimodal AI's role in education, offering insights into
future directions and challenges in AGI development. This exploration aims to
provide a nuanced understanding of the intersection between AI, multimodality,
and education, setting a foundation for future research and development in AGI. 

Title: SubstationAI: Multimodal Large Model-Based Approaches for Analyzing
  Substation Equipment Faults 
Summary: The reliability of substation equipment is crucial to the stability of power
systems, but traditional fault analysis methods heavily rely on manual
expertise, limiting their effectiveness in handling complex and large-scale
data. This paper proposes a substation equipment fault analysis method based on
a multimodal large language model (MLLM). We developed a database containing
40,000 entries, including images, defect labels, and analysis reports, and used
an image-to-video generation model for data augmentation. Detailed fault
analysis reports were generated using GPT-4. Based on this database, we
developed SubstationAI, the first model dedicated to substation fault analysis,
and designed a fault diagnosis knowledge base along with knowledge enhancement
methods. Experimental results show that SubstationAI significantly outperforms
existing models, such as GPT-4, across various evaluation metrics,
demonstrating higher accuracy and practicality in fault cause analysis, repair
suggestions, and preventive measures, providing a more advanced solution for
substation equipment fault analysis. 

"
What was the average number of rounds required for the iterative distributed algorithm to reach consensus in the multi-agent multi-armed bandit experiments?,abs-2408.10865v1,Negative / Unanswerable,"Title: Multi-agent Multi-armed Bandits with Stochastic Sharable Arm Capacities 
Summary: Motivated by distributed selection problems, we formulate a new variant of
multi-player multi-armed bandit (MAB) model, which captures stochastic arrival
of requests to each arm, as well as the policy of allocating requests to
players. The challenge is how to design a distributed learning algorithm such
that players select arms according to the optimal arm pulling profile (an arm
pulling profile prescribes the number of players at each arm) without
communicating to each other. We first design a greedy algorithm, which locates
one of the optimal arm pulling profiles with a polynomial computational
complexity. We also design an iterative distributed algorithm for players to
commit to an optimal arm pulling profile with a constant number of rounds in
expectation. We apply the explore then commit (ETC) framework to address the
online setting when model parameters are unknown. We design an exploration
strategy for players to estimate the optimal arm pulling profile. Since such
estimates can be different across different players, it is challenging for
players to commit. We then design an iterative distributed algorithm, which
guarantees that players can arrive at a consensus on the optimal arm pulling
profile in only M rounds. We conduct experiments to validate our algorithm. 

"
"In the study of ChatGPT's empathy (abs-2308.03527v3), what were the specific five questionnaires used to evaluate its empathic capabilities?",abs-2308.03527v3,Negative / Unanswerable,"Title: Exploring ChatGPT's Empathic Abilities 
Summary: Empathy is often understood as the ability to share and understand another
individual's state of mind or emotion. With the increasing use of chatbots in
various domains, e.g., children seeking help with homework, individuals looking
for medical advice, and people using the chatbot as a daily source of everyday
companionship, the importance of empathy in human-computer interaction has
become more apparent. Therefore, our study investigates the extent to which
ChatGPT based on GPT-3.5 can exhibit empathetic responses and emotional
expressions. We analyzed the following three aspects: (1) understanding and
expressing emotions, (2) parallel emotional response, and (3) empathic
personality. Thus, we not only evaluate ChatGPT on various empathy aspects and
compare it with human behavior but also show a possible way to analyze the
empathy of chatbots in general. Our results show, that in 91.7% of the cases,
ChatGPT was able to correctly identify emotions and produces appropriate
answers. In conversations, ChatGPT reacted with a parallel emotion in 70.7% of
cases. The empathic capabilities of ChatGPT were evaluated using a set of five
questionnaires covering different aspects of empathy. Even though the results
show, that the scores of ChatGPT are still worse than the average of healthy
humans, it scores better than people who have been diagnosed with Asperger
syndrome / high-functioning autism. 

"
What specific version of the ALBERT model was used as the base for creating mALBERT?,abs-2403.18338v1,Negative / Unanswerable,"Title: mALBERT: Is a Compact Multilingual BERT Model Still Worth It? 
Summary: Within the current trend of Pretained Language Models (PLM), emerge more and
more criticisms about the ethical andecological impact of such models. In this
article, considering these critical remarks, we propose to focus on
smallermodels, such as compact models like ALBERT, which are more ecologically
virtuous than these PLM. However,PLMs enable huge breakthroughs in Natural
Language Processing tasks, such as Spoken and Natural LanguageUnderstanding,
classification, Question--Answering tasks. PLMs also have the advantage of
being multilingual, and,as far as we know, a multilingual version of compact
ALBERT models does not exist. Considering these facts, wepropose the free
release of the first version of a multilingual compact ALBERT model,
pre-trained using Wikipediadata, which complies with the ethical aspect of such
a language model. We also evaluate the model against classicalmultilingual PLMs
in classical NLP tasks. Finally, this paper proposes a rare study on the
subword tokenizationimpact on language performances. 

"
What was the specific programming language used for the source code that the Neural Interpretation model was tested on?,abs-2304.00989v2,Negative / Unanswerable,"Title: Neuro-Symbolic Execution of Generic Source Code 
Summary: Can a Python program be executed statement-by-statement by neural networks
composed according to the source code? We formulate the Neuro-Symbolic
Execution Problem and introduce Neural Interpretation (NI), the first neural
model for the execution of generic source code that allows missing definitions.
NI preserves source code structure, where every variable has a vector encoding,
and every function executes a neural network. NI is a novel neural model of
computers with a compiler architecture that can assemble neural layers
""programmed"" by source code. NI is the first neural model capable of executing
Py150 dataset programs, including library functions without concrete inputs,
and it can be trained with flexible code understanding objectives. We
demonstrate white-box execution without concrete inputs for variable misuse
localization and repair. 

"
