Question,Source Article Index,Question Type,Summary
What is Neural Interpretation (NI) as introduced in the paper on Neuro-Symbolic Execution?,abs-2304.00989v2,Direct Fact Retrieval & Definition,"Title: Neuro-Symbolic Execution of Generic Source Code 
Summary: Can a Python program be executed statement-by-statement by neural networks
composed according to the source code? We formulate the Neuro-Symbolic
Execution Problem and introduce Neural Interpretation (NI), the first neural
model for the execution of generic source code that allows missing definitions.
NI preserves source code structure, where every variable has a vector encoding,
and every function executes a neural network. NI is a novel neural model of
computers with a compiler architecture that can assemble neural layers
""programmed"" by source code. NI is the first neural model capable of executing
Py150 dataset programs, including library functions without concrete inputs,
and it can be trained with flexible code understanding objectives. We
demonstrate white-box execution without concrete inputs for variable misuse
localization and repair. 

"
"In the paper on multi-agent multi-armed bandits, what is meant by an 'arm pulling profile'?",abs-2408.10865v1,Direct Fact Retrieval & Definition,"Title: Multi-agent Multi-armed Bandits with Stochastic Sharable Arm Capacities 
Summary: Motivated by distributed selection problems, we formulate a new variant of
multi-player multi-armed bandit (MAB) model, which captures stochastic arrival
of requests to each arm, as well as the policy of allocating requests to
players. The challenge is how to design a distributed learning algorithm such
that players select arms according to the optimal arm pulling profile (an arm
pulling profile prescribes the number of players at each arm) without
communicating to each other. We first design a greedy algorithm, which locates
one of the optimal arm pulling profiles with a polynomial computational
complexity. We also design an iterative distributed algorithm for players to
commit to an optimal arm pulling profile with a constant number of rounds in
expectation. We apply the explore then commit (ETC) framework to address the
online setting when model parameters are unknown. We design an exploration
strategy for players to estimate the optimal arm pulling profile. Since such
estimates can be different across different players, it is challenging for
players to commit. We then design an iterative distributed algorithm, which
guarantees that players can arrive at a consensus on the optimal arm pulling
profile in only M rounds. We conduct experiments to validate our algorithm. 

"
What does HCHC stand for in the paper about high-dimensional clustering?,abs-2304.14531v2,Direct Fact Retrieval & Definition,"Title: High-dimensional Clustering onto Hamiltonian Cycle 
Summary: Clustering aims to group unlabelled samples based on their similarities. It
has become a significant tool for the analysis of high-dimensional data.
However, most of the clustering methods merely generate pseudo labels and thus
are unable to simultaneously present the similarities between different
clusters and outliers. This paper proposes a new framework called
High-dimensional Clustering onto Hamiltonian Cycle (HCHC) to solve the above
problems. First, HCHC combines global structure with local structure in one
objective function for deep clustering, improving the labels as relative
probabilities, to mine the similarities between different clusters while
keeping the local structure in each cluster. Then, the anchors of different
clusters are sorted on the optimal Hamiltonian cycle generated by the cluster
similarities and mapped on the circumference of a circle. Finally, a sample
with a higher probability of a cluster will be mapped closer to the
corresponding anchor. In this way, our framework allows us to appreciate three
aspects visually and simultaneously - clusters (formed by samples with high
probabilities), cluster similarities (represented as circular distances), and
outliers (recognized as dots far away from all clusters). The experiments
illustrate the superiority of HCHC. 

"
"According to the study on ChatGPT's empathy, in what percentage of cases did the model react with a parallel emotion in conversations?",abs-2308.03527v3,Direct Fact Retrieval & Definition,"Title: Exploring ChatGPT's Empathic Abilities 
Summary: Empathy is often understood as the ability to share and understand another
individual's state of mind or emotion. With the increasing use of chatbots in
various domains, e.g., children seeking help with homework, individuals looking
for medical advice, and people using the chatbot as a daily source of everyday
companionship, the importance of empathy in human-computer interaction has
become more apparent. Therefore, our study investigates the extent to which
ChatGPT based on GPT-3.5 can exhibit empathetic responses and emotional
expressions. We analyzed the following three aspects: (1) understanding and
expressing emotions, (2) parallel emotional response, and (3) empathic
personality. Thus, we not only evaluate ChatGPT on various empathy aspects and
compare it with human behavior but also show a possible way to analyze the
empathy of chatbots in general. Our results show, that in 91.7% of the cases,
ChatGPT was able to correctly identify emotions and produces appropriate
answers. In conversations, ChatGPT reacted with a parallel emotion in 70.7% of
cases. The empathic capabilities of ChatGPT were evaluated using a set of five
questionnaires covering different aspects of empathy. Even though the results
show, that the scores of ChatGPT are still worse than the average of healthy
humans, it scores better than people who have been diagnosed with Asperger
syndrome / high-functioning autism. 

"
What is the primary goal of the High-dimensional Clustering onto Hamiltonian Cycle (HCHC) framework?,abs-2304.14531v2,Summarization / Purpose Identification,"Title: High-dimensional Clustering onto Hamiltonian Cycle 
Summary: Clustering aims to group unlabelled samples based on their similarities. It
has become a significant tool for the analysis of high-dimensional data.
However, most of the clustering methods merely generate pseudo labels and thus
are unable to simultaneously present the similarities between different
clusters and outliers. This paper proposes a new framework called
High-dimensional Clustering onto Hamiltonian Cycle (HCHC) to solve the above
problems. First, HCHC combines global structure with local structure in one
objective function for deep clustering, improving the labels as relative
probabilities, to mine the similarities between different clusters while
keeping the local structure in each cluster. Then, the anchors of different
clusters are sorted on the optimal Hamiltonian cycle generated by the cluster
similarities and mapped on the circumference of a circle. Finally, a sample
with a higher probability of a cluster will be mapped closer to the
corresponding anchor. In this way, our framework allows us to appreciate three
aspects visually and simultaneously - clusters (formed by samples with high
probabilities), cluster similarities (represented as circular distances), and
outliers (recognized as dots far away from all clusters). The experiments
illustrate the superiority of HCHC. 

"
Summarize the main challenge that the research on 'Multi-agent Multi-armed Bandits with Stochastic Sharable Arm Capacities' aims to address.,abs-2408.10865v1,Summarization / Purpose Identification,"Title: Multi-agent Multi-armed Bandits with Stochastic Sharable Arm Capacities 
Summary: Motivated by distributed selection problems, we formulate a new variant of
multi-player multi-armed bandit (MAB) model, which captures stochastic arrival
of requests to each arm, as well as the policy of allocating requests to
players. The challenge is how to design a distributed learning algorithm such
that players select arms according to the optimal arm pulling profile (an arm
pulling profile prescribes the number of players at each arm) without
communicating to each other. We first design a greedy algorithm, which locates
one of the optimal arm pulling profiles with a polynomial computational
complexity. We also design an iterative distributed algorithm for players to
commit to an optimal arm pulling profile with a constant number of rounds in
expectation. We apply the explore then commit (ETC) framework to address the
online setting when model parameters are unknown. We design an exploration
strategy for players to estimate the optimal arm pulling profile. Since such
estimates can be different across different players, it is challenging for
players to commit. We then design an iterative distributed algorithm, which
guarantees that players can arrive at a consensus on the optimal arm pulling
profile in only M rounds. We conduct experiments to validate our algorithm. 

"
What is the central purpose of the SubstationAI model described in article abs-2412.17077v1?,abs-2412.17077v1,Summarization / Purpose Identification,"Title: SubstationAI: Multimodal Large Model-Based Approaches for Analyzing
  Substation Equipment Faults 
Summary: The reliability of substation equipment is crucial to the stability of power
systems, but traditional fault analysis methods heavily rely on manual
expertise, limiting their effectiveness in handling complex and large-scale
data. This paper proposes a substation equipment fault analysis method based on
a multimodal large language model (MLLM). We developed a database containing
40,000 entries, including images, defect labels, and analysis reports, and used
an image-to-video generation model for data augmentation. Detailed fault
analysis reports were generated using GPT-4. Based on this database, we
developed SubstationAI, the first model dedicated to substation fault analysis,
and designed a fault diagnosis knowledge base along with knowledge enhancement
methods. Experimental results show that SubstationAI significantly outperforms
existing models, such as GPT-4, across various evaluation metrics,
demonstrating higher accuracy and practicality in fault cause analysis, repair
suggestions, and preventive measures, providing a more advanced solution for
substation equipment fault analysis. 

"
What is the main argument presented in the paper 'AI Consciousness is Inevitable' from a Theoretical Computer Science perspective?,abs-2403.17101v9,Summarization / Purpose Identification,"Title: AI Consciousness is Inevitable: A Theoretical Computer Science
  Perspective 
Summary: We look at consciousness through the lens of Theoretical Computer Science, a
branch of mathematics that studies computation under resource limitations. From
this perspective, we develop a formal machine model for consciousness. The
model is inspired by Alan Turing's simple yet powerful model of computation and
Bernard Baars' theater model of consciousness. Though extremely simple, the
model (1) aligns at a high level with many of the major scientific theories of
human and animal consciousness, (2) provides explanations at a high level for
many phenomena associated with consciousness, and (3) gives insight into how a
machine can have subjective consciousness. This combination supports our claim
that machine consciousness is not only plausible but inevitable. 

"
Compare the approaches to modeling human cognition in LLMs as presented in 'Exploring ChatGPT's Empathic Abilities' (abs-2308.03527v3) and 'Aligning Crowd Feedback via Distributional Preference Reward Modeling' (abs-2402.09764v3).,"abs-2308.03527v3,abs-2402.09764v3",Comparative & Contrastive,"Title: Exploring ChatGPT's Empathic Abilities 
Summary: Empathy is often understood as the ability to share and understand another
individual's state of mind or emotion. With the increasing use of chatbots in
various domains, e.g., children seeking help with homework, individuals looking
for medical advice, and people using the chatbot as a daily source of everyday
companionship, the importance of empathy in human-computer interaction has
become more apparent. Therefore, our study investigates the extent to which
ChatGPT based on GPT-3.5 can exhibit empathetic responses and emotional
expressions. We analyzed the following three aspects: (1) understanding and
expressing emotions, (2) parallel emotional response, and (3) empathic
personality. Thus, we not only evaluate ChatGPT on various empathy aspects and
compare it with human behavior but also show a possible way to analyze the
empathy of chatbots in general. Our results show, that in 91.7% of the cases,
ChatGPT was able to correctly identify emotions and produces appropriate
answers. In conversations, ChatGPT reacted with a parallel emotion in 70.7% of
cases. The empathic capabilities of ChatGPT were evaluated using a set of five
questionnaires covering different aspects of empathy. Even though the results
show, that the scores of ChatGPT are still worse than the average of healthy
humans, it scores better than people who have been diagnosed with Asperger
syndrome / high-functioning autism. 

Title: Aligning Crowd Feedback via Distributional Preference Reward Modeling 
Summary: Deep Reinforcement Learning is widely used for aligning Large Language Models
(LLM) with human preference. However, the conventional reward modelling is
predominantly dependent on human annotations provided by a select cohort of
individuals. Such dependence may unintentionally result in skewed models that
reflect the inclinations of these annotators, thereby failing to adequately
represent the wider population's expectations. We propose the Distributional
Preference Reward Model (DPRM), a simple yet effective framework to align large
language models with diverse human preferences. To this end, we characterize
multiple preferences by a categorical distribution and introduce a Bayesian
updater to accommodate shifted or new preferences. On top of that, we design an
optimal-transportation-based loss to calibrate DPRM to align with the
preference distribution. Finally, the expected reward is utilized to fine-tune
an LLM policy to generate responses favoured by the population. Our experiments
show that DPRM significantly enhances the alignment of LLMs with population
preference, yielding more accurate, unbiased, and contextually appropriate
responses. 

"
"Contrast the architectural goals of mALBERT (abs-2403.18338v1), a compact multilingual model, with those of Monet (abs-2412.04139v2), which uses a Mixture of Monosemantic Experts for interpretability.","abs-2403.18338v1,abs-2412.04139v2",Comparative & Contrastive,"Title: mALBERT: Is a Compact Multilingual BERT Model Still Worth It? 
Summary: Within the current trend of Pretained Language Models (PLM), emerge more and
more criticisms about the ethical andecological impact of such models. In this
article, considering these critical remarks, we propose to focus on
smallermodels, such as compact models like ALBERT, which are more ecologically
virtuous than these PLM. However,PLMs enable huge breakthroughs in Natural
Language Processing tasks, such as Spoken and Natural LanguageUnderstanding,
classification, Question--Answering tasks. PLMs also have the advantage of
being multilingual, and,as far as we know, a multilingual version of compact
ALBERT models does not exist. Considering these facts, wepropose the free
release of the first version of a multilingual compact ALBERT model,
pre-trained using Wikipediadata, which complies with the ethical aspect of such
a language model. We also evaluate the model against classicalmultilingual PLMs
in classical NLP tasks. Finally, this paper proposes a rare study on the
subword tokenizationimpact on language performances. 

Title: Monet: Mixture of Monosemantic Experts for Transformers 
Summary: Understanding the internal computations of large language models (LLMs) is
crucial for aligning them with human values and preventing undesirable
behaviors like toxic content generation. However, mechanistic interpretability
is hindered by polysemanticity -- where individual neurons respond to multiple,
unrelated concepts. While Sparse Autoencoders (SAEs) have attempted to
disentangle these features through sparse dictionary learning, they have
compromised LLM performance due to reliance on post-hoc reconstruction loss. To
address this issue, we introduce Mixture of Monosemantic Experts for
Transformers (Monet) architecture, which incorporates sparse dictionary
learning directly into end-to-end Mixture-of-Experts pretraining. Our novel
expert decomposition method enables scaling the expert count to 262,144 per
layer while total parameters scale proportionally to the square root of the
number of experts. Our analyses demonstrate mutual exclusivity of knowledge
across experts and showcase the parametric knowledge encapsulated within
individual experts. Moreover, Monet allows knowledge manipulation over domains,
languages, and toxicity mitigation without degrading general performance. Our
pursuit of transparent LLMs highlights the potential of scaling expert counts
to enhance mechanistic interpretability and directly resect the internal
knowledge to fundamentally adjust model behavior. The source code and
pretrained checkpoints are available at https://github.com/dmis-lab/Monet. 

"
How does the concept of Artificial General Intelligence (AGI) in education (abs-2312.06037v2) differ from the view of AGI presented as a path through 'Concepts' (abs-2309.01622v1)?,"abs-2312.06037v2,abs-2309.01622v1",Comparative & Contrastive,"Title: Multimodality of AI for Education: Towards Artificial General
  Intelligence 
Summary: This paper presents a comprehensive examination of how multimodal artificial
intelligence (AI) approaches are paving the way towards the realization of
Artificial General Intelligence (AGI) in educational contexts. It scrutinizes
the evolution and integration of AI in educational systems, emphasizing the
crucial role of multimodality, which encompasses auditory, visual, kinesthetic,
and linguistic modes of learning. This research delves deeply into the key
facets of AGI, including cognitive frameworks, advanced knowledge
representation, adaptive learning mechanisms, strategic planning, sophisticated
language processing, and the integration of diverse multimodal data sources. It
critically assesses AGI's transformative potential in reshaping educational
paradigms, focusing on enhancing teaching and learning effectiveness, filling
gaps in existing methodologies, and addressing ethical considerations and
responsible usage of AGI in educational settings. The paper also discusses the
implications of multimodal AI's role in education, offering insights into
future directions and challenges in AGI development. This exploration aims to
provide a nuanced understanding of the intersection between AI, multimodality,
and education, setting a foundation for future research and development in AGI. 

Title: Concepts is All You Need: A More Direct Path to AGI 
Summary: Little demonstrable progress has been made toward AGI (Artificial General
Intelligence) since the term was coined some 20 years ago. In spite of the
fantastic breakthroughs in Statistical AI such as AlphaZero, ChatGPT, and
Stable Diffusion none of these projects have, or claim to have, a clear path to
AGI. In order to expedite the development of AGI it is crucial to understand
and identify the core requirements of human-like intelligence as it pertains to
AGI. From that one can distill which particular development steps are necessary
to achieve AGI, and which are a distraction. Such analysis highlights the need
for a Cognitive AI approach rather than the currently favored statistical and
generative efforts. More specifically it identifies the central role of
concepts in human-like cognition. Here we outline an architecture and
development plan, together with some preliminary results, that offers a much
more direct path to full Human-Level AI (HLAI)/ AGI. 

"
Compare the approach to generating creative content in I-Design for interior design (abs-2404.02838v1) with the approach used by LLMs to generate puzzles for the Connections word game (abs-2407.11240v1).,"abs-2404.02838v1,abs-2407.11240v1",Comparative & Contrastive,"Title: I-Design: Personalized LLM Interior Designer 
Summary: Interior design allows us to be who we are and live how we want - each design
is as unique as our distinct personality. However, it is not trivial for
non-professionals to express and materialize this since it requires aligning
functional and visual expectations with the constraints of physical space; this
renders interior design a luxury. To make it more accessible, we present
I-Design, a personalized interior designer that allows users to generate and
visualize their design goals through natural language communication. I-Design
starts with a team of large language model agents that engage in dialogues and
logical reasoning with one another, transforming textual user input into
feasible scene graph designs with relative object relationships. Subsequently,
an effective placement algorithm determines optimal locations for each object
within the scene. The final design is then constructed in 3D by retrieving and
integrating assets from an existing object database. Additionally, we propose a
new evaluation protocol that utilizes a vision-language model and complements
the design pipeline. Extensive quantitative and qualitative experiments show
that I-Design outperforms existing methods in delivering high-quality 3D design
solutions and aligning with abstract concepts that match user input, showcasing
its advantages across detailed 3D arrangement and conceptual fidelity. 

Title: Making New Connections: LLMs as Puzzle Generators for The New York
  Times' Connections Word Game 
Summary: The Connections puzzle is a word association game published daily by The New
York Times (NYT). In this game, players are asked to find groups of four words
that are connected by a common theme. While solving a given Connections puzzle
requires both semantic knowledge and abstract reasoning, generating novel
puzzles additionally requires a form of metacognition: generators must be able
to accurately model the downstream reasoning of potential solvers. In this
paper, we investigate the ability of the GPT family of Large Language Models
(LLMs) to generate challenging and creative word games for human players. We
start with an analysis of the word game Connections and the unique challenges
it poses as a Procedural Content Generation (PCG) domain. We then propose a
method for generating Connections puzzles using LLMs by adapting a Tree of
Thoughts (ToT) prompting approach. We evaluate this method by conducting a user
study, asking human players to compare AI-generated puzzles against published
Connections puzzles. Our findings show that LLMs are capable puzzle creators,
and can generate diverse sets of enjoyable, challenging, and creative
Connections puzzles as judged by human users. 

"
