Question,Source Article Index,Question Type,Summary,qwen2.5:3b,documentIDs,context_retrieved
What is the main purpose of the Progressive Prototypical Network (PPN) for predicting health risks from EHR?,abs-2312.10977v1,Summarization / Purpose Identification,"Title: Predict and Interpret Health Risk using EHR through Typical Patients 
Summary: Predicting health risks from electronic health records (EHR) is a topic of
recent interest. Deep learning models have achieved success by modeling
temporal and feature interaction. However, these methods learn insufficient
representations and lead to poor performance when it comes to patients with few
visits or sparse records. Inspired by the fact that doctors may compare the
patient with typical patients and make decisions from similar cases, we propose
a Progressive Prototypical Network (PPN) to select typical patients as
prototypes and utilize their information to enhance the representation of the
given patient. In particular, a progressive prototype memory and two prototype
separation losses are proposed to update prototypes. Besides, a novel
integration is introduced for better fusing information from patients and
prototypes. Experiments on three real-world datasets demonstrate that our model
brings improvement on all metrics. To make our results better understood by
physicians, we developed an application at http://ppn.ai-care.top. Our code is
released at https://github.com/yzhHoward/PPN. 

","The Progressive Prototypical Network (PPN) aims to address the challenge of representing patients with few visits or sparse records in Electronic Health Records (EHR). By selecting typical patients as prototypes and utilizing their information, PPN enhances representation learning, leading to improved performance on various health risk prediction tasks.","abs-2312.10977v1, abs-2309.06584v4, abs-2103.15682v2, abs-2006.10337v2","[""Summary: Predicting health risks from electronic health records (EHR) is a topic of recent interest. Deep learning models have achieved success by modeling temporal and feature interaction. However, these methods learn insufficient representations and lead to poor performance when it comes to patients with few visits or sparse records. Inspired by the fact that doctors may compare the patient with typical patients and make decisions from similar cases, we propose a Progressive Prototypical Network (PPN) to select typical patients as prototypes and utilize their information to enhance the representation of the given patient. In particular, a progressive prototype memory and two prototype separation losses are proposed to update prototypes. Besides, a novel integration is introduced for better fusing information from patients and prototypes. Experiments on three real-world datasets demonstrate that our model brings improvement on all metrics. To make our results better understood by"", ""Title: Predict and Interpret Health Risk using EHR through Typical Patients.\nPublished_date: 2023-12-18."", ""Title: Self-explainable Graph Neural Network for Alzheimer's Disease And\n  Related Dementias Risk Prediction.\nPublished_date: 2023-09-12."", ""Title: Rapid Risk Minimization with Bayesian Models Through Deep Learning\n  Approximation.\nPublished_date: 2021-03-29."", ""Title: Category-Specific CNN for Visual-aware CTR Prediction at JD.com.\nPublished_date: 2020-06-18.""]"
What is the primary contribution of the paper on the Forward-Forward algorithm for training neural networks?,abs-2212.13345v1,Summarization / Purpose Identification,"Title: The Forward-Forward Algorithm: Some Preliminary Investigations 
Summary: The aim of this paper is to introduce a new learning procedure for neural
networks and to demonstrate that it works well enough on a few small problems
to be worth further investigation. The Forward-Forward algorithm replaces the
forward and backward passes of backpropagation by two forward passes, one with
positive (i.e. real) data and the other with negative data which could be
generated by the network itself. Each layer has its own objective function
which is simply to have high goodness for positive data and low goodness for
negative data. The sum of the squared activities in a layer can be used as the
goodness but there are many other possibilities, including minus the sum of the
squared activities. If the positive and negative passes could be separated in
time, the negative passes could be done offline, which would make the learning
much simpler in the positive pass and allow video to be pipelined through the
network without ever storing activities or stopping to propagate derivatives. 

","The primary contribution of the paper discussing the Forward-Forward algorithm is its demonstration that this forward-only learning procedure can effectively replace the traditional backward pass in backpropagation, and it shows connections between the Forward-Forward algorithm and other neuro-inspired learning rules such as Feedback Alignment. The study provides an analytical understanding of the Forward-Forward's dynamics during training, particularly when using top-down feedback, and highlights its ability to learn without a backward pass while sharing similar principles with PEPITA and Feedback Alignment frameworks.","abs-2302.05440v2, abs-2212.13345v1, abs-2412.09860v1, abs-2310.03927v1","[""Summary: \""Forward-only\"" algorithms, which train neural networks while avoiding a backward pass, have recently gained attention as a way of solving the biologically unrealistic aspects of backpropagation. Here, we first address compelling challenges related to the \""forward-only\"" rules, which include reducing the performance gap with backpropagation and providing an analytical understanding of their dynamics. To this end, we show that the forward-only algorithm with top-down feedback is well-approximated by an \""adaptive-feedback-alignment\"" algorithm, and we analytically track its performance during learning in a prototype high-dimensional setting. Then, we compare different versions of forward-only algorithms, focusing on the Forward-Forward and PEPITA frameworks, and we show that they share the same learning principles. Overall, our work unveils the connections between three key neuro-inspired learning rules, providing a link between \""forward-only\"" algorithms, i.e., Forward-Forward and"", ""Summary: The aim of this paper is to introduce a new learning procedure for neural networks and to demonstrate that it works well enough on a few small problems to be worth further investigation. The Forward-Forward algorithm replaces the forward and backward passes of backpropagation by two forward passes, one with positive (i.e. real) data and the other with negative data which could be generated by the network itself. Each layer has its own objective function which is simply to have high goodness for positive data and low goodness for negative data. The sum of the squared activities in a layer can be used as the goodness but there are many other possibilities, including minus the sum of the squared activities. If the positive and negative passes could be separated in time, the negative passes could be done offline, which would make the learning much simpler in the positive pass and allow video to be pipelined through the network without ever storing activities or stopping to"", ""Summary: Graph neural networks (GNNs) with unsupervised learning can solve large-scale combinatorial optimization problems (COPs) with efficient time complexity, making them versatile for various applications. However, since this method maps the combinatorial optimization problem to the training process of a graph neural network, and the current mainstream backpropagation-based training algorithms are prone to fall into local minima, the optimization performance is still inferior to the current state-of-the-art (SOTA) COP methods. To address this issue, inspired by possibly chaotic dynamics of real brain learning, we introduce a chaotic training algorithm, i.e. chaotic graph backpropagation (CGBP), which introduces a local loss function in GNN that makes the training process not only chaotic but also highly efficient. Different from existing methods, we show that the global ergodicity and pseudo-randomness of such chaotic dynamics enable CGBP to learn each optimal GNN effectively and"", ""Summary: Neural networks are not learning optimal decision boundaries. We show that decision boundaries are situated in areas of low training data density. They are impacted by few training samples which can easily lead to overfitting. We provide a simple algorithm performing a weighted average of the prediction of a sample and its nearest neighbors' (computed in latent space) leading to a minor favorable outcomes for a variety of important measures for neural networks. In our evaluation, we employ various self-trained and pre-trained convolutional neural networks to show that our approach improves (i) resistance to label noise, (ii) robustness against adversarial attacks, (iii) classification accuracy, and to some degree even (iv) interpretability. While improvements are not necessarily large in all four areas, our approach is conceptually simple, i.e., improvements come without any modification to network architecture, training procedure or dataset. Furthermore, they are in stark"", ""the connections between three key neuro-inspired learning rules, providing a link between \""forward-only\"" algorithms, i.e., Forward-Forward and PEPITA, and an approximation of backpropagation, i.e., Feedback Alignment.""]"
Summarize the goal of the study 'Provable Domain Generalization via Invariant-Feature Subspace Recovery'.,abs-2201.12919v2,Summarization / Purpose Identification,"Title: Provable Domain Generalization via Invariant-Feature Subspace Recovery 
Summary: Domain generalization asks for models trained over a set of training
environments to perform well in unseen test environments. Recently, a series of
algorithms such as Invariant Risk Minimization (IRM) has been proposed for
domain generalization. However, Rosenfeld et al. (2021) shows that in a simple
linear data model, even if non-convexity issues are ignored, IRM and its
extensions cannot generalize to unseen environments with less than $d_s+1$
training environments, where $d_s$ is the dimension of the spurious-feature
subspace. In this paper, we propose to achieve domain generalization with
Invariant-feature Subspace Recovery (ISR). Our first algorithm, ISR-Mean, can
identify the subspace spanned by invariant features from the first-order
moments of the class-conditional distributions, and achieve provable domain
generalization with $d_s+1$ training environments under the data model of
Rosenfeld et al. (2021). Our second algorithm, ISR-Cov, further reduces the
required number of training environments to $O(1)$ using the information of
second-order moments. Notably, unlike IRM, our algorithms bypass non-convexity
issues and enjoy global convergence guarantees. Empirically, our ISRs can
obtain superior performance compared with IRM on synthetic benchmarks. In
addition, on three real-world image and text datasets, we show that both ISRs
can be used as simple yet effective post-processing methods to improve the
worst-case accuracy of (pre-)trained models against spurious correlations and
group shifts. 

","The study aims to achieve provable domain generalization by identifying the subspace spanned by invariant features using algorithms like ISR-Mean and ISR-Cov, which can generalize with $d_s+1$ training environments in a linear data model, even when non-convexity issues are ignored.","abs-2201.12919v2, abs-2110.15057v2, abs-2103.11163v2, abs-2110.05169v3","[""Title: Provable Domain Generalization via Invariant-Feature Subspace Recovery.\nPublished_date: 2022-01-30."", ""Summary: Domain generalization asks for models trained over a set of training environments to perform well in unseen test environments. Recently, a series of algorithms such as Invariant Risk Minimization (IRM) has been proposed for domain generalization. However, Rosenfeld et al. (2021) shows that in a simple linear data model, even if non-convexity issues are ignored, IRM and its extensions cannot generalize to unseen environments with less than $d_s+1$ training environments, where $d_s$ is the dimension of the spurious-feature subspace. In this paper, we propose to achieve domain generalization with Invariant-feature Subspace Recovery (ISR). Our first algorithm, ISR-Mean, can identify the subspace spanned by invariant features from the first-order moments of the class-conditional distributions, and achieve provable domain generalization with $d_s+1$ training environments under the data model of Rosenfeld et al. (2021). Our second algorithm, ISR-Cov, further reduces the required"", ""In particular, our solution is unique, matches conditional distributions across domains, recovers target proportions and explicitly controls the target generalization risk. Through an exhaustive comparison on several datasets, we challenge the state-of-the-art in GeTarS."", ""Title: An Empirical Framework for Domain Generalization in Clinical Settings.\nPublished_date: 2021-03-20."", ""expensive (e.g., fine-tuning) and cannot rely on meta-RL techniques since there is just a single train environment. To do so, we propose an approach where we learn a subspace of policies within the parameter space. This subspace contains an infinite number of policies that are trained to solve the training environment while having different parameter values. As a consequence, two policies in that subspace process information differently and exhibit different behaviors when facing variations of the train environment. Our experiments carried out over a large variety of benchmarks compare our approach with baselines, including diversity-based methods. In comparison, our approach is simple to tune, does not need any extra component (e.g., discriminator) and learns policies able to gather a high reward on unseen environments.""]"
What is the central argument of the paper 'Towards Better Generalization: Weight Decay Induces Low-rank Bias for Neural Networks'?,abs-2410.02176v1,Summarization / Purpose Identification,"Title: Towards Better Generalization: Weight Decay Induces Low-rank Bias for
  Neural Networks 
Summary: We study the implicit bias towards low-rank weight matrices when training
neural networks (NN) with Weight Decay (WD). We prove that when a ReLU NN is
sufficiently trained with Stochastic Gradient Descent (SGD) and WD, its weight
matrix is approximately a rank-two matrix. Empirically, we demonstrate that WD
is a necessary condition for inducing this low-rank bias across both regression
and classification tasks. Our work differs from previous studies as our
theoretical analysis does not rely on common assumptions regarding the training
data distribution, optimality of weight matrices, or specific training
procedures. Furthermore, by leveraging the low-rank bias, we derive improved
generalization error bounds and provide numerical evidence showing that better
generalization can be achieved. Thus, our work offers both theoretical and
empirical insights into the strong generalization performance of SGD when
combined with WD. 

","The central argument of the paper ""Towards Better Generalization: Weight Decay Induces Low-rank Bias for Neural Networks"" suggests that incorporating weight decay into neural networks can induce a low-rank bias, which aids in improving generalization by reducing overfitting.","abs-2410.02176v1, abs-2211.00692v2, abs-2403.13037v1, abs-2006.06135v1, abs-2104.14936v1","[""Title: Towards Better Generalization: Weight Decay Induces Low-rank Bias for\n  Neural Networks.\nPublished_date: 2024-10-03."", ""Title: Towards Better Out-of-Distribution Generalization of Neural Algorithmic\n  Reasoning Tasks.\nPublished_date: 2022-11-01."", ""Title: BiLoRA: A Bi-level Optimization Framework for Overfitting-Resilient\n  Low-Rank Adaptation of Large Pre-trained Models.\nPublished_date: 2024-03-19."", ""Title: Sample Efficient Reinforcement Learning via Low-Rank Matrix Estimation.\nPublished_date: 2020-06-11."", ""Title: Low-Rank Autoregressive Tensor Completion for Spatiotemporal Traffic\n  Data Imputation.\nPublished_date: 2021-04-30.""]"
Compare the methods used for handling fake news in GraMuFeN (abs-2310.07668v1) and ensuring information reliability in RA-RAG (abs-2410.22954v1).,"abs-2310.07668v1,abs-2410.22954v1",Comparative & Contrastive,"Title: GRaMuFeN: Graph-based Multi-modal Fake News Detection in Social Media 
Summary: The proliferation of social media platforms such as Twitter, Instagram, and
Weibo has significantly enhanced the dissemination of false information. This
phenomenon grants both individuals and governmental entities the ability to
shape public opinions, highlighting the need for deploying effective detection
methods. In this paper, we propose GraMuFeN, a model designed to detect fake
content by analyzing both the textual and image content of news. GraMuFeN
comprises two primary components: a text encoder and an image encoder. For
textual analysis, GraMuFeN treats each text as a graph and employs a Graph
Convolutional Neural Network (GCN) as the text encoder. Additionally, the
pre-trained ResNet-152, as a Convolutional Neural Network (CNN), has been
utilized as the image encoder. By integrating the outputs from these two
encoders and implementing a contrastive similarity loss function, GraMuFeN
achieves remarkable results. Extensive evaluations conducted on two publicly
available benchmark datasets for social media news indicate a 10 % increase in
micro F1-Score, signifying improvement over existing state-of-the-art models.
These findings underscore the effectiveness of combining GCN and CNN models for
detecting fake news in multi-modal data, all while minimizing the additional
computational burden imposed by model parameters. 

Title: Retrieval-Augmented Generation with Estimation of Source Reliability 
Summary: Retrieval-augmented generation (RAG) addresses key limitations of large
language models (LLMs), such as hallucinations and outdated knowledge, by
incorporating external databases. These databases typically consult multiple
sources to encompass up-to-date and various information. However, standard RAG
methods often overlook the heterogeneous source reliability in the multi-source
database and retrieve documents solely based on relevance, making them prone to
propagating misinformation. To address this, we propose Reliability-Aware RAG
(RA-RAG) which estimates the reliability of multiple sources and incorporates
this information into both retrieval and aggregation processes. Specifically,
it iteratively estimates source reliability and true answers for a set of
queries with no labelling. Then, it selectively retrieves relevant documents
from a few of reliable sources and aggregates them using weighted majority
voting, where the selective retrieval ensures scalability while not
compromising the performance. We also introduce a benchmark designed to reflect
real-world scenarios with heterogeneous source reliability and demonstrate the
effectiveness of RA-RAG compared to a set of baselines. 

","GraMuFeN uses a combination of text encoder based on Graph Convolutional Neural Network (GCN) for textual analysis and an image encoder using the pre-trained ResNet-152 for visual content. In contrast, RA-RAG addresses the reliability issue by estimating the reliability scores of multiple sources in a multi-source database, selectively retrieving relevant documents from reliable sources, and aggregating them through weighted majority voting to ensure both accuracy and scalability.","abs-2310.07668v1, abs-2410.22954v1, abs-2107.10935v1","[""Summary: The proliferation of social media platforms such as Twitter, Instagram, and Weibo has significantly enhanced the dissemination of false information. This phenomenon grants both individuals and governmental entities the ability to shape public opinions, highlighting the need for deploying effective detection methods. In this paper, we propose GraMuFeN, a model designed to detect fake content by analyzing both the textual and image content of news. GraMuFeN comprises two primary components: a text encoder and an image encoder. For textual analysis, GraMuFeN treats each text as a graph and employs a Graph Convolutional Neural Network (GCN) as the text encoder. Additionally, the pre-trained ResNet-152, as a Convolutional Neural Network (CNN), has been utilized as the image encoder. By integrating the outputs from these two encoders and implementing a contrastive similarity loss function, GraMuFeN achieves remarkable results. Extensive evaluations conducted on two publicly"", ""and implementing a contrastive similarity loss function, GraMuFeN achieves remarkable results. Extensive evaluations conducted on two publicly available benchmark datasets for social media news indicate a 10 % increase in micro F1-Score, signifying improvement over existing state-of-the-art models. These findings underscore the effectiveness of combining GCN and CNN models for detecting fake news in multi-modal data, all while minimizing the additional computational burden imposed by model parameters."", ""Summary: Retrieval-augmented generation (RAG) addresses key limitations of large language models (LLMs), such as hallucinations and outdated knowledge, by incorporating external databases. These databases typically consult multiple sources to encompass up-to-date and various information. However, standard RAG methods often overlook the heterogeneous source reliability in the multi-source database and retrieve documents solely based on relevance, making them prone to propagating misinformation. To address this, we propose Reliability-Aware RAG (RA-RAG) which estimates the reliability of multiple sources and incorporates this information into both retrieval and aggregation processes. Specifically, it iteratively estimates source reliability and true answers for a set of queries with no labelling. Then, it selectively retrieves relevant documents from a few of reliable sources and aggregates them using weighted majority voting, where the selective retrieval ensures scalability while not"", ""from a few of reliable sources and aggregates them using weighted majority voting, where the selective retrieval ensures scalability while not compromising the performance. We also introduce a benchmark designed to reflect real-world scenarios with heterogeneous source reliability and demonstrate the effectiveness of RA-RAG compared to a set of baselines."", ""Summary: Automated headline generation for online news articles is not a trivial task - machine generated titles need to be grammatically correct, informative, capture attention and generate search traffic without being \""click baits\"" or \""fake news\"". In this paper we showcase how a pre-trained language model can be leveraged to create an abstractive news headline generator for German language. We incorporate state of the art fine-tuning techniques for abstractive text summarization, i.e. we use different optimizers for the encoder and decoder where the former is pre-trained and the latter is trained from scratch. We modify the headline generation to incorporate frequently sought keywords relevant for search engine optimization. We conduct experiments on a German news data set and achieve a ROUGE-L-gram F-score of 40.02. Furthermore, we address the limitations of ROUGE for measuring the quality of text summarization by introducing a sentence similarity metric and human evaluation.""]"
