Question,Source Article Index,Question Type,Summary,qwen2.5:3b,documentIDs,context_retrieved
What is the Prism framework designed to do for Vision Language Models (VLMs)?,abs-2406.14544v1,Direct Fact Retrieval & Definition,"Title: Prism: A Framework for Decoupling and Assessing the Capabilities of VLMs 
Summary: Vision Language Models (VLMs) demonstrate remarkable proficiency in
addressing a wide array of visual questions, which requires strong perception
and reasoning faculties. Assessing these two competencies independently is
crucial for model refinement, despite the inherent difficulty due to the
intertwined nature of seeing and reasoning in existing VLMs. To tackle this
issue, we present Prism, an innovative framework designed to disentangle the
perception and reasoning processes involved in visual question solving. Prism
comprises two distinct stages: a perception stage that utilizes a VLM to
extract and articulate visual information in textual form, and a reasoning
stage that formulates responses based on the extracted visual information using
a Large Language Model (LLM). This modular design enables the systematic
comparison and assessment of both proprietary and open-source VLM for their
perception and reasoning strengths. Our analytical framework provides several
valuable insights, underscoring Prism's potential as a cost-effective solution
for vision-language tasks. By combining a streamlined VLM focused on perception
with a powerful LLM tailored for reasoning, Prism achieves superior results in
general vision-language tasks while substantially cutting down on training and
operational expenses. Quantitative evaluations show that Prism, when configured
with a vanilla 2B LLaVA and freely accessible GPT-3.5, delivers performance on
par with VLMs $10 \times$ larger on the rigorous multimodal benchmark MMStar.
The project is released at: https://github.com/SparksJoe/Prism. 

","Prism is a framework designed to disentangle the perception and reasoning processes involved in visual question solving by breaking down these tasks into two distinct stages: a perception stage that extracts and represents visual information in textual form using a VLM, and a reasoning stage where responses are formulated based on this visual information using a Large Language Model (LLM). This modular design facilitates the systematic comparison of both proprietary and open-source VLMs for their strengths in perception.","abs-2406.14544v1, abs-2402.04236v2, abs-2403.09333v1, abs-2403.06199v4","[""Summary: Vision Language Models (VLMs) demonstrate remarkable proficiency in addressing a wide array of visual questions, which requires strong perception and reasoning faculties. Assessing these two competencies independently is crucial for model refinement, despite the inherent difficulty due to the intertwined nature of seeing and reasoning in existing VLMs. To tackle this issue, we present Prism, an innovative framework designed to disentangle the perception and reasoning processes involved in visual question solving. Prism comprises two distinct stages: a perception stage that utilizes a VLM to extract and articulate visual information in textual form, and a reasoning stage that formulates responses based on the extracted visual information using a Large Language Model (LLM). This modular design enables the systematic comparison and assessment of both proprietary and open-source VLM for their perception and reasoning strengths. Our analytical framework provides several valuable"", ""assessment of both proprietary and open-source VLM for their perception and reasoning strengths. Our analytical framework provides several valuable insights, underscoring Prism's potential as a cost-effective solution for vision-language tasks. By combining a streamlined VLM focused on perception with a powerful LLM tailored for reasoning, Prism achieves superior results in general vision-language tasks while substantially cutting down on training and operational expenses. Quantitative evaluations show that Prism, when configured with a vanilla 2B LLaVA and freely accessible GPT-3.5, delivers performance on par with VLMs $10 \\times$ larger on the rigorous multimodal benchmark MMStar. The project is released at: https://github.com/SparksJoe/Prism."", ""Summary: Vision-Language Models (VLMs) have demonstrated their broad effectiveness thanks to extensive training in aligning visual instructions to responses. However, such training of conclusive alignment leads models to ignore essential visual reasoning, further resulting in failures in meticulous visual problems and unfaithful responses. Drawing inspiration from human cognition in solving visual problems (e.g., marking, zoom in), this paper introduces Chain of Manipulations, a mechanism that enables VLMs to solve problems step-by-step with evidence. After training, models can solve various visual problems by eliciting intrinsic manipulations (e.g., grounding, zoom in) with results (e.g., boxes, image) actively without involving external tools, while also allowing users to trace error causes. We study the roadmap to implement this mechanism, including (1) a flexible design of manipulations upon extensive analysis, (2) an efficient automated data generation pipeline, (3) a compatible"", ""Summary: Large Vision Language Models have achieved fine-grained object perception, but the limitation of image resolution remains a significant obstacle to surpass the performance of task-specific experts in complex and dense scenarios. Such limitation further restricts the model's potential to achieve nuanced visual and language referring in domains such as GUI Agents, Counting and \\etc. To address this issue, we introduce a unified high-resolution generalist model, Griffon v2, enabling flexible object referring with visual and textual prompts. To efficiently scaling up image resolution, we design a simple and lightweight down-sampling projector to overcome the input tokens constraint in Large Language Models. This design inherently preserves the complete contexts and fine details, and significantly improves multimodal perception ability especially for small objects. Building upon this, we further equip the model with visual-language co-referring capabilities through a plug-and-play"", ""Summary: Multimodal Large Language Models (MLLMs) have showcased impressive skills in tasks related to visual understanding and reasoning. Yet, their widespread application faces obstacles due to the high computational demands during both the training and inference phases, restricting their use to a limited audience within the research and user communities. In this paper, we investigate the design aspects of Multimodal Small Language Models (MSLMs) and propose an efficient multimodal assistant named Mipha, which is designed to create synergy among various aspects: visual representation, language models, and optimization strategies. We show that without increasing the volume of training data, our Mipha-3B outperforms the state-of-the-art large MLLMs, especially LLaVA-1.5-13B, on multiple benchmarks. Through detailed discussion, we provide insights and guidelines for developing strong MSLMs that rival the capabilities of MLLMs. Our code is available at""]"
"According to the Broiler-Net paper, what are the two specific abnormal chicken behaviors investigated?",abs-2401.12176v1,Direct Fact Retrieval & Definition,"Title: Broiler-Net: A Deep Convolutional Framework for Broiler Behavior
  Analysis in Poultry Houses 
Summary: Detecting anomalies in poultry houses is crucial for maintaining optimal
chicken health conditions, minimizing economic losses and bolstering
profitability. This paper presents a novel real-time framework for analyzing
chicken behavior in cage-free poultry houses to detect abnormal behaviors.
Specifically, two significant abnormalities, namely inactive broiler and
huddling behavior, are investigated in this study. The proposed framework
comprises three key steps: (1) chicken detection utilizing a state-of-the-art
deep learning model, (2) tracking individual chickens across consecutive frames
with a fast tracker module, and (3) detecting abnormal behaviors within the
video stream. Experimental studies are conducted to evaluate the efficacy of
the proposed algorithm in accurately assessing chicken behavior. The results
illustrate that our framework provides a precise and efficient solution for
real-time anomaly detection, facilitating timely interventions to maintain
chicken health and enhance overall productivity on poultry farms. Github:
https://github.com/TaherehZarratEhsan/Chicken-Behavior-Analysis 

",The Broiler-Net paper investigates two specific abnormal chicken behaviors in cage-free poultry houses: inactive broilers and huddling behavior.,"abs-2401.12176v1, abs-2401.12665v2, abs-2406.11772v1, abs-2401.04575v2","[""Summary: Detecting anomalies in poultry houses is crucial for maintaining optimal chicken health conditions, minimizing economic losses and bolstering profitability. This paper presents a novel real-time framework for analyzing chicken behavior in cage-free poultry houses to detect abnormal behaviors. Specifically, two significant abnormalities, namely inactive broiler and huddling behavior, are investigated in this study. The proposed framework comprises three key steps: (1) chicken detection utilizing a state-of-the-art deep learning model, (2) tracking individual chickens across consecutive frames with a fast tracker module, and (3) detecting abnormal behaviors within the video stream. Experimental studies are conducted to evaluate the efficacy of the proposed algorithm in accurately assessing chicken behavior. The results illustrate that our framework provides a precise and efficient solution for real-time anomaly detection, facilitating timely interventions to maintain chicken"", ""that our framework provides a precise and efficient solution for real-time anomaly detection, facilitating timely interventions to maintain chicken health and enhance overall productivity on poultry farms. Github: https://github.com/TaherehZarratEhsan/Chicken-Behavior-Analysis"", ""Title: ClipSAM: CLIP and SAM Collaboration for Zero-Shot Anomaly Segmentation.\nPublished_date: 2024-01-23."", ""The TDLI-PIV methodology is able to capture fine-grained patterns in timber and, moreover, boosts robustness and prediction accuracy via a collaborative voting inference process.   In this work we also introduce a new data set of marcroscopic images of timber, called GOIMAI-Phase-I, which has been obtained using optical magnification in order to capture fine-grained details, which contrasts to the other datasets that are publicly available. More concretely, images in GOIMAI-Phase-I are taken with a smartphone with a 24x magnifying lens attached to the camera. Our data set contains 2120 images of timber and covers 37 legally protected wood species.   Our experiments have assessed the performance of the TDLI-PIV methodology, involving the comparison with other methodologies available in the literature, exploration of data augmentation methods and the effect that the dataset size has on the accuracy of TDLI-PIV."", ""Title: Let's Go Shopping (LGS) -- Web-Scale Image-Text Dataset for Visual\n  Concept Understanding.\nPublished_date: 2024-01-09.""]"
What four components are integrated within the Mix-SSM blocks of the InsectMamba model?,abs-2404.03611v1,Direct Fact Retrieval & Definition,"Title: InsectMamba: Insect Pest Classification with State Space Model 
Summary: The classification of insect pests is a critical task in agricultural
technology, vital for ensuring food security and environmental sustainability.
However, the complexity of pest identification, due to factors like high
camouflage and species diversity, poses significant obstacles. Existing methods
struggle with the fine-grained feature extraction needed to distinguish between
closely related pest species. Although recent advancements have utilized
modified network structures and combined deep learning approaches to improve
accuracy, challenges persist due to the similarity between pests and their
surroundings. To address this problem, we introduce InsectMamba, a novel
approach that integrates State Space Models (SSMs), Convolutional Neural
Networks (CNNs), Multi-Head Self-Attention mechanism (MSA), and Multilayer
Perceptrons (MLPs) within Mix-SSM blocks. This integration facilitates the
extraction of comprehensive visual features by leveraging the strengths of each
encoding strategy. A selective module is also proposed to adaptively aggregate
these features, enhancing the model's ability to discern pest characteristics.
InsectMamba was evaluated against strong competitors across five insect pest
classification datasets. The results demonstrate its superior performance and
verify the significance of each model component by an ablation study. 

","InsectMamba integrates State Space Models (SSMs), Convolutional Neural Networks (CNNs), Multi-Head Self-Attention mechanism (MSA), and Multilayer Perceptrons (MLPs) within Mix-SSM blocks to facilitate comprehensive visual feature extraction.","abs-2404.03611v1, abs-2406.16333v1, abs-2406.16638v1, abs-2401.01970v2","[""(MLPs) within Mix-SSM blocks. This integration facilitates the extraction of comprehensive visual features by leveraging the strengths of each encoding strategy. A selective module is also proposed to adaptively aggregate these features, enhancing the model's ability to discern pest characteristics. InsectMamba was evaluated against strong competitors across five insect pest classification datasets. The results demonstrate its superior performance and verify the significance of each model component by an ablation study."", ""Summary: The classification of insect pests is a critical task in agricultural technology, vital for ensuring food security and environmental sustainability. However, the complexity of pest identification, due to factors like high camouflage and species diversity, poses significant obstacles. Existing methods struggle with the fine-grained feature extraction needed to distinguish between closely related pest species. Although recent advancements have utilized modified network structures and combined deep learning approaches to improve accuracy, challenges persist due to the similarity between pests and their surroundings. To address this problem, we introduce InsectMamba, a novel approach that integrates State Space Models (SSMs), Convolutional Neural Networks (CNNs), Multi-Head Self-Attention mechanism (MSA), and Multilayer Perceptrons (MLPs) within Mix-SSM blocks. This integration facilitates the extraction of comprehensive visual features by leveraging the strengths of each"", ""Title: Prompt-Consistency Image Generation (PCIG): A Unified Framework\n  Integrating LLMs, Knowledge Graphs, and Controllable Diffusion Models.\nPublished_date: 2024-06-24."", ""Title: Feature Fusion for Human Activity Recognition using Parameter-Optimized\n  Multi-Stage Graph Convolutional Network and Transformer Models.\nPublished_date: 2024-06-24."", ""Summary: Precisely perceiving the geometric and semantic properties of real-world 3D objects is crucial for the continued evolution of augmented reality and robotic applications. To this end, we present Foundation Model Embedded Gaussian Splatting (FMGS), which incorporates vision-language embeddings of foundation models into 3D Gaussian Splatting (GS). The key contribution of this work is an efficient method to reconstruct and represent 3D vision-language models. This is achieved by distilling feature maps generated from image-based foundation models into those rendered from our 3D model. To ensure high-quality rendering and fast training, we introduce a novel scene representation by integrating strengths from both GS and multi-resolution hash encodings (MHE). Our effective training procedure also introduces a pixel alignment loss that makes the rendered feature distance of the same semantic entities close, following the pixel-level semantic boundaries. Our results demonstrate""]"
What does ELRT stand for in the context of training compact convolutional neural networks?,abs-2401.10341v1,Direct Fact Retrieval & Definition,"Title: ELRT: Efficient Low-Rank Training for Compact Convolutional Neural
  Networks 
Summary: Low-rank compression, a popular model compression technique that produces
compact convolutional neural networks (CNNs) with low rankness, has been
well-studied in the literature. On the other hand, low-rank training, as an
alternative way to train low-rank CNNs from scratch, has been exploited little
yet. Unlike low-rank compression, low-rank training does not need pre-trained
full-rank models, and the entire training phase is always performed on the
low-rank structure, bringing attractive benefits for practical applications.
However, the existing low-rank training solutions still face several
challenges, such as a considerable accuracy drop and/or still needing to update
full-size models during the training. In this paper, we perform a systematic
investigation on low-rank CNN training. By identifying the proper low-rank
format and performance-improving strategy, we propose ELRT, an efficient
low-rank training solution for high-accuracy, high-compactness, low-rank CNN
models. Our extensive evaluation results for training various CNNs on different
datasets demonstrate the effectiveness of ELRT. 

","ELRT stands for Efficient Low-Rank Training, a method used to efficiently train compact Convolutional Neural Networks.","abs-2401.10341v1, abs-2401.12862v2, abs-2403.13206v2, abs-2403.06168v2, abs-2402.16050v2","[""Title: ELRT: Efficient Low-Rank Training for Compact Convolutional Neural\n  Networks.\nPublished_date: 2024-01-18."", ""prediction of points at every timestamp can be supervised by its subsequent future multi-modality observation. Another key component of FedRSU is federated learning, where multiple devices collaboratively train an ML model while keeping the training data local and private. With the power of the recurrent self-supervised learning paradigm, FL is able to leverage innumerable underutilized data from RSU. To verify the FedRSU framework, we construct a large-scale multi-modality dataset RSU-SF. The dataset consists of 17 RSU clients, covering various scenarios, modalities, and sensor settings. Based on RSU-SF, we show that FedRSU can greatly improve model performance in ITS and provide a comprehensive benchmark under diverse FL scenarios. To the best of our knowledge, we provide the first real-world LiDAR-camera multi-modal dataset and benchmark for the FL community."", ""Title: Depth-guided NeRF Training via Earth Mover's Distance.\nPublished_date: 2024-03-19."", ""Summary: Due to the difficulty and labor-consuming nature of getting highly accurate or matting annotations, there only exists a limited amount of highly accurate labels available to the public. To tackle this challenge, we propose a DiffuMatting which inherits the strong Everything generation ability of diffusion and endows the power of \""matting anything\"". Our DiffuMatting can 1). act as an anything matting factory with high accurate annotations 2). be well-compatible with community LoRAs or various conditional control approaches to achieve the community-friendly art design and controllable generation. Specifically, inspired by green-screen-matting, we aim to teach the diffusion model to paint on a fixed green screen canvas. To this end, a large-scale greenscreen dataset (Green100K) is collected as a training dataset for DiffuMatting. Secondly, a green background control loss is proposed to keep the drawing board as a pure green color to distinguish the foreground and background. To"", ""that bridges our model with pluggable MLLMs without requiring annotation. We validate TGB across seven video benchmarks and demonstrate substantial performance improvements compared with prior MLLMs. Notably, our model, initially trained on sequences of four frames, effectively handles sequences up to 16 longer without sacrificing performance, highlighting its scalability and effectiveness in real-world applications. Our code is publicly available at https://github.com/bigai-nlco/VideoTGB""]"
What is the primary purpose of the AllSpark framework in the context of semi-supervised semantic segmentation?,abs-2403.01818v3,Summarization / Purpose Identification,"Title: AllSpark: Reborn Labeled Features from Unlabeled in Transformer for
  Semi-Supervised Semantic Segmentation 
Summary: Semi-supervised semantic segmentation (SSSS) has been proposed to alleviate
the burden of time-consuming pixel-level manual labeling, which leverages
limited labeled data along with larger amounts of unlabeled data. Current
state-of-the-art methods train the labeled data with ground truths and
unlabeled data with pseudo labels. However, the two training flows are
separate, which allows labeled data to dominate the training process, resulting
in low-quality pseudo labels and, consequently, sub-optimal results. To
alleviate this issue, we present AllSpark, which reborns the labeled features
from unlabeled ones with the channel-wise cross-attention mechanism. We further
introduce a Semantic Memory along with a Channel Semantic Grouping strategy to
ensure that unlabeled features adequately represent labeled features. The
AllSpark shed new light on the architecture level designs of SSSS rather than
framework level, which avoids increasingly complicated training pipeline
designs. It can also be regarded as a flexible bottleneck module that can be
seamlessly integrated into a general transformer-based segmentation model. The
proposed AllSpark outperforms existing methods across all evaluation protocols
on Pascal, Cityscapes and COCO benchmarks without bells-and-whistles. Code and
model weights are available at: https://github.com/xmed-lab/AllSpark. 

","The AllSpark framework aims to alleviate the issue where labeled data dominates training, leading to suboptimal results. It achieves this by reusing and enhancing features from unlabeled data through a channel-wise cross-attention mechanism, thereby ensuring that unlabeled features adequately represent those of the labeled data, improving overall performance in semi-supervised semantic segmentation.","abs-2403.01818v3, abs-2401.12164v1, abs-2404.06177v2","[""Summary: Semi-supervised semantic segmentation (SSSS) has been proposed to alleviate the burden of time-consuming pixel-level manual labeling, which leverages limited labeled data along with larger amounts of unlabeled data. Current state-of-the-art methods train the labeled data with ground truths and unlabeled data with pseudo labels. However, the two training flows are separate, which allows labeled data to dominate the training process, resulting in low-quality pseudo labels and, consequently, sub-optimal results. To alleviate this issue, we present AllSpark, which reborns the labeled features from unlabeled ones with the channel-wise cross-attention mechanism. We further introduce a Semantic Memory along with a Channel Semantic Grouping strategy to ensure that unlabeled features adequately represent labeled features. The AllSpark shed new light on the architecture level designs of SSSS rather than framework level, which avoids increasingly complicated training pipeline designs."", ""Summary: Image segmentation is a clustering task whereby each pixel is assigned a cluster label. Remote sensing data usually consists of multiple bands of spectral images in which there exist semantically meaningful land cover subregions, co-registered with other source data such as LIDAR (LIght Detection And Ranging) data, where available. This suggests that, in order to account for spatial correlation between pixels, a feature vector associated with each pixel may be a vectorized tensor representing the multiple bands and a local patch as appropriate. Similarly, multiple types of texture features based on a pixel's local patch would also be beneficial for encoding locally statistical information and spatial variations, without necessarily labelling pixel-wise a large amount of ground truth, then training a supervised model, which is sometimes impractical. In this work, by resorting to label only a small quantity of pixels, a new semi-supervised segmentation approach is proposed."", ""Title: Semi-supervised segmentation of land cover images using nonlinear\n  canonical correlation analysis with multiple features and t-SNE.\nPublished_date: 2024-01-22."", ""sometimes impractical. In this work, by resorting to label only a small quantity of pixels, a new semi-supervised segmentation approach is proposed. Initially, over all pixels, an image data matrix is created in high dimensional feature space. Then, t-SNE projects the high dimensional data onto 3D embedding. By using radial basis functions as input features, which use the labelled data samples as centres, to pair with the output class labels, a modified canonical correlation analysis algorithm, referred to as RBF-CCA, is introduced which learns the associated projection matrix via the small labelled data set. The associated canonical variables, obtained for the full image, are applied by k-means clustering algorithm. The proposed semi-supervised RBF-CCA algorithm has been implemented on several remotely sensed multispectral images, demonstrating excellent segmentation results."", ""Title: Uncertainty-aware Evidential Fusion-based Learning for Semi-supervised\n  Medical Image Segmentation.\nPublished_date: 2024-04-09.""]"
