Question,Source Article Index,Question Type,Summary,qwen2.5:3b,documentIDs,context_retrieved
Summarize the main problem that the survey on 'Noisy Label Processing for Classification' addresses.,abs-2404.04159v1,Summarization / Purpose Identification,"Title: Noisy Label Processing for Classification: A Survey 
Summary: In recent years, deep neural networks (DNNs) have gained remarkable
achievement in computer vision tasks, and the success of DNNs often depends
greatly on the richness of data. However, the acquisition process of data and
high-quality ground truth requires a lot of manpower and money. In the long,
tedious process of data annotation, annotators are prone to make mistakes,
resulting in incorrect labels of images, i.e., noisy labels. The emergence of
noisy labels is inevitable. Moreover, since research shows that DNNs can easily
fit noisy labels, the existence of noisy labels will cause significant damage
to the model training process. Therefore, it is crucial to combat noisy labels
for computer vision tasks, especially for classification tasks. In this survey,
we first comprehensively review the evolution of different deep learning
approaches for noisy label combating in the image classification task. In
addition, we also review different noise patterns that have been proposed to
design robust algorithms. Furthermore, we explore the inner pattern of
real-world label noise and propose an algorithm to generate a synthetic label
noise pattern guided by real-world data. We test the algorithm on the
well-known real-world dataset CIFAR-10N to form a new real-world data-guided
synthetic benchmark and evaluate some typical noise-robust methods on the
benchmark. 

","The survey on ""Noisy Label Processing for Classification"" addresses the issue of obtaining highly accurate or consistent labels due to the difficulty and labor-intensive nature of acquiring such data, leading to a limited availability of high-quality annotations for training machine learning models.","abs-2404.04159v1, abs-2403.06168v2, abs-2401.12513v2, abs-2401.11814v1, abs-2406.15329v1","[""Title: Noisy Label Processing for Classification: A Survey.\nPublished_date: 2024-04-05."", ""Summary: Due to the difficulty and labor-consuming nature of getting highly accurate or matting annotations, there only exists a limited amount of highly accurate labels available to the public. To tackle this challenge, we propose a DiffuMatting which inherits the strong Everything generation ability of diffusion and endows the power of \""matting anything\"". Our DiffuMatting can 1). act as an anything matting factory with high accurate annotations 2). be well-compatible with community LoRAs or various conditional control approaches to achieve the community-friendly art design and controllable generation. Specifically, inspired by green-screen-matting, we aim to teach the diffusion model to paint on a fixed green screen canvas. To this end, a large-scale greenscreen dataset (Green100K) is collected as a training dataset for DiffuMatting. Secondly, a green background control loss is proposed to keep the drawing board as a pure green color to distinguish the foreground and background. To"", ""the detection challenge with a mean average precision (mAP) of 51.4%. At the more relaxed intersection over union threshold of 0.5, we achieved the highest mean average precision and mean average recall results for both detection and classification.   Conclusion: The results demonstrate the potential for these techniques for automated character recognition on historical manuscripts. We ran the prediction pipeline on more than 4,500 images from the Oxyrhynchus Papyri to illustrate the utility of our approach, and we release the results publicly in multiple formats."", ""Summary: This paper presents an annotated dataset of brain MRI images designed to advance the field of brain symmetry study. Magnetic resonance imaging (MRI) has gained interest in analyzing brain symmetry in neonatal infants, and challenges remain due to the vast size differences between fetal and adult brains. Classification methods for brain structural MRI use scales and visual cues to assess hemisphere symmetry, which can help diagnose neonatal patients by comparing hemispheres and anatomical regions of interest in the brain. Using the Developing Human Connectome Project dataset, this work presents a dataset comprising cerebral images extracted as slices across selected portions of interest for clinical evaluation . All the extracted images are annotated with the brain's midline. All the extracted images are annotated with the brain's midline. From the assumption that a decrease in symmetry is directly related to possible clinical pathologies, the dataset can contribute to a more"", ""Summary: An end-to-end, segmentation-free, deep learning model trained from scratch is proposed, leveraging DCNN for feature extraction, alongside Bidirectional Long-Short Term Memory (BLSTM) for sequence recognition and Connectionist Temporal Classification (CTC) loss function on the KHATT database. The training phase yields remarkable results 84% recognition rate on the test dataset at the character level and 71% on the word level, establishing an image-based sequence recognition framework that operates without segmentation only at the line level. The analysis and preprocessing of the KFUPM Handwritten Arabic TexT (KHATT) database are also presented. Finally, advanced image processing techniques, including filtering, transformation, and line segmentation are implemented. The importance of this work is highlighted by its wide-ranging applications. Including digitizing, documentation, archiving, and text translation in fields such as banking. Moreover, AHR serves as a pivotal tool for""]"
What is the core objective of the Griffon v2 model?,abs-2403.09333v1,Summarization / Purpose Identification,"Title: Griffon v2: Advancing Multimodal Perception with High-Resolution Scaling
  and Visual-Language Co-Referring 
Summary: Large Vision Language Models have achieved fine-grained object perception,
but the limitation of image resolution remains a significant obstacle to
surpass the performance of task-specific experts in complex and dense
scenarios. Such limitation further restricts the model's potential to achieve
nuanced visual and language referring in domains such as GUI Agents, Counting
and \etc. To address this issue, we introduce a unified high-resolution
generalist model, Griffon v2, enabling flexible object referring with visual
and textual prompts. To efficiently scaling up image resolution, we design a
simple and lightweight down-sampling projector to overcome the input tokens
constraint in Large Language Models. This design inherently preserves the
complete contexts and fine details, and significantly improves multimodal
perception ability especially for small objects. Building upon this, we further
equip the model with visual-language co-referring capabilities through a
plug-and-play visual tokenizer. It enables user-friendly interaction with
flexible target images, free-form texts and even coordinates. Experiments
demonstrate that Griffon v2 can localize any objects of interest with visual
and textual referring, achieve state-of-the-art performance on REC, phrase
grounding, and REG tasks, and outperform expert models in object detection and
object counting. Data, codes and models will be released at
https://github.com/jefferyZhan/Griffon. 

","The core objective of the Griffon v2 model is to localize any objects of interest with visual and textual references, achieving state-of-the-art performance on tasks such as recognition-extraction-geolocation (REC), phrase grounding, and region-extraction-grounding (REG). It also outperforms expert models in object detection and counting.","abs-2403.09333v1, abs-2406.14544v1, abs-2406.11772v1, abs-2403.06168v2","[""Title: Griffon v2: Advancing Multimodal Perception with High-Resolution Scaling\n  and Visual-Language Co-Referring.\nPublished_date: 2024-03-14."", ""especially for small objects. Building upon this, we further equip the model with visual-language co-referring capabilities through a plug-and-play visual tokenizer. It enables user-friendly interaction with flexible target images, free-form texts and even coordinates. Experiments demonstrate that Griffon v2 can localize any objects of interest with visual and textual referring, achieve state-of-the-art performance on REC, phrase grounding, and REG tasks, and outperform expert models in object detection and object counting. Data, codes and models will be released at https://github.com/jefferyZhan/Griffon."", ""Title: Prism: A Framework for Decoupling and Assessing the Capabilities of VLMs.\nPublished_date: 2024-06-20."", ""The TDLI-PIV methodology is able to capture fine-grained patterns in timber and, moreover, boosts robustness and prediction accuracy via a collaborative voting inference process.   In this work we also introduce a new data set of marcroscopic images of timber, called GOIMAI-Phase-I, which has been obtained using optical magnification in order to capture fine-grained details, which contrasts to the other datasets that are publicly available. More concretely, images in GOIMAI-Phase-I are taken with a smartphone with a 24x magnifying lens attached to the camera. Our data set contains 2120 images of timber and covers 37 legally protected wood species.   Our experiments have assessed the performance of the TDLI-PIV methodology, involving the comparison with other methodologies available in the literature, exploration of data augmentation methods and the effect that the dataset size has on the accuracy of TDLI-PIV."", ""Summary: Due to the difficulty and labor-consuming nature of getting highly accurate or matting annotations, there only exists a limited amount of highly accurate labels available to the public. To tackle this challenge, we propose a DiffuMatting which inherits the strong Everything generation ability of diffusion and endows the power of \""matting anything\"". Our DiffuMatting can 1). act as an anything matting factory with high accurate annotations 2). be well-compatible with community LoRAs or various conditional control approaches to achieve the community-friendly art design and controllable generation. Specifically, inspired by green-screen-matting, we aim to teach the diffusion model to paint on a fixed green screen canvas. To this end, a large-scale greenscreen dataset (Green100K) is collected as a training dataset for DiffuMatting. Secondly, a green background control loss is proposed to keep the drawing board as a pure green color to distinguish the foreground and background. To""]"
What is the main goal of the 'Exploring Optical Flow Inclusion into nnU-Net Framework' study?,abs-2403.10216v1,Summarization / Purpose Identification,"Title: Exploring Optical Flow Inclusion into nnU-Net Framework for Surgical
  Instrument Segmentation 
Summary: Surgical instrument segmentation in laparoscopy is essential for
computer-assisted surgical systems. Despite the Deep Learning progress in
recent years, the dynamic setting of laparoscopic surgery still presents
challenges for precise segmentation. The nnU-Net framework excelled in semantic
segmentation analyzing single frames without temporal information. The
framework's ease of use, including its ability to be automatically configured,
and its low expertise requirements, have made it a popular base framework for
comparisons. Optical flow (OF) is a tool commonly used in video tasks to
estimate motion and represent it in a single frame, containing temporal
information. This work seeks to employ OF maps as an additional input to the
nnU-Net architecture to improve its performance in the surgical instrument
segmentation task, taking advantage of the fact that instruments are the main
moving objects in the surgical field. With this new input, the temporal
component would be indirectly added without modifying the architecture. Using
CholecSeg8k dataset, three different representations of movement were estimated
and used as new inputs, comparing them with a baseline model. Results showed
that the use of OF maps improves the detection of classes with high movement,
even when these are scarce in the dataset. To further improve performance,
future work may focus on implementing other OF-preserving augmentations. 

","The main goal of the ""Exploring Optical Flow Inclusion into nnU-Net Framework"" study is to improve surgical instrument segmentation in laparoscopic surgery by incorporating optical flow maps as an additional input to the nnU-Net architecture, leveraging their ability to represent temporal information and capturing the motion of instruments.","abs-2403.10216v1, abs-2406.02976v1, abs-2401.12862v2","[""Title: Exploring Optical Flow Inclusion into nnU-Net Framework for Surgical\n  Instrument Segmentation.\nPublished_date: 2024-03-15."", ""Summary: Surgical instrument segmentation in laparoscopy is essential for computer-assisted surgical systems. Despite the Deep Learning progress in recent years, the dynamic setting of laparoscopic surgery still presents challenges for precise segmentation. The nnU-Net framework excelled in semantic segmentation analyzing single frames without temporal information. The framework's ease of use, including its ability to be automatically configured, and its low expertise requirements, have made it a popular base framework for comparisons. Optical flow (OF) is a tool commonly used in video tasks to estimate motion and represent it in a single frame, containing temporal information. This work seeks to employ OF maps as an additional input to the nnU-Net architecture to improve its performance in the surgical instrument segmentation task, taking advantage of the fact that instruments are the main moving objects in the surgical field. With this new input, the temporal component would be"", ""Normalizing Flow (DA-Flow) integrates the DAM as a post-processing unit after GCN within the normalizing flow framework. Simulations show that the proposed model is robust against noise and negative samples. Experimental results show that DA-Flow reaches competitive or better performance than the existing state-of-the-art (SOTA) methods in terms of the micro AUC metric with the fewest number of parameters. Moreover, we found that even without training, simply using random projection without dimensionality reduction on skeleton data enables substantial anomaly detection capabilities."", ""Summary: Cooperation between temporal convolutional networks (TCN) and graph convolutional networks (GCN) as a processing module has shown promising results in skeleton-based video anomaly detection (SVAD). However, to maintain a lightweight model with low computational and storage complexity, shallow GCN and TCN blocks are constrained by small receptive fields and a lack of cross-dimension interaction capture. To tackle this limitation, we propose a lightweight module called the Dual Attention Module (DAM) for capturing cross-dimension interaction relationships in spatio-temporal skeletal data. It employs the frame attention mechanism to identify the most significant frames and the skeleton attention mechanism to capture broader relationships across fixed partitions with minimal parameters and flops. Furthermore, the proposed Dual Attention Normalizing Flow (DA-Flow) integrates the DAM as a post-processing unit after GCN within the normalizing flow framework. Simulations show that"", ""Summary: Roadside unit (RSU) can significantly improve the safety and robustness of autonomous vehicles through Vehicle-to-Everything (V2X) communication. Currently, the usage of a single RSU mainly focuses on real-time inference and V2X collaboration, while neglecting the potential value of the high-quality data collected by RSU sensors. Integrating the vast amounts of data from numerous RSUs can provide a rich source of data for model training. However, the absence of ground truth annotations and the difficulty of transmitting enormous volumes of data are two inevitable barriers to fully exploiting this hidden value. In this paper, we introduce FedRSU, an innovative federated learning framework for self-supervised scene flow estimation. In FedRSU, we present a recurrent self-supervision training paradigm, where for each RSU, the scene flow prediction of points at every timestamp can be supervised by its subsequent future multi-modality observation. Another key component of FedRSU is""]"
Compare the approaches for improving model performance in resource-constrained environments in ELRT (abs-2401.10341v1) and SaFF-Net (abs-2406.14038v2).,"abs-2401.10341v1,abs-2406.14038v2",Comparative & Contrastive,"Title: ELRT: Efficient Low-Rank Training for Compact Convolutional Neural
  Networks 
Summary: Low-rank compression, a popular model compression technique that produces
compact convolutional neural networks (CNNs) with low rankness, has been
well-studied in the literature. On the other hand, low-rank training, as an
alternative way to train low-rank CNNs from scratch, has been exploited little
yet. Unlike low-rank compression, low-rank training does not need pre-trained
full-rank models, and the entire training phase is always performed on the
low-rank structure, bringing attractive benefits for practical applications.
However, the existing low-rank training solutions still face several
challenges, such as a considerable accuracy drop and/or still needing to update
full-size models during the training. In this paper, we perform a systematic
investigation on low-rank CNN training. By identifying the proper low-rank
format and performance-improving strategy, we propose ELRT, an efficient
low-rank training solution for high-accuracy, high-compactness, low-rank CNN
models. Our extensive evaluation results for training various CNNs on different
datasets demonstrate the effectiveness of ELRT. 

Title: Resource-efficient Medical Image Analysis with Self-adapting
  Forward-Forward Networks 
Summary: We introduce a fast Self-adapting Forward-Forward Network (SaFF-Net) for
medical imaging analysis, mitigating power consumption and resource
limitations, which currently primarily stem from the prevalent reliance on
back-propagation for model training and fine-tuning. Building upon the recently
proposed Forward-Forward Algorithm (FFA), we introduce the Convolutional
Forward-Forward Algorithm (CFFA), a parameter-efficient reformulation that is
suitable for advanced image analysis and overcomes the speed and generalisation
constraints of the original FFA. To address hyper-parameter sensitivity of FFAs
we are also introducing a self-adapting framework SaFF-Net fine-tuning
parameters during warmup and training in parallel. Our approach enables more
effective model training and eliminates the previously essential requirement
for an arbitrarily chosen Goodness function in FFA. We evaluate our approach on
several benchmarking datasets in comparison with standard Back-Propagation (BP)
neural networks showing that FFA-based networks with notably fewer parameters
and function evaluations can compete with standard models, especially, in
one-shot scenarios and large batch sizes. The code will be available at the
time of the conference. 

","ELRT proposes an efficient low-rank training solution for high-accuracy, high-compactness CNN models without requiring a Goodness function. In contrast, SaFF-Net introduces the Convolutional Forward-Forward Algorithm (CFFA) to address speed and generalization constraints of the original Forward-Forward Algorithm (FFA), while also incorporating self-adapting parameters for more effective model training in resource-constrained environments.","abs-2406.14038v2, abs-2401.10341v1, abs-2403.13684v2, abs-2406.10973v2, abs-2403.05168v1","[""Summary: We introduce a fast Self-adapting Forward-Forward Network (SaFF-Net) for medical imaging analysis, mitigating power consumption and resource limitations, which currently primarily stem from the prevalent reliance on back-propagation for model training and fine-tuning. Building upon the recently proposed Forward-Forward Algorithm (FFA), we introduce the Convolutional Forward-Forward Algorithm (CFFA), a parameter-efficient reformulation that is suitable for advanced image analysis and overcomes the speed and generalisation constraints of the original FFA. To address hyper-parameter sensitivity of FFAs we are also introducing a self-adapting framework SaFF-Net fine-tuning parameters during warmup and training in parallel. Our approach enables more effective model training and eliminates the previously essential requirement for an arbitrarily chosen Goodness function in FFA. We evaluate our approach on several benchmarking datasets in comparison with standard Back-Propagation"", ""performance-improving strategy, we propose ELRT, an efficient low-rank training solution for high-accuracy, high-compactness, low-rank CNN models. Our extensive evaluation results for training various CNNs on different datasets demonstrate the effectiveness of ELRT."", ""evaluate our SPTNet on standard benchmarks and demonstrate that our method outperforms existing GCD methods. Notably, we find our method achieves an average accuracy of 61.4% on the SSB, surpassing prior state-of-the-art methods by approximately 10%. The improvement is particularly remarkable as our method yields extra parameters amounting to only 0.117% of those in the backbone architecture. Project page: https://visual-ai.github.io/sptnet."", ""blocks and tuning all other layers with LoRA. We then fine-tune the resulting model only with LoRA on this new domain for supervised learning. Our experiments demonstrate state-of-the-art results on satellite imagery, even outperforming fully pre-training and fine-tuning ViTs. Using the DinoV2 training objective, we demonstrate up to 7.5% improvement in linear probing top-1 accuracy on downstream tasks while using <10% of the number of parameters that are used in prior fully-tuned state-of-the art approaches. Our ablation studies confirm the efficacy of our approach over other baselines, including PEFT and unfreezing more ViT blocks. Code is available on the project website: https://samar-khanna.github.io/ExPLoRA/"", ""two levels, capturing more cross-modal details. The experiment results demonstrate significant improvements across various downstream tasks, with TOC contributing to an average improvement of 1.70% for DCID on four tasks, and H-DCID surpassing DCID by an average of 3.64%. The combination of TOC and H-DCID further enhances performance, exceeding DCID by 4.43%. These findings highlight the effectiveness of our methods in facilitating robust and nuanced cross-modal learning, opening avenues for future enhancements. The source code and pre-trained models can be accessed at https://github.com/haihuangcode/TOC_H-DCID.""]"
