Question,Source Article Index,Question Type,Summary,qwen2.5:3b,documentIDs,context_retrieved
Could the vine copula model from 'Retrospective Uncertainties for Deep Models' (abs-2302.12606v1) be used to improve the source reliability estimation in the RA-RAG framework (abs-2410.22954v1) by modeling dependencies between different information sources?,"abs-2302.12606v1,abs-2410.22954v1",Synthesis & Multi-Hop Reasoning,"Title: Retrospective Uncertainties for Deep Models using Vine Copulas 
Summary: Despite the major progress of deep models as learning machines, uncertainty
estimation remains a major challenge. Existing solutions rely on modified loss
functions or architectural changes. We propose to compensate for the lack of
built-in uncertainty estimates by supplementing any network, retrospectively,
with a subsequent vine copula model, in an overall compound we call Vine-Copula
Neural Network (VCNN). Through synthetic and real-data experiments, we show
that VCNNs could be task (regression/classification) and architecture
(recurrent, fully connected) agnostic while providing reliable and
better-calibrated uncertainty estimates, comparable to state-of-the-art
built-in uncertainty solutions. 

Title: Retrieval-Augmented Generation with Estimation of Source Reliability 
Summary: Retrieval-augmented generation (RAG) addresses key limitations of large
language models (LLMs), such as hallucinations and outdated knowledge, by
incorporating external databases. These databases typically consult multiple
sources to encompass up-to-date and various information. However, standard RAG
methods often overlook the heterogeneous source reliability in the multi-source
database and retrieve documents solely based on relevance, making them prone to
propagating misinformation. To address this, we propose Reliability-Aware RAG
(RA-RAG) which estimates the reliability of multiple sources and incorporates
this information into both retrieval and aggregation processes. Specifically,
it iteratively estimates source reliability and true answers for a set of
queries with no labelling. Then, it selectively retrieves relevant documents
from a few of reliable sources and aggregates them using weighted majority
voting, where the selective retrieval ensures scalability while not
compromising the performance. We also introduce a benchmark designed to reflect
real-world scenarios with heterogeneous source reliability and demonstrate the
effectiveness of RA-RAG compared to a set of baselines. 

","The vine copula model proposed in ""Retrospective Uncertainties for Deep Models"" could potentially enhance the RA-RAG framework's ability to estimate source reliability by modeling dependencies between different information sources, which might help in distinguishing reliable from unreliable sources. However, this direct application has not been discussed or demonstrated within the provided documents.","abs-2410.22954v1, abs-2302.12606v1, abs-2009.12326v2, abs-2106.01001v3","[""Summary: Retrieval-augmented generation (RAG) addresses key limitations of large language models (LLMs), such as hallucinations and outdated knowledge, by incorporating external databases. These databases typically consult multiple sources to encompass up-to-date and various information. However, standard RAG methods often overlook the heterogeneous source reliability in the multi-source database and retrieve documents solely based on relevance, making them prone to propagating misinformation. To address this, we propose Reliability-Aware RAG (RA-RAG) which estimates the reliability of multiple sources and incorporates this information into both retrieval and aggregation processes. Specifically, it iteratively estimates source reliability and true answers for a set of queries with no labelling. Then, it selectively retrieves relevant documents from a few of reliable sources and aggregates them using weighted majority voting, where the selective retrieval ensures scalability while not"", ""from a few of reliable sources and aggregates them using weighted majority voting, where the selective retrieval ensures scalability while not compromising the performance. We also introduce a benchmark designed to reflect real-world scenarios with heterogeneous source reliability and demonstrate the effectiveness of RA-RAG compared to a set of baselines."", ""Title: Retrospective Uncertainties for Deep Models using Vine Copulas.\nPublished_date: 2023-02-24.\nSummary: Despite the major progress of deep models as learning machines, uncertainty estimation remains a major challenge. Existing solutions rely on modified loss functions or architectural changes. We propose to compensate for the lack of built-in uncertainty estimates by supplementing any network, retrospectively, with a subsequent vine copula model, in an overall compound we call Vine-Copula Neural Network (VCNN). Through synthetic and real-data experiments, we show that VCNNs could be task (regression/classification) and architecture (recurrent, fully connected) agnostic while providing reliable and better-calibrated uncertainty estimates, comparable to state-of-the-art built-in uncertainty solutions."", ""fitting the copula model to online data, we also provide a new method to detect change points in the multivariate dependence structure with missing values. Experimental results on synthetic and real world data validate the performance of the proposed methods."", ""the network that can be reached through relevant input trajectories, in few gradient steps. We show on several information restitution, sequence classification, and reinforcement learning benchmarks that warming up greatly improves learning speed and performance, for multiple recurrent cells, but sometimes impedes precision. We therefore introduce a double-layer architecture initialised with a partial warmup that is shown to greatly improve learning of long time dependencies while maintaining high levels of precision. This approach provides a general framework for improving learning abilities of any recurrent cell when long time dependencies are present. We also show empirically that other initialisation and pretraining procedures from the literature implicitly foster reachable multistability of recurrent cells.""]"
"How could the theory of SPoC from 'DeepSPoC' (abs-2408.16403v1) be used to model the sequential decision process in 'Shuffle Private Linear Contextual Bandits' (abs-2202.05567v1), treating the shuffler's permutation as a form of stochastic particle interaction?","abs-2408.16403v1,abs-2202.05567v1",Synthesis & Multi-Hop Reasoning,"Title: DeepSPoC: A Deep Learning-Based PDE Solver Governed by Sequential
  Propagation of Chaos 
Summary: Sequential propagation of chaos (SPoC) is a recently developed tool to solve
mean-field stochastic differential equations and their related nonlinear
Fokker-Planck equations. Based on the theory of SPoC, we present a new method
(deepSPoC) that combines the interacting particle system of SPoC and deep
learning. Under the framework of deepSPoC, two classes of frequently used deep
models include fully connected neural networks and normalizing flows are
considered. For high-dimensional problems, spatial adaptive method are designed
to further improve the accuracy and efficiency of deepSPoC. We analysis the
convergence of the framework of deepSPoC under some simplified conditions and
also provide a posterior error estimation for the algorithm. Finally, we test
our methods on a wide range of different types of mean-field equations. 

Title: Shuffle Private Linear Contextual Bandits 
Summary: Differential privacy (DP) has been recently introduced to linear contextual
bandits to formally address the privacy concerns in its associated personalized
services to participating users (e.g., recommendations). Prior work largely
focus on two trust models of DP: the central model, where a central server is
responsible for protecting users sensitive data, and the (stronger) local
model, where information needs to be protected directly on user side. However,
there remains a fundamental gap in the utility achieved by learning algorithms
under these two privacy models, e.g., $\tilde{O}(\sqrt{T})$ regret in the
central model as compared to $\tilde{O}(T^{3/4})$ regret in the local model, if
all users are unique within a learning horizon $T$. In this work, we aim to
achieve a stronger model of trust than the central model, while suffering a
smaller regret than the local model by considering recently popular shuffle
model of privacy. We propose a general algorithmic framework for linear
contextual bandits under the shuffle trust model, where there exists a trusted
shuffler in between users and the central server, that randomly permutes a
batch of users data before sending those to the server. We then instantiate
this framework with two specific shuffle protocols: one relying on privacy
amplification of local mechanisms, and another incorporating a protocol for
summing vectors and matrices of bounded norms. We prove that both these
instantiations lead to regret guarantees that significantly improve on that of
the local model, and can potentially be of the order $\tilde{O}(T^{3/5})$ if
all users are unique. We also verify this regret behavior with simulations on
synthetic data. Finally, under the practical scenario of non-unique users, we
show that the regret of our shuffle private algorithm scale as
$\tilde{O}(T^{2/3})$, which matches that the central model could achieve in
this case. 

","The theory of Sequential Propagation of Chaos (SPoC) from ""DeepSPoC"" can be applied to model the sequential decision process in Shuffle Private Linear Contextual Bandits by considering the shuffler's permutations as stochastic interactions among particles. This approach leverages SPoC’s ability to solve mean-field problems, potentially enabling a more efficient and accurate modeling of the bandit environment where each permutation represents a unique interaction scenario.

However, it is important to note that while this framework can provide insights into how different permutations might influence outcomes, direct application without additional context or adaptations specific to the shuffle mechanism may not fully capture all nuances of the Shuffle Private Linear Contextual Bandits problem.","abs-2202.05567v1, abs-2408.16403v1, abs-2003.03426v2, abs-2002.08405v5, abs-2211.07387v1","[""Title: Shuffle Private Linear Contextual Bandits.\nPublished_date: 2022-02-11."", ""Title: DeepSPoC: A Deep Learning-Based PDE Solver Governed by Sequential\n  Propagation of Chaos.\nPublished_date: 2024-08-29.\nSummary: Sequential propagation of chaos (SPoC) is a recently developed tool to solve mean-field stochastic differential equations and their related nonlinear Fokker-Planck equations. Based on the theory of SPoC, we present a new method (deepSPoC) that combines the interacting particle system of SPoC and deep learning. Under the framework of deepSPoC, two classes of frequently used deep models include fully connected neural networks and normalizing flows are considered. For high-dimensional problems, spatial adaptive method are designed to further improve the accuracy and efficiency of deepSPoC. We analysis the convergence of the framework of deepSPoC under some simplified conditions and also provide a posterior error estimation for the algorithm. Finally, we test our methods on a wide range of different types of mean-field equations."", ""Title: Contextual Blocking Bandits.\nPublished_date: 2020-03-06."", ""Title: Bandits with Mean Bounds.\nPublished_date: 2020-02-19."", ""Title: Hypothesis Transfer in Bandits by Weighted Models.\nPublished_date: 2022-11-14.""]"
Can the low-rank bias induced by Weight Decay (abs-2410.02176v1) be used as a principle to guide the structured pruning in IAP or AIAP (abs-2201.09881v1) for better model compression?,"abs-2410.02176v1,abs-2201.09881v1",Synthesis & Multi-Hop Reasoning,"Title: Towards Better Generalization: Weight Decay Induces Low-rank Bias for
  Neural Networks 
Summary: We study the implicit bias towards low-rank weight matrices when training
neural networks (NN) with Weight Decay (WD). We prove that when a ReLU NN is
sufficiently trained with Stochastic Gradient Descent (SGD) and WD, its weight
matrix is approximately a rank-two matrix. Empirically, we demonstrate that WD
is a necessary condition for inducing this low-rank bias across both regression
and classification tasks. Our work differs from previous studies as our
theoretical analysis does not rely on common assumptions regarding the training
data distribution, optimality of weight matrices, or specific training
procedures. Furthermore, by leveraging the low-rank bias, we derive improved
generalization error bounds and provide numerical evidence showing that better
generalization can be achieved. Thus, our work offers both theoretical and
empirical insights into the strong generalization performance of SGD when
combined with WD. 

Title: Iterative Activation-based Structured Pruning 
Summary: Deploying complex deep learning models on edge devices is challenging because
they have substantial compute and memory resource requirements, whereas edge
devices' resource budget is limited. To solve this problem, extensive pruning
techniques have been proposed for compressing networks. Recent advances based
on the Lottery Ticket Hypothesis (LTH) show that iterative model pruning tends
to produce smaller and more accurate models. However, LTH research focuses on
unstructured pruning, which is hardware-inefficient and difficult to accelerate
on hardware platforms.
  In this paper, we investigate iterative pruning in the context of structured
pruning because structurally pruned models map well on commodity hardware. We
find that directly applying a structured weight-based pruning technique
iteratively, called iterative L1-norm based pruning (ILP), does not produce
accurate pruned models. To solve this problem, we propose two activation-based
pruning methods, Iterative Activation-based Pruning (IAP) and Adaptive
Iterative Activation-based Pruning (AIAP). We observe that, with only 1%
accuracy loss, IAP and AIAP achieve 7.75X and 15.88$X compression on LeNet-5,
and 1.25X and 1.71X compression on ResNet-50, whereas ILP achieves 4.77X and
1.13X, respectively. 

","No Answer. The provided documents do not contain information about Weight Decay, low-rank bias, or its relation to structured pruning methods such as IAP or AIAP.","abs-2209.04766v3, abs-2207.11048v1, abs-2201.09881v1, abs-2202.08070v3","[""Summary: As real-world graphs expand in size, larger GNN models with billions of parameters are deployed. High parameter count in such models makes training and inference on graphs expensive and challenging. To reduce the computational and memory costs of GNNs, optimization methods such as pruning the redundant nodes and edges in input graphs have been commonly adopted. However, model compression, which directly targets the sparsification of model layers, has been mostly limited to traditional Deep Neural Networks (DNNs) used for tasks such as image classification and object detection. In this paper, we utilize two state-of-the-art model compression methods (1) train and prune and (2) sparse training for the sparsification of weight layers in GNNs. We evaluate and compare the efficiency of both methods in terms of accuracy, training sparsity, and training FLOPs on real-world graphs. Our experimental results show that on the ia-email, wiki-talk, and stackoverflow datasets for link"", ""Title: Quantized Sparse Weight Decomposition for Neural Network Compression.\nPublished_date: 2022-07-22.\nSummary: In this paper, we introduce a novel method of neural network weight compression. In our method, we store weight tensors as sparse, quantized matrix factors, whose product is computed on the fly during inference to generate the target model's weights. We use projected gradient descent methods to find quantized and sparse factorization of the weight tensors. We show that this approach can be seen as a unification of weight SVD, vector quantization, and sparse PCA. Combined with end-to-end fine-tuning our method exceeds or is on par with previous state-of-the-art methods in terms of the trade-off between accuracy and model size. Our method is applicable to both moderate compression regimes, unlike vector quantization, and extreme compression regimes."", ""Summary: Deploying complex deep learning models on edge devices is challenging because they have substantial compute and memory resource requirements, whereas edge devices' resource budget is limited. To solve this problem, extensive pruning techniques have been proposed for compressing networks. Recent advances based on the Lottery Ticket Hypothesis (LTH) show that iterative model pruning tends to produce smaller and more accurate models. However, LTH research focuses on unstructured pruning, which is hardware-inefficient and difficult to accelerate on hardware platforms.   In this paper, we investigate iterative pruning in the context of structured pruning because structurally pruned models map well on commodity hardware. We find that directly applying a structured weight-based pruning technique iteratively, called iterative L1-norm based pruning (ILP), does not produce accurate pruned models. To solve this problem, we propose two activation-based pruning methods, Iterative"", ""based pruning (ILP), does not produce accurate pruned models. To solve this problem, we propose two activation-based pruning methods, Iterative Activation-based Pruning (IAP) and Adaptive Iterative Activation-based Pruning (AIAP). We observe that, with only 1% accuracy loss, IAP and AIAP achieve 7.75X and 15.88$X compression on LeNet-5, and 1.25X and 1.71X compression on ResNet-50, whereas ILP achieves 4.77X and 1.13X, respectively."", ""amount of excess capacity per task, and (2) capacity can be kept at a surprisingly similar level across tasks. Overall, this suggests a notion of compressibility with respect to weight norms, complementary to classic compression via weight pruning. Source code is available at https://github.com/rkwitt/excess_capacity.""]"
"Considering the challenges of out-of-distribution detection in satellite images (abs-2104.05442v1), could the Invariant-feature Subspace Recovery (ISR) methods (abs-2201.12919v2) be applied to identify and separate geographic features (invariant) from sensor-specific artifacts (spurious)?","abs-2104.05442v1,abs-2201.12919v2",Synthesis & Multi-Hop Reasoning,"Title: Out-of-distribution detection in satellite image classification 
Summary: In satellite image analysis, distributional mismatch between the training and
test data may arise due to several reasons, including unseen classes in the
test data and differences in the geographic area. Deep learning based models
may behave in unexpected manner when subjected to test data that has such
distributional shifts from the training data, also called out-of-distribution
(OOD) examples. Predictive uncertainly analysis is an emerging research topic
which has not been explored much in context of satellite image analysis.
Towards this, we adopt a Dirichlet Prior Network based model to quantify
distributional uncertainty of deep learning models for remote sensing. The
approach seeks to maximize the representation gap between the in-domain and OOD
examples for a better identification of unknown examples at test time.
Experimental results on three exemplary test scenarios show the efficacy of the
model in satellite image analysis. 

Title: Provable Domain Generalization via Invariant-Feature Subspace Recovery 
Summary: Domain generalization asks for models trained over a set of training
environments to perform well in unseen test environments. Recently, a series of
algorithms such as Invariant Risk Minimization (IRM) has been proposed for
domain generalization. However, Rosenfeld et al. (2021) shows that in a simple
linear data model, even if non-convexity issues are ignored, IRM and its
extensions cannot generalize to unseen environments with less than $d_s+1$
training environments, where $d_s$ is the dimension of the spurious-feature
subspace. In this paper, we propose to achieve domain generalization with
Invariant-feature Subspace Recovery (ISR). Our first algorithm, ISR-Mean, can
identify the subspace spanned by invariant features from the first-order
moments of the class-conditional distributions, and achieve provable domain
generalization with $d_s+1$ training environments under the data model of
Rosenfeld et al. (2021). Our second algorithm, ISR-Cov, further reduces the
required number of training environments to $O(1)$ using the information of
second-order moments. Notably, unlike IRM, our algorithms bypass non-convexity
issues and enjoy global convergence guarantees. Empirically, our ISRs can
obtain superior performance compared with IRM on synthetic benchmarks. In
addition, on three real-world image and text datasets, we show that both ISRs
can be used as simple yet effective post-processing methods to improve the
worst-case accuracy of (pre-)trained models against spurious correlations and
group shifts. 

","The ISR methods proposed in the document ""Invariant-Feature Subspace Recovery"" can potentially identify the subspace spanned by invariant features from the first-order moments of class-conditional distributions, which suggests they could be applied to distinguish between geographic features that are invariant across different training environments and sensor-specific artifacts that are spurious. However, their effectiveness would depend on the specific data model and the dimensionality of the spurious-feature subspace for the given dataset.","abs-2201.12919v2, abs-2210.12638v1, abs-2408.14331v1, abs-2106.01001v3","[""Title: Provable Domain Generalization via Invariant-Feature Subspace Recovery.\nPublished_date: 2022-01-30."", ""Summary: Domain generalization asks for models trained over a set of training environments to perform well in unseen test environments. Recently, a series of algorithms such as Invariant Risk Minimization (IRM) has been proposed for domain generalization. However, Rosenfeld et al. (2021) shows that in a simple linear data model, even if non-convexity issues are ignored, IRM and its extensions cannot generalize to unseen environments with less than $d_s+1$ training environments, where $d_s$ is the dimension of the spurious-feature subspace. In this paper, we propose to achieve domain generalization with Invariant-feature Subspace Recovery (ISR). Our first algorithm, ISR-Mean, can identify the subspace spanned by invariant features from the first-order moments of the class-conditional distributions, and achieve provable domain generalization with $d_s+1$ training environments under the data model of Rosenfeld et al. (2021). Our second algorithm, ISR-Cov, further reduces the required"", ""Title: Tucker-O-Minus Decomposition for Multi-view Tensor Subspace Clustering.\nPublished_date: 2022-10-23."", ""ensemble pipelines, and customized loss functions. These features are designed to address the unique challenges of the insurance domain, including the imbalanced nature of common insurance datasets. The full code and documentation are available on the GitHub repository. (https://github.com/PanyiDong/InsurAutoML)"", ""Summary: Training recurrent neural networks is known to be difficult when time dependencies become long. In this work, we show that most standard cells only have one stable equilibrium at initialisation, and that learning on tasks with long time dependencies generally occurs once the number of network stable equilibria increases; a property known as multistability. Multistability is often not easily attained by initially monostable networks, making learning of long time dependencies between inputs and outputs difficult. This insight leads to the design of a novel way to initialise any recurrent cell connectivity through a procedure called \""warmup\"" to improve its capability to learn arbitrarily long time dependencies. This initialisation procedure is designed to maximise network reachable multistability, i.e., the number of equilibria within the network that can be reached through relevant input trajectories, in few gradient steps. We show on several information restitution, sequence""]"
