Question,Source Article Index,Question Type,Summary,qwen2.5:3b,documentIDs,context_retrieved
"Considering the challenges of noisy labels discussed in abs-2404.04159v1, how could the AllSpark framework's 'Semantic Memory' (abs-2403.01818v3) be adapted to identify and correct potentially mislabeled pixels during semi-supervised training?","abs-2404.04159v1,abs-2403.01818v3",Synthesis & Multi-Hop Reasoning,"Title: Noisy Label Processing for Classification: A Survey 
Summary: In recent years, deep neural networks (DNNs) have gained remarkable
achievement in computer vision tasks, and the success of DNNs often depends
greatly on the richness of data. However, the acquisition process of data and
high-quality ground truth requires a lot of manpower and money. In the long,
tedious process of data annotation, annotators are prone to make mistakes,
resulting in incorrect labels of images, i.e., noisy labels. The emergence of
noisy labels is inevitable. Moreover, since research shows that DNNs can easily
fit noisy labels, the existence of noisy labels will cause significant damage
to the model training process. Therefore, it is crucial to combat noisy labels
for computer vision tasks, especially for classification tasks. In this survey,
we first comprehensively review the evolution of different deep learning
approaches for noisy label combating in the image classification task. In
addition, we also review different noise patterns that have been proposed to
design robust algorithms. Furthermore, we explore the inner pattern of
real-world label noise and propose an algorithm to generate a synthetic label
noise pattern guided by real-world data. We test the algorithm on the
well-known real-world dataset CIFAR-10N to form a new real-world data-guided
synthetic benchmark and evaluate some typical noise-robust methods on the
benchmark. 

Title: AllSpark: Reborn Labeled Features from Unlabeled in Transformer for
  Semi-Supervised Semantic Segmentation 
Summary: Semi-supervised semantic segmentation (SSSS) has been proposed to alleviate
the burden of time-consuming pixel-level manual labeling, which leverages
limited labeled data along with larger amounts of unlabeled data. Current
state-of-the-art methods train the labeled data with ground truths and
unlabeled data with pseudo labels. However, the two training flows are
separate, which allows labeled data to dominate the training process, resulting
in low-quality pseudo labels and, consequently, sub-optimal results. To
alleviate this issue, we present AllSpark, which reborns the labeled features
from unlabeled ones with the channel-wise cross-attention mechanism. We further
introduce a Semantic Memory along with a Channel Semantic Grouping strategy to
ensure that unlabeled features adequately represent labeled features. The
AllSpark shed new light on the architecture level designs of SSSS rather than
framework level, which avoids increasingly complicated training pipeline
designs. It can also be regarded as a flexible bottleneck module that can be
seamlessly integrated into a general transformer-based segmentation model. The
proposed AllSpark outperforms existing methods across all evaluation protocols
on Pascal, Cityscapes and COCO benchmarks without bells-and-whistles. Code and
model weights are available at: https://github.com/xmed-lab/AllSpark. 

","The Semantic Memory introduced in the AllSpark framework can aid in identifying potentially mislabeled pixels by ensuring that unlabeled features adequately represent labeled ones. This is achieved through a channel-wise cross-attention mechanism, which reboots labeled features from unlabeled data. By doing so, the Semantic Memory helps to mitigate the issue of labeled data dominating the training process and ensures that the model leverages both labeled and unlabeled data effectively for accurate learning, potentially correcting noisy labels.","abs-2403.01818v3, abs-2404.05717v3, abs-2403.13684v2, abs-2403.11021v3","[""Summary: Semi-supervised semantic segmentation (SSSS) has been proposed to alleviate the burden of time-consuming pixel-level manual labeling, which leverages limited labeled data along with larger amounts of unlabeled data. Current state-of-the-art methods train the labeled data with ground truths and unlabeled data with pseudo labels. However, the two training flows are separate, which allows labeled data to dominate the training process, resulting in low-quality pseudo labels and, consequently, sub-optimal results. To alleviate this issue, we present AllSpark, which reborns the labeled features from unlabeled ones with the channel-wise cross-attention mechanism. We further introduce a Semantic Memory along with a Channel Semantic Grouping strategy to ensure that unlabeled features adequately represent labeled features. The AllSpark shed new light on the architecture level designs of SSSS rather than framework level, which avoids increasingly complicated training pipeline designs."", ""masked variables for faithful context preservation and initial semantic concept swapping. Then, we introduce appearance adaptation, to seamlessly adapt the semantic concept into the original image in terms of target location, shape, style, and content during the image generation process. Extensive results on both human and automatic evaluation demonstrate significant improvements of our approach over baseline methods on personalized swapping. Furthermore, SwapAnything shows its precise and faithful swapping abilities across single object, multiple objects, partial object, and cross-domain swapping tasks. SwapAnything also achieves great performance on text-based swapping and tasks beyond swapping such as object insertion."", ""Summary: Generalized Category Discovery (GCD) aims to classify unlabelled images from both `seen' and `unseen' classes by transferring knowledge from a set of labelled `seen' class images. A key theme in existing GCD approaches is adapting large-scale pre-trained models for the GCD task. An alternate perspective, however, is to adapt the data representation itself for better alignment with the pre-trained model. As such, in this paper, we introduce a two-stage adaptation approach termed SPTNet, which iteratively optimizes model parameters (i.e., model-finetuning) and data parameters (i.e., prompt learning). Furthermore, we propose a novel spatial prompt tuning method (SPT) which considers the spatial property of image data, enabling the method to better focus on object parts, which can transfer between seen and unseen classes. We thoroughly evaluate our SPTNet on standard benchmarks and demonstrate that our method outperforms existing GCD methods. Notably, we find our method achieves"", ""Summary: Effective editing of personal content holds a pivotal role in enabling individuals to express their creativity, weaving captivating narratives within their visual stories, and elevate the overall quality and impact of their visual content. Therefore, in this work, we introduce SwapAnything, a novel framework that can swap any objects in an image with personalized concepts given by the reference, while keeping the context unchanged. Compared with existing methods for personalized subject swapping, SwapAnything has three unique advantages: (1) precise control of arbitrary objects and parts rather than the main subject, (2) more faithful preservation of context pixels, (3) better adaptation of the personalized concept to the image. First, we propose targeted variable swapping to apply region control over latent feature maps and swap masked variables for faithful context preservation and initial semantic concept swapping. Then, we introduce appearance adaptation, to seamlessly"", ""Summary: The unprecedented surge in video data production in recent years necessitates efficient tools to extract meaningful frames from videos for downstream tasks. Long-term temporal reasoning is a key desideratum for frame retrieval systems. While state-of-the-art foundation models, like VideoLLaMA and ViCLIP, are proficient in short-term semantic understanding, they surprisingly fail at long-term reasoning across frames. A key reason for this failure is that they intertwine per-frame perception and temporal reasoning into a single deep network. Hence, decoupling but co-designing semantic understanding and temporal reasoning is essential for efficient scene identification. We propose a system that leverages vision-language models for semantic understanding of individual frames but effectively reasons about the long-term evolution of events using state machines and temporal logic (TL) formulae that inherently capture memory. Our TL-based reasoning improves the F1 score of complex""]"
How could the optical flow inclusion method from abs-2403.10216v1 be used to enhance the motion-guided warping module in Pix2Gif (abs-2403.04634v2) for more accurate GIF generation?,"abs-2403.10216v1,abs-2403.04634v2",Synthesis & Multi-Hop Reasoning,"Title: Exploring Optical Flow Inclusion into nnU-Net Framework for Surgical
  Instrument Segmentation 
Summary: Surgical instrument segmentation in laparoscopy is essential for
computer-assisted surgical systems. Despite the Deep Learning progress in
recent years, the dynamic setting of laparoscopic surgery still presents
challenges for precise segmentation. The nnU-Net framework excelled in semantic
segmentation analyzing single frames without temporal information. The
framework's ease of use, including its ability to be automatically configured,
and its low expertise requirements, have made it a popular base framework for
comparisons. Optical flow (OF) is a tool commonly used in video tasks to
estimate motion and represent it in a single frame, containing temporal
information. This work seeks to employ OF maps as an additional input to the
nnU-Net architecture to improve its performance in the surgical instrument
segmentation task, taking advantage of the fact that instruments are the main
moving objects in the surgical field. With this new input, the temporal
component would be indirectly added without modifying the architecture. Using
CholecSeg8k dataset, three different representations of movement were estimated
and used as new inputs, comparing them with a baseline model. Results showed
that the use of OF maps improves the detection of classes with high movement,
even when these are scarce in the dataset. To further improve performance,
future work may focus on implementing other OF-preserving augmentations. 

Title: Pix2Gif: Motion-Guided Diffusion for GIF Generation 
Summary: We present Pix2Gif, a motion-guided diffusion model for image-to-GIF (video)
generation. We tackle this problem differently by formulating the task as an
image translation problem steered by text and motion magnitude prompts, as
shown in teaser fig. To ensure that the model adheres to motion guidance, we
propose a new motion-guided warping module to spatially transform the features
of the source image conditioned on the two types of prompts. Furthermore, we
introduce a perceptual loss to ensure the transformed feature map remains
within the same space as the target image, ensuring content consistency and
coherence. In preparation for the model training, we meticulously curated data
by extracting coherent image frames from the TGIF video-caption dataset, which
provides rich information about the temporal changes of subjects. After
pretraining, we apply our model in a zero-shot manner to a number of video
datasets. Extensive qualitative and quantitative experiments demonstrate the
effectiveness of our model -- it not only captures the semantic prompt from
text but also the spatial ones from motion guidance. We train all our models
using a single node of 16xV100 GPUs. Code, dataset and models are made public
at: https://hiteshk03.github.io/Pix2Gif/. 

","The inclusion of optical flow maps as an additional input to the nnU-Net architecture, as proposed in abs-2403.10216v1, could enhance the motion-guided warping module in Pix2Gif (abs-2403.04634v2) by providing the model with temporal information about object motions. This additional input allows for a more accurate spatial transformation of features from the source image under motion guidance, thereby ensuring that the generated GIFs remain coherent and consistent with the actual motion patterns observed in real scenes.","abs-2403.04634v2, abs-2403.10216v1, abs-2403.12002v2, abs-2406.02976v1","[""Summary: We present Pix2Gif, a motion-guided diffusion model for image-to-GIF (video) generation. We tackle this problem differently by formulating the task as an image translation problem steered by text and motion magnitude prompts, as shown in teaser fig. To ensure that the model adheres to motion guidance, we propose a new motion-guided warping module to spatially transform the features of the source image conditioned on the two types of prompts. Furthermore, we introduce a perceptual loss to ensure the transformed feature map remains within the same space as the target image, ensuring content consistency and coherence. In preparation for the model training, we meticulously curated data by extracting coherent image frames from the TGIF video-caption dataset, which provides rich information about the temporal changes of subjects. After pretraining, we apply our model in a zero-shot manner to a number of video datasets. Extensive qualitative and quantitative experiments demonstrate"", ""pretraining, we apply our model in a zero-shot manner to a number of video datasets. Extensive qualitative and quantitative experiments demonstrate the effectiveness of our model -- it not only captures the semantic prompt from text but also the spatial ones from motion guidance. We train all our models using a single node of 16xV100 GPUs. Code, dataset and models are made public at: https://hiteshk03.github.io/Pix2Gif/."", ""Summary: Surgical instrument segmentation in laparoscopy is essential for computer-assisted surgical systems. Despite the Deep Learning progress in recent years, the dynamic setting of laparoscopic surgery still presents challenges for precise segmentation. The nnU-Net framework excelled in semantic segmentation analyzing single frames without temporal information. The framework's ease of use, including its ability to be automatically configured, and its low expertise requirements, have made it a popular base framework for comparisons. Optical flow (OF) is a tool commonly used in video tasks to estimate motion and represent it in a single frame, containing temporal information. This work seeks to employ OF maps as an additional input to the nnU-Net architecture to improve its performance in the surgical instrument segmentation task, taking advantage of the fact that instruments are the main moving objects in the surgical field. With this new input, the temporal component would be"", ""Summary: Text-driven diffusion-based video editing presents a unique challenge not encountered in image editing literature: establishing real-world motion. Unlike existing video editing approaches, here we focus on score distillation sampling to circumvent the standard reverse diffusion process and initiate optimization from videos that already exhibit natural motion. Our analysis reveals that while video score distillation can effectively introduce new content indicated by target text, it can also cause significant structure and motion deviation. To counteract this, we propose to match space-time self-similarities of the original video and the edited video during the score distillation. Thanks to the use of score distillation, our approach is model-agnostic, which can be applied for both cascaded and non-cascaded video diffusion frameworks. Through extensive comparisons with leading methods, our approach demonstrates its superiority in altering appearances while accurately preserving"", ""Summary: Cooperation between temporal convolutional networks (TCN) and graph convolutional networks (GCN) as a processing module has shown promising results in skeleton-based video anomaly detection (SVAD). However, to maintain a lightweight model with low computational and storage complexity, shallow GCN and TCN blocks are constrained by small receptive fields and a lack of cross-dimension interaction capture. To tackle this limitation, we propose a lightweight module called the Dual Attention Module (DAM) for capturing cross-dimension interaction relationships in spatio-temporal skeletal data. It employs the frame attention mechanism to identify the most significant frames and the skeleton attention mechanism to capture broader relationships across fixed partitions with minimal parameters and flops. Furthermore, the proposed Dual Attention Normalizing Flow (DA-Flow) integrates the DAM as a post-processing unit after GCN within the normalizing flow framework. Simulations show that""]"
"In the Prism framework (abs-2406.14544v1), what was the specific training time in GPU hours for the 2B LLaVA model used in the perception stage?",abs-2406.14544v1,Negative / Unanswerable,"Title: Prism: A Framework for Decoupling and Assessing the Capabilities of VLMs 
Summary: Vision Language Models (VLMs) demonstrate remarkable proficiency in
addressing a wide array of visual questions, which requires strong perception
and reasoning faculties. Assessing these two competencies independently is
crucial for model refinement, despite the inherent difficulty due to the
intertwined nature of seeing and reasoning in existing VLMs. To tackle this
issue, we present Prism, an innovative framework designed to disentangle the
perception and reasoning processes involved in visual question solving. Prism
comprises two distinct stages: a perception stage that utilizes a VLM to
extract and articulate visual information in textual form, and a reasoning
stage that formulates responses based on the extracted visual information using
a Large Language Model (LLM). This modular design enables the systematic
comparison and assessment of both proprietary and open-source VLM for their
perception and reasoning strengths. Our analytical framework provides several
valuable insights, underscoring Prism's potential as a cost-effective solution
for vision-language tasks. By combining a streamlined VLM focused on perception
with a powerful LLM tailored for reasoning, Prism achieves superior results in
general vision-language tasks while substantially cutting down on training and
operational expenses. Quantitative evaluations show that Prism, when configured
with a vanilla 2B LLaVA and freely accessible GPT-3.5, delivers performance on
par with VLMs $10 \times$ larger on the rigorous multimodal benchmark MMStar.
The project is released at: https://github.com/SparksJoe/Prism. 

",The document does not provide the specific training time in GPU hours for the 2B LLaVA model used in the perception stage of the Prism framework.,"abs-2406.14544v1, abs-2402.05195v2, abs-2402.04009v1, abs-2403.04634v2","[""assessment of both proprietary and open-source VLM for their perception and reasoning strengths. Our analytical framework provides several valuable insights, underscoring Prism's potential as a cost-effective solution for vision-language tasks. By combining a streamlined VLM focused on perception with a powerful LLM tailored for reasoning, Prism achieves superior results in general vision-language tasks while substantially cutting down on training and operational expenses. Quantitative evaluations show that Prism, when configured with a vanilla 2B LLaVA and freely accessible GPT-3.5, delivers performance on par with VLMs $10 \\times$ larger on the rigorous multimodal benchmark MMStar. The project is released at: https://github.com/SparksJoe/Prism."", ""an alternative prior-training strategy that works in the latent space of a pre-trained CLIP model without relying on the diffusion UNet models. $\\lambda$-ECLIPSE leverages the image-text interleaved pre-training for fast and effective multi-subject-driven P-T2I. Through extensive experiments, we establish that $\\lambda$-ECLIPSE surpasses existing baselines in composition alignment while preserving concept alignment performance, even with significantly lower resource utilization. $\\lambda$-ECLIPSE performs multi-subject driven P-T2I with just 34M parameters and is trained on a mere 74 GPU hours. Additionally, $\\lambda$-ECLIPSE demonstrates the unique ability to perform multi-concept interpolations."", ""model and focus on learning task-specific knowledge. We also show that LAST can be highly parallel across multiple optimization objectives, making it very efficient in downstream task adaptation, for example, in finding optimal hyperparameters. LAST outperforms previous state-of-the-art methods on VTAB-1K and other visual adaptation tasks with roughly only 30\\% of GPU memory footprint and 60\\% of training time compared to existing PEFT methods, but achieves significantly higher accuracy."", ""Summary: In finetuning a large pretrained model to downstream tasks, parameter-efficient fine-tuning (PEFT) methods can effectively finetune pretrained models with few trainable parameters, but suffer from high GPU memory consumption and slow training speed. Because learnable parameters from these methods are entangled with the pretrained model, gradients related to the frozen pretrained model's parameters have to be computed and stored during finetuning. We propose Low-rank Attention Side-Tuning (LAST), which disentangles the trainable module from the pretrained model by freezing not only parameters but also outputs of the pretrained network. LAST trains a side-network composed of only low-rank self-attention modules. By viewing the pretrained model as a frozen feature extractor, the side-network takes intermediate output from the pretrained model and focus on learning task-specific knowledge. We also show that LAST can be highly parallel across multiple optimization objectives,"", ""pretraining, we apply our model in a zero-shot manner to a number of video datasets. Extensive qualitative and quantitative experiments demonstrate the effectiveness of our model -- it not only captures the semantic prompt from text but also the spatial ones from motion guidance. We train all our models using a single node of 16xV100 GPUs. Code, dataset and models are made public at: https://hiteshk03.github.io/Pix2Gif/.""]"
