Question,Source Article Index,Question Type,Summary,qwen2.5:3b,documentIDs,context_retrieved
What specific version of the StarCoder model was used as the base for WizardCoder?,abs-2306.08568v1,Negative / Unanswerable Questions,"Title: WizardCoder: Empowering Code Large Language Models with Evol-Instruct 
Summary: Code Large Language Models (Code LLMs), such as StarCoder, have demonstrated
exceptional performance in code-related tasks. However, most existing models
are solely pre-trained on extensive raw code data without instruction
fine-tuning. In this paper, we introduce WizardCoder, which empowers Code LLMs
with complex instruction fine-tuning, by adapting the Evol-Instruct method to
the domain of code. Through comprehensive experiments on four prominent code
generation benchmarks, namely HumanEval, HumanEval+, MBPP, and DS-1000, we
unveil the exceptional capabilities of our model. It surpasses all other
open-source Code LLMs by a substantial margin. Moreover, our model even
outperforms the largest closed LLMs, Anthropic's Claude and Google's Bard, on
HumanEval and HumanEval+. Our code, model weights, and data are public at
https://github.com/nlpxucan/WizardLM 

",No Answer.,"abs-2309.14021v1, abs-2305.08655v1, abs-2309.08448v2, abs-2305.15334v1, abs-2404.07117v1","[""Summary: Low Rank Decomposition of matrix - splitting a large matrix into a product of two smaller matrix offers a means for compression that reduces the parameters of a model without sparsification, and hence delivering more speedup on modern hardware. Moreover, unlike quantization, the compressed linear layers remain fully differentiable and all the parameters trainable, while being able to leverage the existing highly efficient kernels over floating point matrices. We study the potential to compress Large Language Models (LLMs) for monolingual Code generation via Low Rank Decomposition (LoRD) and observe that ranks for the linear layers in these models can be reduced by upto 39.58% with less than 1% increase in perplexity. We then use Low Rank Decomposition (LoRD) to compress StarCoder 16B to 13.2B parameter with no drop and to 12.3B with minimal drop in HumanEval Pass@1 score, in less than 10 minutes on a single A100. The compressed models speeds up inference by up to 22.35% with"", ""Summary: Pre-trained Language Model (PLM) is nowadays the mainstay of Unsupervised Sentence Representation Learning (USRL). However, PLMs are sensitive to the frequency information of words from their pre-training corpora, resulting in anisotropic embedding space, where the embeddings of high-frequency words are clustered but those of low-frequency words disperse sparsely. This anisotropic phenomenon results in two problems of similarity bias and information bias, lowering the quality of sentence embeddings. To solve the problems, we fine-tune PLMs by leveraging the frequency information of words and propose a novel USRL framework, namely Sentence Representation Learning with Frequency-induced Adversarial tuning and Incomplete sentence filtering (SLT-FAI). We calculate the word frequencies over the pre-training corpora of PLMs and assign words thresholding frequency labels. With them, (1) we incorporate a similarity discriminator used to distinguish the embeddings of high-frequency"", ""evaluation framework, enabling the assessment of language models' capabilities across different tasks. In this paper, we evaluate the performance of GPT-3.5, Taiwan-LLaMa-v1.0, and Model 7-C, our proprietary model, on these benchmarks. The evaluation results highlight that our model, Model 7-C, achieves performance comparable to GPT-3.5 with respect to a part of the evaluated capabilities. In an effort to advance the evaluation of language models in Traditional Chinese and stimulate further research in this field, we have open-sourced our benchmark and opened the model for trial."", ""Title: Gorilla: Large Language Model Connected with Massive APIs.\nPublished_date: 2023-05-24."", ""Title: Continuous Language Model Interpolation for Dynamic and Controllable\n  Text Generation.\nPublished_date: 2024-04-10.""]"
"Compare the objectives of the FIT-RAG framework and the CORE-GPT platform. While both use external knowledge, what is the primary focus of each system?","abs-2403.14374v1,abs-2307.04683v1",Comparative & Contrastive Questions,"Title: FIT-RAG: Black-Box RAG with Factual Information and Token Reduction 
Summary: Due to the extraordinarily large number of parameters, fine-tuning Large
Language Models (LLMs) to update long-tail or out-of-date knowledge is
impractical in lots of applications. To avoid fine-tuning, we can alternatively
treat a LLM as a black-box (i.e., freeze the parameters of the LLM) and augment
it with a Retrieval-Augmented Generation (RAG) system, namely black-box RAG.
Recently, black-box RAG has achieved success in knowledge-intensive tasks and
has gained much attention. Existing black-box RAG methods typically fine-tune
the retriever to cater to LLMs' preferences and concatenate all the retrieved
documents as the input, which suffers from two issues: (1) Ignorance of Factual
Information. The LLM preferred documents may not contain the factual
information for the given question, which can mislead the retriever and hurt
the effectiveness of black-box RAG; (2) Waste of Tokens. Simply concatenating
all the retrieved documents brings large amounts of unnecessary tokens for
LLMs, which degenerates the efficiency of black-box RAG. To address these
issues, this paper proposes a novel black-box RAG framework which utilizes the
factual information in the retrieval and reduces the number of tokens for
augmentation, dubbed FIT-RAG. FIT-RAG utilizes the factual information by
constructing a bi-label document scorer. Besides, it reduces the tokens by
introducing a self-knowledge recognizer and a sub-document-level token reducer.
FIT-RAG achieves both superior effectiveness and efficiency, which is validated
by extensive experiments across three open-domain question-answering datasets:
TriviaQA, NQ and PopQA. FIT-RAG can improve the answering accuracy of
Llama2-13B-Chat by 14.3\% on TriviaQA, 19.9\% on NQ and 27.5\% on PopQA,
respectively. Furthermore, it can save approximately half of the tokens on
average across the three datasets. 

Title: CORE-GPT: Combining Open Access research and large language models for
  credible, trustworthy question answering 
Summary: In this paper, we present CORE-GPT, a novel question-answering platform that
combines GPT-based language models and more than 32 million full-text open
access scientific articles from CORE. We first demonstrate that GPT3.5 and GPT4
cannot be relied upon to provide references or citations for generated text. We
then introduce CORE-GPT which delivers evidence-based answers to questions,
along with citations and links to the cited papers, greatly increasing the
trustworthiness of the answers and reducing the risk of hallucinations.
CORE-GPT's performance was evaluated on a dataset of 100 questions covering the
top 20 scientific domains in CORE, resulting in 100 answers and links to 500
relevant articles. The quality of the provided answers and and relevance of the
links were assessed by two annotators. Our results demonstrate that CORE-GPT
can produce comprehensive and trustworthy answers across the majority of
scientific domains, complete with links to genuine, relevant scientific
articles. 

","FIT-RAG aims to address the inefficiency issues in black-box Retrieval-Augmented Generation (RAG) by reducing token usage through the integration of factual information into the retrieval process. In contrast, CORE-GPT focuses on enhancing the trustworthiness and accuracy of answers generated by GPT-based language models by providing evidence-based responses with citations and links to relevant scientific articles, thereby improving the reliability of the model's outputs across various scientific domains.","abs-2403.14374v1, abs-2307.04683v1, abs-2404.00152v2","[""the effectiveness of black-box RAG; (2) Waste of Tokens. Simply concatenating all the retrieved documents brings large amounts of unnecessary tokens for LLMs, which degenerates the efficiency of black-box RAG. To address these issues, this paper proposes a novel black-box RAG framework which utilizes the factual information in the retrieval and reduces the number of tokens for augmentation, dubbed FIT-RAG. FIT-RAG utilizes the factual information by constructing a bi-label document scorer. Besides, it reduces the tokens by introducing a self-knowledge recognizer and a sub-document-level token reducer. FIT-RAG achieves both superior effectiveness and efficiency, which is validated by extensive experiments across three open-domain question-answering datasets: TriviaQA, NQ and PopQA. FIT-RAG can improve the answering accuracy of Llama2-13B-Chat by 14.3\\% on TriviaQA, 19.9\\% on NQ and 27.5\\% on PopQA, respectively. Furthermore, it can save approximately half of the tokens on average"", ""Summary: In this paper, we present CORE-GPT, a novel question-answering platform that combines GPT-based language models and more than 32 million full-text open access scientific articles from CORE. We first demonstrate that GPT3.5 and GPT4 cannot be relied upon to provide references or citations for generated text. We then introduce CORE-GPT which delivers evidence-based answers to questions, along with citations and links to the cited papers, greatly increasing the trustworthiness of the answers and reducing the risk of hallucinations. CORE-GPT's performance was evaluated on a dataset of 100 questions covering the top 20 scientific domains in CORE, resulting in 100 answers and links to 500 relevant articles. The quality of the provided answers and and relevance of the links were assessed by two annotators. Our results demonstrate that CORE-GPT can produce comprehensive and trustworthy answers across the majority of scientific domains, complete with links to genuine, relevant"", ""Title: FIT-RAG: Black-Box RAG with Factual Information and Token Reduction.\nPublished_date: 2024-03-21."", ""that CORE-GPT can produce comprehensive and trustworthy answers across the majority of scientific domains, complete with links to genuine, relevant scientific articles."", ""Summary: Despite their general capabilities, LLMs still struggle on biomedical NER tasks, which are difficult due to the presence of specialized terminology and lack of training data. In this work we set out to improve LLM performance on biomedical NER in limited data settings via a new knowledge augmentation approach which incorporates definitions of relevant concepts on-the-fly. During this process, to provide a test bed for knowledge augmentation, we perform a comprehensive exploration of prompting strategies. Our experiments show that definition augmentation is useful for both open source and closed LLMs. For example, it leads to a relative improvement of 15\\% (on average) in GPT-4 performance (F1) across all (six) of our test datasets. We conduct extensive ablations and analyses to demonstrate that our performance improvements stem from adding relevant definitional knowledge. We find that careful prompting strategies also improve LLM performance, allowing them to outperform""]"
How might the 'self-distillation' framework of LR-Drop be applied to the multi-head attention mechanism regularized by TLM to create a system that is robust at both the layer and token levels?,"abs-2402.16361v1,abs-2310.18738v1",Synthesis & Multi-Hop Reasoning Questions,"Title: Layer-wise Regularized Dropout for Neural Language Models 
Summary: Among the various pre-trained neural language models that are popular today,
dropout is already an indispensable regularization technique. To solve the
inconsistency between training and inference caused by the randomness of
dropout, some studies use consistency training to regularize dropout at the
output layer. In this paper, we propose a novel Layer-wise Regularized Dropout
(LR-Drop), which is specially designed for Transformer-based Language models.
Specifically, LR-Drop layer-wise regularizes each Transformer layer using the
consistency training strategy. Each training sample passes through the two
siamese sub-models sampled by dropout, and then LR-Drop forces the hidden
states, multi-head attention matrices, and output distribution of the two
siamese sub-models to be consistent. The proposed LR-Drop can be regarded as a
""self-distillation"" framework, in which each sub-model generated by dropout is
the other's ""teacher"" model and ""student"" model. Through extensive experiments
on 8 natural language understanding datasets, 6 neural machine translation
datasets, and 1 abstractive summarization dataset (a total of 15 datasets), we
show that LR-Drop achieves superior performances, including state-of-the-art
results. 

Title: TLM: Token-Level Masking for Transformers 
Summary: Structured dropout approaches, such as attention dropout and DropHead, have
been investigated to regularize the multi-head attention mechanism in
Transformers. In this paper, we propose a new regularization scheme based on
token-level rather than structure-level to reduce overfitting. Specifically, we
devise a novel Token-Level Masking (TLM) training strategy for Transformers to
regularize the connections of self-attention, which consists of two masking
techniques that are effective and easy to implement. The underlying idea is to
manipulate the connections between tokens in the multi-head attention via
masking, where the networks are forced to exploit partial neighbors'
information to produce a meaningful representation. The generality and
effectiveness of TLM are thoroughly evaluated via extensive experiments on 4
diversified NLP tasks across 18 datasets, including natural language
understanding benchmark GLUE, ChineseGLUE, Chinese Grammatical Error
Correction, and data-to-text generation. The results indicate that TLM can
consistently outperform attention dropout and DropHead, e.g., it increases by
0.5 points relative to DropHead with BERT-large on GLUE. Moreover, TLM can
establish a new record on the data-to-text benchmark Rotowire (18.93 BLEU). Our
code will be publicly available at https://github.com/Young1993/tlm. 

","The Layer-wise Regularized Dropout (LR-Drop) employs a ""self-distillation"" framework where each sub-model generated by dropout acts as a teacher model for another, ensuring consistency in hidden states, multi-head attention matrices, and output distributions. This self-distillation approach can be extended to integrate with Token-Level Masking (TLM), which manipulates token-level connections in the multi-head attention mechanism via masking techniques. By leveraging both layer-wise regularization at the Transformer layer level and token-level masking, a robust system that is effective across multiple levels of the model can be created.

Alternatively, ASVD, based on low-rank decomposition, can compress the network by 10%-30% through decomposing the attention module into layers. Applying this to both TLM and LR-Drop could achieve further performance improvements in terms of robustness at both layer and token levels without sacrificing efficiency or increasing computational costs significantly.","abs-2310.18738v1, abs-2402.16361v1, abs-2312.05821v4","[""Summary: Structured dropout approaches, such as attention dropout and DropHead, have been investigated to regularize the multi-head attention mechanism in Transformers. In this paper, we propose a new regularization scheme based on token-level rather than structure-level to reduce overfitting. Specifically, we devise a novel Token-Level Masking (TLM) training strategy for Transformers to regularize the connections of self-attention, which consists of two masking techniques that are effective and easy to implement. The underlying idea is to manipulate the connections between tokens in the multi-head attention via masking, where the networks are forced to exploit partial neighbors' information to produce a meaningful representation. The generality and effectiveness of TLM are thoroughly evaluated via extensive experiments on 4 diversified NLP tasks across 18 datasets, including natural language understanding benchmark GLUE, ChineseGLUE, Chinese Grammatical Error Correction, and"", ""Summary: Among the various pre-trained neural language models that are popular today, dropout is already an indispensable regularization technique. To solve the inconsistency between training and inference caused by the randomness of dropout, some studies use consistency training to regularize dropout at the output layer. In this paper, we propose a novel Layer-wise Regularized Dropout (LR-Drop), which is specially designed for Transformer-based Language models. Specifically, LR-Drop layer-wise regularizes each Transformer layer using the consistency training strategy. Each training sample passes through the two siamese sub-models sampled by dropout, and then LR-Drop forces the hidden states, multi-head attention matrices, and output distribution of the two siamese sub-models to be consistent. The proposed LR-Drop can be regarded as a \""self-distillation\"" framework, in which each sub-model generated by dropout is the other's \""teacher\"" model and \""student\"" model. Through extensive"", ""NLP tasks across 18 datasets, including natural language understanding benchmark GLUE, ChineseGLUE, Chinese Grammatical Error Correction, and data-to-text generation. The results indicate that TLM can consistently outperform attention dropout and DropHead, e.g., it increases by 0.5 points relative to DropHead with BERT-large on GLUE. Moreover, TLM can establish a new record on the data-to-text benchmark Rotowire (18.93 BLEU). Our code will be publicly available at https://github.com/Young1993/tlm."", ""a \""self-distillation\"" framework, in which each sub-model generated by dropout is the other's \""teacher\"" model and \""student\"" model. Through extensive experiments on 8 natural language understanding datasets, 6 neural machine translation datasets, and 1 abstractive summarization dataset (a total of 15 datasets), we show that LR-Drop achieves superior performances, including state-of-the-art results."", ""decomposition by addressing the varying sensitivity of different LLM layers. In this way, ASVD can compress a network by 10%-30%. Based on the success of the low-rank decomposition of projection matrices in the self-attention module, we further introduce ASVD to compress the KV cache. By reducing the channel dimension of KV activations, memory requirements for KV cache can be largely reduced. ASVD can further achieve 50% KV cache reductions without performance drop in a training-free manner. Code is anonymously available in supplementary materials.""]"
What specific dropout techniques are mentioned as being outperformed by Token-Level Masking (TLM)?,abs-2310.18738v1,Direct Fact Retrieval & Definition Questions,"Title: TLM: Token-Level Masking for Transformers 
Summary: Structured dropout approaches, such as attention dropout and DropHead, have
been investigated to regularize the multi-head attention mechanism in
Transformers. In this paper, we propose a new regularization scheme based on
token-level rather than structure-level to reduce overfitting. Specifically, we
devise a novel Token-Level Masking (TLM) training strategy for Transformers to
regularize the connections of self-attention, which consists of two masking
techniques that are effective and easy to implement. The underlying idea is to
manipulate the connections between tokens in the multi-head attention via
masking, where the networks are forced to exploit partial neighbors'
information to produce a meaningful representation. The generality and
effectiveness of TLM are thoroughly evaluated via extensive experiments on 4
diversified NLP tasks across 18 datasets, including natural language
understanding benchmark GLUE, ChineseGLUE, Chinese Grammatical Error
Correction, and data-to-text generation. The results indicate that TLM can
consistently outperform attention dropout and DropHead, e.g., it increases by
0.5 points relative to DropHead with BERT-large on GLUE. Moreover, TLM can
establish a new record on the data-to-text benchmark Rotowire (18.93 BLEU). Our
code will be publicly available at https://github.com/Young1993/tlm. 

","Token-Level Masking (TLM) is reported to consistently outperform attention dropout and DropHead, with results showing TLM increasing BERT-large's performance by 0.5 points on the GLUE benchmark compared to DropHead.","abs-2310.18738v1, abs-2402.16361v1, abs-2401.06081v2","[""Summary: Structured dropout approaches, such as attention dropout and DropHead, have been investigated to regularize the multi-head attention mechanism in Transformers. In this paper, we propose a new regularization scheme based on token-level rather than structure-level to reduce overfitting. Specifically, we devise a novel Token-Level Masking (TLM) training strategy for Transformers to regularize the connections of self-attention, which consists of two masking techniques that are effective and easy to implement. The underlying idea is to manipulate the connections between tokens in the multi-head attention via masking, where the networks are forced to exploit partial neighbors' information to produce a meaningful representation. The generality and effectiveness of TLM are thoroughly evaluated via extensive experiments on 4 diversified NLP tasks across 18 datasets, including natural language understanding benchmark GLUE, ChineseGLUE, Chinese Grammatical Error Correction, and"", ""NLP tasks across 18 datasets, including natural language understanding benchmark GLUE, ChineseGLUE, Chinese Grammatical Error Correction, and data-to-text generation. The results indicate that TLM can consistently outperform attention dropout and DropHead, e.g., it increases by 0.5 points relative to DropHead with BERT-large on GLUE. Moreover, TLM can establish a new record on the data-to-text benchmark Rotowire (18.93 BLEU). Our code will be publicly available at https://github.com/Young1993/tlm."", ""Summary: Among the various pre-trained neural language models that are popular today, dropout is already an indispensable regularization technique. To solve the inconsistency between training and inference caused by the randomness of dropout, some studies use consistency training to regularize dropout at the output layer. In this paper, we propose a novel Layer-wise Regularized Dropout (LR-Drop), which is specially designed for Transformer-based Language models. Specifically, LR-Drop layer-wise regularizes each Transformer layer using the consistency training strategy. Each training sample passes through the two siamese sub-models sampled by dropout, and then LR-Drop forces the hidden states, multi-head attention matrices, and output distribution of the two siamese sub-models to be consistent. The proposed LR-Drop can be regarded as a \""self-distillation\"" framework, in which each sub-model generated by dropout is the other's \""teacher\"" model and \""student\"" model. Through extensive"", ""a \""self-distillation\"" framework, in which each sub-model generated by dropout is the other's \""teacher\"" model and \""student\"" model. Through extensive experiments on 8 natural language understanding datasets, 6 neural machine translation datasets, and 1 abstractive summarization dataset (a total of 15 datasets), we show that LR-Drop achieves superior performances, including state-of-the-art results."", ""of the key tokens for the erroneous solution, reducing the effect of other unimportant tokens. The experiment results on mathematical tasks and question-answering tasks have demonstrated the effectiveness of our approach. Our code and data are available at https://github.com/RUCAIBox/RLMEC.""]"
