Question,Source Article Index,Question Type,Summary,qwen2.5:3b,documentIDs,context_retrieved
How much did it cost to train the FinPythia-6.9B model as detailed in the 'Efficient Continual Pre-training' paper?,abs-2311.08545v1,Negative / Unanswerable Questions,"Title: Efficient Continual Pre-training for Building Domain Specific Large
  Language Models 
Summary: Large language models (LLMs) have demonstrated remarkable open-domain
capabilities. Traditionally, LLMs tailored for a domain are trained from
scratch to excel at handling domain-specific tasks. In this work, we explore an
alternative strategy of continual pre-training as a means to develop
domain-specific LLMs. We introduce FinPythia-6.9B, developed through
domain-adaptive continual pre-training on the financial domain. Continual
pre-trained FinPythia showcases consistent improvements on financial tasks over
the original foundational model. We further explore simple but effective data
selection strategies for continual pre-training. Our data selection strategies
outperforms vanilla continual pre-training's performance with just 10% of
corpus size and cost, without any degradation on open-domain standard tasks.
Our work proposes an alternative solution to building domain-specific LLMs from
scratch in a cost-effective manner. 

","The 'Efficient Continual Pre-training for Building Domain Specific Large Language Models' document does not provide specific information about the costs associated with training the FinPythia-6.9B model. Therefore, it is not possible to answer the question based on the given documents. No Answer.","abs-2311.08545v1, abs-2310.01467v1, abs-2406.11813v3, abs-2402.16361v1","[""Language Models.\nPublished_date: 2023-11-14.\nSummary: Large language models (LLMs) have demonstrated remarkable open-domain capabilities. Traditionally, LLMs tailored for a domain are trained from scratch to excel at handling domain-specific tasks. In this work, we explore an alternative strategy of continual pre-training as a means to develop domain-specific LLMs. We introduce FinPythia-6.9B, developed through domain-adaptive continual pre-training on the financial domain. Continual pre-trained FinPythia showcases consistent improvements on financial tasks over the original foundational model. We further explore simple but effective data selection strategies for continual pre-training. Our data selection strategies outperforms vanilla continual pre-training's performance with just 10% of corpus size and cost, without any degradation on open-domain standard tasks. Our work proposes an alternative solution to building domain-specific LLMs from scratch in a cost-effective manner."", ""Title: Efficient Continual Pre-training for Building Domain Specific Large\n  Language Models.\nPublished_date: 2023-11-14."", ""Summary: Pre-trained language models (PLM) have revolutionized the NLP landscape, achieving stellar performances across diverse tasks. These models, while benefiting from vast training data, often require fine-tuning on specific data to cater to distinct downstream tasks. However, this data adaptation process has inherent security and privacy concerns, primarily when leveraging user-generated, device-residing data. Federated learning (FL) provides a solution, allowing collaborative model fine-tuning without centralized data collection. However, applying FL to finetune PLMs is hampered by challenges, including restricted model parameter access, high computational requirements, and communication overheads. This paper introduces Federated Black-box Prompt Tuning (FedBPT), a framework designed to address these challenges. FedBPT does not require the clients to access the model parameters. By focusing on training optimal prompts and utilizing gradient-free optimization methods, FedBPT"", ""Summary: Despite the recent observation that large language models (LLMs) can store substantial factual knowledge, there is a limited understanding of the mechanisms of how they acquire factual knowledge through pretraining. This work addresses this gap by studying how LLMs acquire factual knowledge during pretraining. The findings reveal several important insights into the dynamics of factual knowledge acquisition during pretraining. First, counterintuitively, we observe that pretraining on more data shows no significant improvement in the model's capability to acquire and maintain factual knowledge. Next, there is a power-law relationship between training steps and forgetting of memorization and generalization of factual knowledge, and LLMs trained with duplicated training data exhibit faster forgetting. Third, training LLMs with larger batch sizes can enhance the models' robustness to forgetting. Overall, our observations suggest that factual knowledge acquisition in LLM"", ""Summary: Among the various pre-trained neural language models that are popular today, dropout is already an indispensable regularization technique. To solve the inconsistency between training and inference caused by the randomness of dropout, some studies use consistency training to regularize dropout at the output layer. In this paper, we propose a novel Layer-wise Regularized Dropout (LR-Drop), which is specially designed for Transformer-based Language models. Specifically, LR-Drop layer-wise regularizes each Transformer layer using the consistency training strategy. Each training sample passes through the two siamese sub-models sampled by dropout, and then LR-Drop forces the hidden states, multi-head attention matrices, and output distribution of the two siamese sub-models to be consistent. The proposed LR-Drop can be regarded as a \""self-distillation\"" framework, in which each sub-model generated by dropout is the other's \""teacher\"" model and \""student\"" model. Through extensive""]"
The RLMEC method introduces a token-level RL objective. How could this fine-grained reward system be integrated with the 'Evol-Instruct' methodology from the 'WizardCoder' paper to create more complex and accurate code generation instructions?,"abs-2401.06081v2,abs-2306.08568v1",Synthesis & Multi-Hop Reasoning Questions,"Title: Improving Large Language Models via Fine-grained Reinforcement Learning
  with Minimum Editing Constraint 
Summary: Reinforcement learning (RL) has been widely used in training large language
models (LLMs) for preventing unexpected outputs, eg reducing harmfulness and
errors. However, existing RL methods mostly adopt the instance-level reward,
which is unable to provide fine-grained supervision for complex reasoning
tasks, and can not focus on the few key tokens that lead to the incorrectness.
To address it, we propose a new RL method named RLMEC that incorporates a
generative model as the reward model, which is trained by the erroneous
solution rewriting task under the minimum editing constraint, and can produce
token-level rewards for RL training. Based on the generative reward model, we
design the token-level RL objective for training and an imitation-based
regularization for stabilizing RL process. And the both objectives focus on the
learning of the key tokens for the erroneous solution, reducing the effect of
other unimportant tokens. The experiment results on mathematical tasks and
question-answering tasks have demonstrated the effectiveness of our approach.
Our code and data are available at https://github.com/RUCAIBox/RLMEC. 

Title: WizardCoder: Empowering Code Large Language Models with Evol-Instruct 
Summary: Code Large Language Models (Code LLMs), such as StarCoder, have demonstrated
exceptional performance in code-related tasks. However, most existing models
are solely pre-trained on extensive raw code data without instruction
fine-tuning. In this paper, we introduce WizardCoder, which empowers Code LLMs
with complex instruction fine-tuning, by adapting the Evol-Instruct method to
the domain of code. Through comprehensive experiments on four prominent code
generation benchmarks, namely HumanEval, HumanEval+, MBPP, and DS-1000, we
unveil the exceptional capabilities of our model. It surpasses all other
open-source Code LLMs by a substantial margin. Moreover, our model even
outperforms the largest closed LLMs, Anthropic's Claude and Google's Bard, on
HumanEval and HumanEval+. Our code, model weights, and data are public at
https://github.com/nlpxucan/WizardLM 

","To integrate the RLMEC (Reinforcement Learning with Model Evidence) method's token-level reward objective with the 'Evol-Instruct' methodology of 'WizardCoder', one could leverage the Evol-Instruct framework’s ability to dynamically adjust instruction fine-tuning based on model performance. By integrating RLMEC, which provides a more detailed and context-aware reward signal at the token level, 'Evol-Instruct' can generate instructions that are not only semantically coherent but also highly relevant to specific code generation tasks, thereby enhancing the quality and accuracy of generated code.

Semi-Instruct, another approach mentioned in the literature, could be seen as a complementary strategy for bridging natural and self-instruction methods. Combining RLMEC with Semi-Instruct might allow for more flexible instruction adaptation, where instructions are dynamically refined based on both model behavior during inference and user feedback or performance data, further improving code generation accuracy and complexity.","abs-2306.08568v1, abs-2310.10698v2, abs-2403.00338v1, abs-2308.01240v1, abs-2310.18376v4","[""Title: WizardCoder: Empowering Code Large Language Models with Evol-Instruct.\nPublished_date: 2023-06-14.\nSummary: Code Large Language Models (Code LLMs), such as StarCoder, have demonstrated exceptional performance in code-related tasks. However, most existing models are solely pre-trained on extensive raw code data without instruction fine-tuning. In this paper, we introduce WizardCoder, which empowers Code LLMs with complex instruction fine-tuning, by adapting the Evol-Instruct method to the domain of code. Through comprehensive experiments on four prominent code generation benchmarks, namely HumanEval, HumanEval+, MBPP, and DS-1000, we unveil the exceptional capabilities of our model. It surpasses all other open-source Code LLMs by a substantial margin. Moreover, our model even outperforms the largest closed LLMs, Anthropic's Claude and Google's Bard, on HumanEval and HumanEval+. Our code, model weights, and data are public at https://github.com/nlpxucan/WizardLM"", ""Title: Bridging Code Semantic and LLMs: Semantic Chain-of-Thought Prompting for\n  Code Generation.\nPublished_date: 2023-10-16."", ""Title: Semi-Instruct: Bridging Natural-Instruct and Self-Instruct for Code\n  Large Language Models.\nPublished_date: 2024-03-01."", ""Title: Evaluating Instruction-Tuned Large Language Models on Code Comprehension\n  and Generation.\nPublished_date: 2023-08-02."", ""Title: SQLformer: Deep Auto-Regressive Query Graph Generation for Text-to-SQL\n  Translation.\nPublished_date: 2023-10-27.""]"
What is the core idea behind the 'Token-Level Masking' (TLM) training strategy for Transformers?,abs-2310.18738v1,Summarization / Purpose Identification Questions,"Title: TLM: Token-Level Masking for Transformers 
Summary: Structured dropout approaches, such as attention dropout and DropHead, have
been investigated to regularize the multi-head attention mechanism in
Transformers. In this paper, we propose a new regularization scheme based on
token-level rather than structure-level to reduce overfitting. Specifically, we
devise a novel Token-Level Masking (TLM) training strategy for Transformers to
regularize the connections of self-attention, which consists of two masking
techniques that are effective and easy to implement. The underlying idea is to
manipulate the connections between tokens in the multi-head attention via
masking, where the networks are forced to exploit partial neighbors'
information to produce a meaningful representation. The generality and
effectiveness of TLM are thoroughly evaluated via extensive experiments on 4
diversified NLP tasks across 18 datasets, including natural language
understanding benchmark GLUE, ChineseGLUE, Chinese Grammatical Error
Correction, and data-to-text generation. The results indicate that TLM can
consistently outperform attention dropout and DropHead, e.g., it increases by
0.5 points relative to DropHead with BERT-large on GLUE. Moreover, TLM can
establish a new record on the data-to-text benchmark Rotowire (18.93 BLEU). Our
code will be publicly available at https://github.com/Young1993/tlm. 

","The Token-Level Masking (TLM) training strategy for Transformers proposes a novel approach to regularize the multi-head attention mechanism by manipulating the connections between tokens through masking techniques. This forces the network to rely on partial neighbors' information, thereby reducing overfitting and improving the model's generalization capability across various natural language processing tasks.","abs-2310.18738v1, abs-2412.05225v1, abs-2312.06099v1, abs-2406.02338v1, abs-2309.01868v1","[""Summary: Structured dropout approaches, such as attention dropout and DropHead, have been investigated to regularize the multi-head attention mechanism in Transformers. In this paper, we propose a new regularization scheme based on token-level rather than structure-level to reduce overfitting. Specifically, we devise a novel Token-Level Masking (TLM) training strategy for Transformers to regularize the connections of self-attention, which consists of two masking techniques that are effective and easy to implement. The underlying idea is to manipulate the connections between tokens in the multi-head attention via masking, where the networks are forced to exploit partial neighbors' information to produce a meaningful representation. The generality and effectiveness of TLM are thoroughly evaluated via extensive experiments on 4 diversified NLP tasks across 18 datasets, including natural language understanding benchmark GLUE, ChineseGLUE, Chinese Grammatical Error Correction, and"", ""Summary: Large Language Models (LLMs) based on transformers achieve cutting-edge results on a variety of applications. However, their enormous size and processing requirements make deployment on devices with constrained resources extremely difficult. Among various efficiency considerations, model binarization and Early Exit (EE) are common effective solutions. However, binarization may lead to performance loss due to reduced precision affecting gradient estimation and parameter updates. Besides, the present early-exit mechanisms are still in the nascent stages of research. To ameliorate these issues, we propose Binarized Early Exit Transformer (BEExformer), the first-ever selective learning transformer architecture to combine early exit with binarization for textual inference. It improves the binarization process through a differentiable second-order approximation to the impulse function. This enables gradient computation concerning both the sign as well as the magnitude of the"", ""based on Transformer models. Results and Conclusion The proposed approach achieved state-of-the-art performance for 5 out of 7 major clinical NLP tasks using one unified generative LLM. Our approach outperformed previous task-specific transformer models by ~3% for concept extraction and 7% for relation extraction applied to social determinants of health, 3.4% for clinical concept normalization, 3.4~10% for clinical abbreviation disambiguation, and 5.5~9% for natural language inference. Our approach also outperformed a previously developed prompt-based machine reading comprehension (MRC) model, GatorTron-MRC, for clinical concept and relation extraction. The proposed approach can deliver the ``one model for all`` promise from training to deployment using a unified generative LLM."", ""Title: Linguistic Fingerprint in Transformer Models: How Language Variation\n  Influences Parameter Selection in Irony Detection.\nPublished_date: 2024-06-04."", ""Summary: The rapid advancement of large language models, such as the Generative Pre-trained Transformer (GPT) series, has had significant implications across various disciplines. In this study, we investigate the potential of the state-of-the-art large language model (GPT-4) for planning tasks. We explore its effectiveness in multiple planning subfields, highlighting both its strengths and limitations. Through a comprehensive examination, we identify areas where large language models excel in solving planning problems and reveal the constraints that limit their applicability. Our empirical analysis focuses on GPT-4's performance in planning domain extraction, graph search path planning, and adversarial planning. We then propose a way of fine-tuning a domain-specific large language model to improve its Chain of Thought (CoT) capabilities for the above-mentioned tasks. The results provide valuable insights into the potential applications of large language models in the planning domain""]"
What is the stated pairwise classification accuracy for the joint training approach on the Newsela dataset in the 'Prompt-based Learning for Text Readability Assessment' paper?,abs-2302.13139v2,Direct Fact Retrieval & Definition Questions,"Title: Prompt-based Learning for Text Readability Assessment 
Summary: We propose the novel adaptation of a pre-trained seq2seq model for
readability assessment. We prove that a seq2seq model - T5 or BART - can be
adapted to discern which text is more difficult from two given texts
(pairwise). As an exploratory study to prompt-learn a neural network for text
readability in a text-to-text manner, we report useful tips for future work in
seq2seq training and ranking-based approach to readability assessment.
Specifically, we test nine input-output formats/prefixes and show that they can
significantly influence the final model performance.
  Also, we argue that the combination of text-to-text training and pairwise
ranking setup 1) enables leveraging multiple parallel text simplification data
for teaching readability and 2) trains a neural model for the general concept
of readability (therefore, better cross-domain generalization). At last, we
report a 99.6% pairwise classification accuracy on Newsela and a 98.7% for
OneStopEnglish, through a joint training approach. 

",The joint training approach reported a 99.6% pairwise classification accuracy on the Newsela dataset in the 'Prompt-based Learning for Text Readability Assessment' paper.,"abs-2302.13139v2, abs-2308.15010v1, abs-2312.06099v1","[""Summary: We propose the novel adaptation of a pre-trained seq2seq model for readability assessment. We prove that a seq2seq model - T5 or BART - can be adapted to discern which text is more difficult from two given texts (pairwise). As an exploratory study to prompt-learn a neural network for text readability in a text-to-text manner, we report useful tips for future work in seq2seq training and ranking-based approach to readability assessment. Specifically, we test nine input-output formats/prefixes and show that they can significantly influence the final model performance.   Also, we argue that the combination of text-to-text training and pairwise ranking setup 1) enables leveraging multiple parallel text simplification data for teaching readability and 2) trains a neural model for the general concept of readability (therefore, better cross-domain generalization). At last, we report a 99.6% pairwise classification accuracy on Newsela and a 98.7% for OneStopEnglish, through a joint"", ""cross-domain generalization). At last, we report a 99.6% pairwise classification accuracy on Newsela and a 98.7% for OneStopEnglish, through a joint training approach."", ""Summary: Text classification is one of the most imperative tasks in natural language processing (NLP). Recent advances with pre-trained language models (PLMs) have shown remarkable success on this task. However, the satisfying results obtained by PLMs heavily depend on the large amounts of task-specific labeled data, which may not be feasible in many application scenarios due to data access and privacy constraints. The recently-proposed prompt-based fine-tuning paradigm improves the performance of PLMs for few-shot text classification with task-specific templates. Yet, it is unclear how the prompting knowledge can be transferred across tasks, for the purpose of mutual reinforcement. We propose TransPrompt v2, a novel transferable prompting framework for few-shot learning across similar or distant text classification tasks. For learning across similar tasks, we employ a multi-task meta-knowledge acquisition (MMA) procedure to train a meta-learner that captures the cross-task"", ""Summary: Objective To solve major clinical natural language processing (NLP) tasks using a unified text-to-text learning architecture based on a generative large language model (LLM) via prompt tuning. Methods We formulated 7 key clinical NLP tasks as text-to-text learning and solved them using one unified generative clinical LLM, GatorTronGPT, developed using GPT-3 architecture and trained with up to 20 billion parameters. We adopted soft prompts (i.e., trainable vectors) with frozen LLM, where the LLM parameters were not updated (i.e., frozen) and only the vectors of soft prompts were updated, known as prompt tuning. We added additional soft prompts as a prefix to the input layer, which were optimized during the prompt tuning. We evaluated the proposed method using 7 clinical NLP tasks and compared them with previous task-specific solutions based on Transformer models. Results and Conclusion The proposed approach achieved state-of-the-art performance for 5 out of 7 major clinical"", ""based on Transformer models. Results and Conclusion The proposed approach achieved state-of-the-art performance for 5 out of 7 major clinical NLP tasks using one unified generative LLM. Our approach outperformed previous task-specific transformer models by ~3% for concept extraction and 7% for relation extraction applied to social determinants of health, 3.4% for clinical concept normalization, 3.4~10% for clinical abbreviation disambiguation, and 5.5~9% for natural language inference. Our approach also outperformed a previously developed prompt-based machine reading comprehension (MRC) model, GatorTron-MRC, for clinical concept and relation extraction. The proposed approach can deliver the ``one model for all`` promise from training to deployment using a unified generative LLM.""]"
