Question,Source Article Index,Question Type,Summary,qwen2.5:3b,documentIDs,context_retrieved
Contrast the methods used to handle different data modalities in Prism (abs-2406.14544v1) for VLMs and in Broiler-Net (abs-2401.12176v1) for poultry behavior analysis.,"abs-2406.14544v1,abs-2401.12176v1",Comparative & Contrastive,"Title: Prism: A Framework for Decoupling and Assessing the Capabilities of VLMs 
Summary: Vision Language Models (VLMs) demonstrate remarkable proficiency in
addressing a wide array of visual questions, which requires strong perception
and reasoning faculties. Assessing these two competencies independently is
crucial for model refinement, despite the inherent difficulty due to the
intertwined nature of seeing and reasoning in existing VLMs. To tackle this
issue, we present Prism, an innovative framework designed to disentangle the
perception and reasoning processes involved in visual question solving. Prism
comprises two distinct stages: a perception stage that utilizes a VLM to
extract and articulate visual information in textual form, and a reasoning
stage that formulates responses based on the extracted visual information using
a Large Language Model (LLM). This modular design enables the systematic
comparison and assessment of both proprietary and open-source VLM for their
perception and reasoning strengths. Our analytical framework provides several
valuable insights, underscoring Prism's potential as a cost-effective solution
for vision-language tasks. By combining a streamlined VLM focused on perception
with a powerful LLM tailored for reasoning, Prism achieves superior results in
general vision-language tasks while substantially cutting down on training and
operational expenses. Quantitative evaluations show that Prism, when configured
with a vanilla 2B LLaVA and freely accessible GPT-3.5, delivers performance on
par with VLMs $10 \times$ larger on the rigorous multimodal benchmark MMStar.
The project is released at: https://github.com/SparksJoe/Prism. 

Title: Broiler-Net: A Deep Convolutional Framework for Broiler Behavior
  Analysis in Poultry Houses 
Summary: Detecting anomalies in poultry houses is crucial for maintaining optimal
chicken health conditions, minimizing economic losses and bolstering
profitability. This paper presents a novel real-time framework for analyzing
chicken behavior in cage-free poultry houses to detect abnormal behaviors.
Specifically, two significant abnormalities, namely inactive broiler and
huddling behavior, are investigated in this study. The proposed framework
comprises three key steps: (1) chicken detection utilizing a state-of-the-art
deep learning model, (2) tracking individual chickens across consecutive frames
with a fast tracker module, and (3) detecting abnormal behaviors within the
video stream. Experimental studies are conducted to evaluate the efficacy of
the proposed algorithm in accurately assessing chicken behavior. The results
illustrate that our framework provides a precise and efficient solution for
real-time anomaly detection, facilitating timely interventions to maintain
chicken health and enhance overall productivity on poultry farms. Github:
https://github.com/TaherehZarratEhsan/Chicken-Behavior-Analysis 

","In Prism, the approach leverages video data from online repositories to learn joint representations of text, pose, and IMU data through a multi-modal, multitask, and contrastive-based framework, aiming to improve wearable activity recognition (HAR). Broiler-Net addresses the scarcity of labeled sensor data for poultry behavior analysis by integrating the high-quality data collected by numerous Roadside Units (RSUs) into federated learning for self-supervised scene flow estimation. While both methods use multimodal inputs, they differ in their specific applications and training paradigms.","abs-2403.11771v1, abs-2406.01316v2, abs-2401.12862v2, abs-2401.11489v1","[""Summary: Previous studies have shown that it is possible to map brain activation data of subjects viewing images onto the feature representation space of not only vision models (modality-specific decoding) but also language models (cross-modal decoding). In this work, we introduce and use a new large-scale fMRI dataset (~8,500 trials per subject) of people watching both images and text descriptions of such images. This novel dataset enables the development of modality-agnostic decoders: a single decoder that can predict which stimulus a subject is seeing, irrespective of the modality (image or text) in which the stimulus is presented. We train and evaluate such decoders to map brain signals onto stimulus representations from a large range of publicly available vision, language and multimodal (vision+language) models. Our findings reveal that (1) modality-agnostic decoders perform as well as (and sometimes even better than) modality-specific decoders (2) modality-agnostic decoders"", ""Summary: Due to the scarcity of labeled sensor data in HAR, prior research has turned to video data to synthesize Inertial Measurement Units (IMU) data, capitalizing on its rich activity annotations. However, generating IMU data from videos presents challenges for HAR in real-world settings, attributed to the poor quality of synthetic IMU data and its limited efficacy in subtle, fine-grained motions. In this paper, we propose Multi$^3$Net, our novel multi-modal, multitask, and contrastive-based framework approach to address the issue of limited data. Our pretraining procedure uses videos from online repositories, aiming to learn joint representations of text, pose, and IMU simultaneously. By employing video data and contrastive learning, our method seeks to enhance wearable HAR performance, especially in recognizing subtle activities.Our experimental findings validate the effectiveness of our approach in improving HAR performance with IMU data. We demonstrate that models trained with"", ""that (1) modality-agnostic decoders perform as well as (and sometimes even better than) modality-specific decoders (2) modality-agnostic decoders mapping brain data onto representations from unimodal models perform as well as decoders relying on multimodal representations (3) while language and low-level visual (occipital) brain regions are best at decoding text and image stimuli, respectively, high-level visual (temporal) regions perform well on both stimulus types."", ""Summary: Roadside unit (RSU) can significantly improve the safety and robustness of autonomous vehicles through Vehicle-to-Everything (V2X) communication. Currently, the usage of a single RSU mainly focuses on real-time inference and V2X collaboration, while neglecting the potential value of the high-quality data collected by RSU sensors. Integrating the vast amounts of data from numerous RSUs can provide a rich source of data for model training. However, the absence of ground truth annotations and the difficulty of transmitting enormous volumes of data are two inevitable barriers to fully exploiting this hidden value. In this paper, we introduce FedRSU, an innovative federated learning framework for self-supervised scene flow estimation. In FedRSU, we present a recurrent self-supervision training paradigm, where for each RSU, the scene flow prediction of points at every timestamp can be supervised by its subsequent future multi-modality observation. Another key component of FedRSU is"", ""images. By employing this combination, the temporal variance inherent in conventional image pair comparisons is effectively mitigated. The efficacy of the MapChange framework has been empirically validated through comprehensive testing on two public datasets. These tests have demonstrated the framework's marked superiority over existing state-of-the-art SCD methods.""]"
How do the data augmentation strategies differ between SAMAug-C for medical image classification (abs-2406.11026v1) and UnDeM for image demoireing (abs-2401.02719v1)?,"abs-2406.11026v1,abs-2401.02719v1",Comparative & Contrastive,"Title: Boosting Medical Image Classification with Segmentation Foundation Model 
Summary: The Segment Anything Model (SAM) exhibits impressive capabilities in
zero-shot segmentation for natural images. Recently, SAM has gained a great
deal of attention for its applications in medical image segmentation. However,
to our best knowledge, no studies have shown how to harness the power of SAM
for medical image classification. To fill this gap and make SAM a true
``foundation model'' for medical image analysis, it is highly desirable to
customize SAM specifically for medical image classification. In this paper, we
introduce SAMAug-C, an innovative augmentation method based on SAM for
augmenting classification datasets by generating variants of the original
images. The augmented datasets can be used to train a deep learning
classification model, thereby boosting the classification performance.
Furthermore, we propose a novel framework that simultaneously processes raw and
SAMAug-C augmented image input, capitalizing on the complementary information
that is offered by both. Experiments on three public datasets validate the
effectiveness of our new approach. 

Title: Learning Image Demoireing from Unpaired Real Data 
Summary: This paper focuses on addressing the issue of image demoireing. Unlike the
large volume of existing studies that rely on learning from paired real data,
we attempt to learn a demoireing model from unpaired real data, i.e., moire
images associated with irrelevant clean images. The proposed method, referred
to as Unpaired Demoireing (UnDeM), synthesizes pseudo moire images from
unpaired datasets, generating pairs with clean images for training demoireing
models. To achieve this, we divide real moire images into patches and group
them in compliance with their moire complexity. We introduce a novel moire
generation framework to synthesize moire images with diverse moire features,
resembling real moire patches, and details akin to real moire-free images.
Additionally, we introduce an adaptive denoise method to eliminate the
low-quality pseudo moire images that adversely impact the learning of
demoireing models. We conduct extensive experiments on the commonly-used FHDMi
and UHDM datasets. Results manifest that our UnDeM performs better than
existing methods when using existing demoireing models such as MBCNN and
ESDNet-L. Code: https://github.com/zysxmu/UnDeM 

","No Answer.

The provided documents do not contain information about data augmentation strategies for either SAMAug-C or UnDeM. They discuss the application of Segment Anything Model (SAM) and its variants in medical image classification, as well as an approach to image de-moireing using a different method called UnDeM, but there is no mention of their respective data augmentation strategies.","abs-2406.11026v1, abs-2404.06362v2, abs-2411.06315v1, abs-2401.04575v2","[""Summary: The Segment Anything Model (SAM) exhibits impressive capabilities in zero-shot segmentation for natural images. Recently, SAM has gained a great deal of attention for its applications in medical image segmentation. However, to our best knowledge, no studies have shown how to harness the power of SAM for medical image classification. To fill this gap and make SAM a true ``foundation model'' for medical image analysis, it is highly desirable to customize SAM specifically for medical image classification. In this paper, we introduce SAMAug-C, an innovative augmentation method based on SAM for augmenting classification datasets by generating variants of the original images. The augmented datasets can be used to train a deep learning classification model, thereby boosting the classification performance. Furthermore, we propose a novel framework that simultaneously processes raw and SAMAug-C augmented image input, capitalizing on the complementary information that is offered by"", ""Summary: The Segment Anything Model (SAM) and CLIP are remarkable vision foundation models (VFMs). SAM, a prompt driven segmentation model, excels in segmentation tasks across diverse domains, while CLIP is renowned for its zero shot recognition capabilities. However, their unified potential has not yet been explored in medical image segmentation. To adapt SAM to medical imaging, existing methods primarily rely on tuning strategies that require extensive data or prior prompts tailored to the specific task, making it particularly challenging when only a limited number of data samples are available. This work presents an in depth exploration of integrating SAM and CLIP into a unified framework for medical image segmentation. Specifically, we propose a simple unified framework, SaLIP, for organ segmentation. Initially, SAM is used for part based segmentation within the image, followed by CLIP to retrieve the mask corresponding to the region of interest (ROI) from the pool of SAM"", ""framework that simultaneously processes raw and SAMAug-C augmented image input, capitalizing on the complementary information that is offered by both. Experiments on three public datasets validate the effectiveness of our new approach."", ""Summary: Medical brain imaging relies heavily on image registration to accurately curate structural boundaries of brain features for various healthcare applications. Deep learning models have shown remarkable performance in image registration in recent years. Still, they often struggle to handle the diversity of 3D brain volumes, challenged by their structural and contrastive variations and their imaging domains. In this work, we present NeuReg, a Neuro-inspired 3D image registration architecture with the feature of domain invariance. NeuReg generates domain-agnostic representations of imaging features and incorporates a shifting window-based Swin Transformer block as the encoder. This enables our model to capture the variations across brain imaging modalities and species. We demonstrate a new benchmark in multi-domain publicly available datasets comprising human and mouse 3D brain volumes. Extensive experiments reveal that our model (NeuReg) outperforms the existing baseline deep"", ""Summary: Vision and vision-language applications of neural networks, such as image classification and captioning, rely on large-scale annotated datasets that require non-trivial data-collecting processes. This time-consuming endeavor hinders the emergence of large-scale datasets, limiting researchers and practitioners to a small number of choices. Therefore, we seek more efficient ways to collect and annotate images. Previous initiatives have gathered captions from HTML alt-texts and crawled social media postings, but these data sources suffer from noise, sparsity, or subjectivity. For this reason, we turn to commercial shopping websites whose data meet three criteria: cleanliness, informativeness, and fluency. We introduce the Let's Go Shopping (LGS) dataset, a large-scale public dataset with 15 million image-caption pairs from publicly available e-commerce websites. When compared with existing general-domain datasets, the LGS images focus on the foreground object and have less""]"
Compare the methods used to generate synthetic data in 'Synthesize Step-by-Step' for Chart VQA (abs-2403.16385v2) and 'UnDeM' for image demoireing (abs-2401.02719v1).,"abs-2403.16385v2,abs-2401.02719v1",Comparative & Contrastive,"Title: Synthesize Step-by-Step: Tools, Templates and LLMs as Data Generators
  for Reasoning-Based Chart VQA 
Summary: Understanding data visualizations like charts and plots requires reasoning
about both visual elements and numerics. Although strong in extractive
questions, current chart visual question answering (chart VQA) models suffer on
complex reasoning questions. In this work, we address the lack of reasoning
ability by data augmentation. We leverage Large Language Models (LLMs), which
have shown to have strong reasoning ability, as an automatic data annotator
that generates question-answer annotations for chart images. The key innovation
in our method lies in the Synthesize Step-by-Step strategy: our LLM-based data
generator learns to decompose the complex question into step-by-step
sub-questions (rationales), which are then used to derive the final answer
using external tools, i.e. Python. This step-wise generation procedure is
trained on synthetic data generated using a template-based QA generation
pipeline. Experimental results highlight the significance of the proposed
step-by-step generation. By training with the LLM-augmented data (LAMENDA), we
significantly enhance the chart VQA models, achieving the state-of-the-art
accuracy on the ChartQA and PlotQA datasets. In particular, our approach
improves the accuracy of the previous state-of-the-art approach from 38% to 54%
on the human-written questions in the ChartQA dataset, which needs strong
reasoning. We hope our work underscores the potential of synthetic data and
encourages further exploration of data augmentation using LLMs for
reasoning-heavy tasks. 

Title: Learning Image Demoireing from Unpaired Real Data 
Summary: This paper focuses on addressing the issue of image demoireing. Unlike the
large volume of existing studies that rely on learning from paired real data,
we attempt to learn a demoireing model from unpaired real data, i.e., moire
images associated with irrelevant clean images. The proposed method, referred
to as Unpaired Demoireing (UnDeM), synthesizes pseudo moire images from
unpaired datasets, generating pairs with clean images for training demoireing
models. To achieve this, we divide real moire images into patches and group
them in compliance with their moire complexity. We introduce a novel moire
generation framework to synthesize moire images with diverse moire features,
resembling real moire patches, and details akin to real moire-free images.
Additionally, we introduce an adaptive denoise method to eliminate the
low-quality pseudo moire images that adversely impact the learning of
demoireing models. We conduct extensive experiments on the commonly-used FHDMi
and UHDM datasets. Results manifest that our UnDeM performs better than
existing methods when using existing demoireing models such as MBCNN and
ESDNet-L. Code: https://github.com/zysxmu/UnDeM 

","No Answer.

The provided documents do not contain any information about the method used to generate synthetic data for ""UnDeM"" or any other paper titled ""UnDeM."" The relevant document is specifically about generating synthetic data for Chart VQA in step-by-step manner. There is no comparison possible between methods as neither document addresses the requested topic.","abs-2403.16385v2, abs-2406.11003v1, abs-2406.14544v1","[""Title: Synthesize Step-by-Step: Tools, Templates and LLMs as Data Generators\n  for Reasoning-Based Chart VQA.\nPublished_date: 2024-03-25."", ""is trained on synthetic data generated using a template-based QA generation pipeline. Experimental results highlight the significance of the proposed step-by-step generation. By training with the LLM-augmented data (LAMENDA), we significantly enhance the chart VQA models, achieving the state-of-the-art accuracy on the ChartQA and PlotQA datasets. In particular, our approach improves the accuracy of the previous state-of-the-art approach from 38% to 54% on the human-written questions in the ChartQA dataset, which needs strong reasoning. We hope our work underscores the potential of synthetic data and encourages further exploration of data augmentation using LLMs for reasoning-heavy tasks."", ""within the dataset. Empirical results demonstrate the accuracy and reliability of our method in group environments. This provides mechanisms for significant advances in behavior and interaction analysis in educational and professional training applications in dynamic and unstructured environments."", ""Summary: This study presents a novel framework for 3D gaze tracking tailored for mixed-reality settings, aimed at enhancing joint attention and collaborative efforts in team-based scenarios. Conventional gaze tracking, often limited by monocular cameras and traditional eye-tracking apparatus, struggles with simultaneous data synchronization and analysis from multiple participants in group contexts. Our proposed framework leverages state-of-the-art computer vision and machine learning techniques to overcome these obstacles, enabling precise 3D gaze estimation without dependence on specialized hardware or complex data fusion. Utilizing facial recognition and deep learning, the framework achieves real-time, tracking of gaze patterns across several individuals, addressing common depth estimation errors, and ensuring spatial and identity consistency within the dataset. Empirical results demonstrate the accuracy and reliability of our method in group environments. This provides mechanisms"", ""Title: Prism: A Framework for Decoupling and Assessing the Capabilities of VLMs.\nPublished_date: 2024-06-20.""]"
