Question,Source Article Index,Question Type,Summary,qwen2.5:3b,documentIDs,context_retrieved
What was the inter-annotator agreement score calculated for the two annotators who evaluated CORE-GPT's performance?,abs-2307.04683v1,Negative / Unanswerable Questions,"Title: CORE-GPT: Combining Open Access research and large language models for
  credible, trustworthy question answering 
Summary: In this paper, we present CORE-GPT, a novel question-answering platform that
combines GPT-based language models and more than 32 million full-text open
access scientific articles from CORE. We first demonstrate that GPT3.5 and GPT4
cannot be relied upon to provide references or citations for generated text. We
then introduce CORE-GPT which delivers evidence-based answers to questions,
along with citations and links to the cited papers, greatly increasing the
trustworthiness of the answers and reducing the risk of hallucinations.
CORE-GPT's performance was evaluated on a dataset of 100 questions covering the
top 20 scientific domains in CORE, resulting in 100 answers and links to 500
relevant articles. The quality of the provided answers and and relevance of the
links were assessed by two annotators. Our results demonstrate that CORE-GPT
can produce comprehensive and trustworthy answers across the majority of
scientific domains, complete with links to genuine, relevant scientific
articles. 

",No Answer. The provided documents do not contain any information regarding the inter-annotator agreement scores or evaluations of CORE-GPT’s performance.,"abs-2301.10684v1, abs-2410.03447v1, abs-2404.00152v2, abs-2403.08607v1, abs-2311.03614v1","[""Title: Consistency is Key: Disentangling Label Variation in Natural Language\n  Processing with Intra-Annotator Agreement.\nPublished_date: 2023-01-25.\nSummary: We commonly use agreement measures to assess the utility of judgements made by human annotators in Natural Language Processing (NLP) tasks. While inter-annotator agreement is frequently used as an indication of label reliability by measuring consistency between annotators, we argue for the additional use of intra-annotator agreement to measure label stability over time. However, in a systematic review, we find that the latter is rarely reported in this field. Calculating these measures can act as important quality control and provide insights into why annotators disagree. We propose exploratory annotation experiments to investigate the relationships between these measures and perceptions of subjectivity and ambiguity in text items."", ""Summary: Transformer-based language models have shown an excellent ability to effectively capture and utilize contextual information. Although various analysis techniques have been used to quantify and trace the contribution of single contextual cues to a target task such as subject-verb agreement or coreference resolution, scenarios in which multiple relevant cues are available in the context remain underexplored. In this paper, we investigate how language models handle gender agreement when multiple gender cue words are present, each capable of independently disambiguating a target gender pronoun. We analyze two widely used Transformer-based models: BERT, an encoder-based, and GPT-2, a decoder-based model. Our analysis employs two complementary approaches: context mixing analysis, which tracks information flow within the model, and a variant of activation patching, which measures the impact of cues on the model's prediction. We find that BERT tends to prioritize the first cue in the"", ""Summary: Despite their general capabilities, LLMs still struggle on biomedical NER tasks, which are difficult due to the presence of specialized terminology and lack of training data. In this work we set out to improve LLM performance on biomedical NER in limited data settings via a new knowledge augmentation approach which incorporates definitions of relevant concepts on-the-fly. During this process, to provide a test bed for knowledge augmentation, we perform a comprehensive exploration of prompting strategies. Our experiments show that definition augmentation is useful for both open source and closed LLMs. For example, it leads to a relative improvement of 15\\% (on average) in GPT-4 performance (F1) across all (six) of our test datasets. We conduct extensive ablations and analyses to demonstrate that our performance improvements stem from adding relevant definitional knowledge. We find that careful prompting strategies also improve LLM performance, allowing them to outperform"", ""patient's record with relevant medical knowledge, MedInsight generates enriched, patient-specific responses tailored for healthcare applications such as diagnosis, treatment recommendations, or patient education. Experiments on the MTSamples dataset validate MedInsight's effectiveness in generating contextually appropriate medical responses. Quantitative evaluation using the Ragas metric and TruLens for answer similarity and answer correctness demonstrates the model's efficacy. Furthermore, human evaluation studies involving Subject Matter Expert (SMEs) confirm MedInsight's utility, with moderate inter-rater agreement on the relevance and correctness of the generated responses."", ""Published_date: 2023-11-06.\nSummary: Books have historically been the primary mechanism through which narratives are transmitted. We have developed a collection of resources for the large-scale analysis of novels, including: (1) an open source end-to-end NLP analysis pipeline for the annotation of novels into a standard XML format, (2) a collection of 49,207 distinct cleaned and annotated novels, and (3) a database with an associated web interface for the large-scale aggregate analysis of these literary works. We describe the major functionalities provided in the annotation system along with their utilities. We present samples of analysis artifacts from our website, such as visualizations of character occurrences and interactions, similar books, representative vocabulary, part of speech statistics, and readability metrics. We also describe the use of the annotated format in qualitative and quantitative analysis across large corpora of novels.""]"
"In the 'PWESuite' paper, what are the three methods developed to build phonetically informed word embeddings?",abs-2304.02541v4,Summarization / Purpose Identification Questions,"Title: PWESuite: Phonetic Word Embeddings and Tasks They Facilitate 
Summary: Mapping words into a fixed-dimensional vector space is the backbone of modern
NLP. While most word embedding methods successfully encode semantic
information, they overlook phonetic information that is crucial for many tasks.
We develop three methods that use articulatory features to build phonetically
informed word embeddings. To address the inconsistent evaluation of existing
phonetic word embedding methods, we also contribute a task suite to fairly
evaluate past, current, and future methods. We evaluate both (1) intrinsic
aspects of phonetic word embeddings, such as word retrieval and correlation
with sound similarity, and (2) extrinsic performance on tasks such as rhyme and
cognate detection and sound analogies. We hope our task suite will promote
reproducibility and inspire future phonetic embedding research. 

",The 'PWESuite' paper develops three methods to create phonetically informed word embeddings using articulatory features. These methods aim to capture and encode the phonetic information that semantic-based methods often overlook in modern NLP tasks.,"abs-2304.02541v4, abs-2305.15380v1, abs-2311.12489v1, abs-2402.03053v1, abs-2305.08655v1","[""Title: PWESuite: Phonetic Word Embeddings and Tasks They Facilitate.\nPublished_date: 2023-04-05.\nSummary: Mapping words into a fixed-dimensional vector space is the backbone of modern NLP. While most word embedding methods successfully encode semantic information, they overlook phonetic information that is crucial for many tasks. We develop three methods that use articulatory features to build phonetically informed word embeddings. To address the inconsistent evaluation of existing phonetic word embedding methods, we also contribute a task suite to fairly evaluate past, current, and future methods. We evaluate both (1) intrinsic aspects of phonetic word embeddings, such as word retrieval and correlation with sound similarity, and (2) extrinsic performance on tasks such as rhyme and cognate detection and sound analogies. We hope our task suite will promote reproducibility and inspire future phonetic embedding research."", ""Title: Sentiment Analysis Using Aligned Word Embeddings for Uralic Languages.\nPublished_date: 2023-05-24.\nSummary: In this paper, we present an approach for translating word embeddings from a majority language into 4 minority languages: Erzya, Moksha, Udmurt and Komi-Zyrian. Furthermore, we align these word embeddings and present a novel neural network model that is trained on English data to conduct sentiment analysis and then applied on endangered language data through the aligned word embeddings. To test our model, we annotated a small sentiment analysis corpus for the 4 endangered languages and Finnish. Our method reached at least 56\\% accuracy for each endangered language. The models and the sentiment corpus will be released together with this paper. Our research shows that state-of-the-art neural models can be used with endangered languages with the only requirement being a dictionary between the endangered language and a majority language."", ""Summary: Very low-resource languages, having only a few million tokens worth of data, are not well-supported by multilingual NLP approaches due to poor quality cross-lingual word representations. Recent work showed that good cross-lingual performance can be achieved if a source language is related to the low-resource target language. However, not all language pairs are related. In this paper, we propose to build multilingual word embeddings (MWEs) via a novel language chain-based approach, that incorporates intermediate related languages to bridge the gap between the distant source and target. We build MWEs one language at a time by starting from the resource rich source and sequentially adding each language in the chain till we reach the target. We extend a semi-joint bilingual approach to multiple languages in order to eliminate the main weakness of previous works, i.e., independently trained monolingual embeddings, by anchoring the target language around the multilingual space. We"", ""Summary: In this work, we present a comprehensive exploration of finetuning Malaysian language models, specifically Llama2 and Mistral, on embedding tasks involving negative and positive pairs. We release two distinct models tailored for Semantic Similarity and Retrieval-Augmented Generation (RAG).   For Semantic Similarity, our 600 million parameter Llama2 model outperforms OpenAI text-embedding-ada-002 across all recall@k metrics for b.cari.com.my, c.cari.com.my, Malay news, and Malaysian Twitter test sets.   In the realm of RAG models, our approach proves competitive with OpenAI text-embedding-ada-002 in the Malaysian context. Notably, our 2 billion parameter Llama2 model achieves superior Recall@5, Recall@10 for the \""Melayu\"" keyword research papers dataset and excels in Recall@3, Recall@5, and Recall@10 for the lom.agc.gov.my dataset.   These findings underscore the effectiveness of our finetuning strategy and highlight the performance gains in both Semantic Similarity and RAG"", ""Summary: Pre-trained Language Model (PLM) is nowadays the mainstay of Unsupervised Sentence Representation Learning (USRL). However, PLMs are sensitive to the frequency information of words from their pre-training corpora, resulting in anisotropic embedding space, where the embeddings of high-frequency words are clustered but those of low-frequency words disperse sparsely. This anisotropic phenomenon results in two problems of similarity bias and information bias, lowering the quality of sentence embeddings. To solve the problems, we fine-tune PLMs by leveraging the frequency information of words and propose a novel USRL framework, namely Sentence Representation Learning with Frequency-induced Adversarial tuning and Incomplete sentence filtering (SLT-FAI). We calculate the word frequencies over the pre-training corpora of PLMs and assign words thresholding frequency labels. With them, (1) we incorporate a similarity discriminator used to distinguish the embeddings of high-frequency""]"
"According to the paper 'Improving Large Language Models via Fine-grained Reinforcement Learning...', what is the name of the proposed RL method and what kind of rewards does it produce?",abs-2401.06081v2,Direct Fact Retrieval & Definition Questions,"Title: Improving Large Language Models via Fine-grained Reinforcement Learning
  with Minimum Editing Constraint 
Summary: Reinforcement learning (RL) has been widely used in training large language
models (LLMs) for preventing unexpected outputs, eg reducing harmfulness and
errors. However, existing RL methods mostly adopt the instance-level reward,
which is unable to provide fine-grained supervision for complex reasoning
tasks, and can not focus on the few key tokens that lead to the incorrectness.
To address it, we propose a new RL method named RLMEC that incorporates a
generative model as the reward model, which is trained by the erroneous
solution rewriting task under the minimum editing constraint, and can produce
token-level rewards for RL training. Based on the generative reward model, we
design the token-level RL objective for training and an imitation-based
regularization for stabilizing RL process. And the both objectives focus on the
learning of the key tokens for the erroneous solution, reducing the effect of
other unimportant tokens. The experiment results on mathematical tasks and
question-answering tasks have demonstrated the effectiveness of our approach.
Our code and data are available at https://github.com/RUCAIBox/RLMEC. 

",No Answer. The provided documents do not contain information about a paper titled 'Improving Large Language Models via Fine-grained Reinforcement Learning...'. None of the documents mention this specific paper or propose an RL method with particular reward types.,"abs-2405.00402v1, abs-2407.12021v2, abs-2306.08568v1, abs-2309.04663v2, abs-2403.15455v2","[""Summary: The alignments of reasoning abilities between smaller and larger Language Models are largely conducted via Supervised Fine-Tuning (SFT) using demonstrations generated from robust Large Language Models (LLMs). Although these approaches deliver more performant models, they do not show sufficiently strong generalization ability as the training only relies on the provided demonstrations.   In this paper, we propose the Self-refine Instruction-tuning method that elicits Smaller Language Models to self-refine their abilities. Our approach is based on a two-stage process, where reasoning abilities are first transferred between LLMs and Small Language Models (SLMs) via Instruction-tuning on demonstrations provided by LLMs, and then the instructed models Self-refine their abilities through preference optimization strategies. In particular, the second phase operates refinement heuristics based on the Direct Preference Optimization algorithm, where the SLMs are elicited to deliver a"", ""Summary: Large language model (LLM) decoding involves generating a sequence of tokens based on a given context, where each token is predicted one at a time using the model's learned probabilities. The typical autoregressive decoding method requires a separate forward pass through the model for each token generated, which is computationally inefficient and poses challenges for deploying LLMs in latency-sensitive scenarios. The main limitations of current decoding methods stem from their inefficiencies and resource demands. Existing approaches either necessitate fine-tuning smaller models, which is resource-intensive, or rely on fixed retrieval schemes to construct drafts for the next tokens, which lack adaptability and fail to generalize across different models and contexts. To address these issues, we introduce a novel methodology called ADED, which accelerates LLM decoding without requiring fine-tuning. Our approach involves an adaptive draft-verification process that evolves over"", ""Title: WizardCoder: Empowering Code Large Language Models with Evol-Instruct.\nPublished_date: 2023-06-14.\nSummary: Code Large Language Models (Code LLMs), such as StarCoder, have demonstrated exceptional performance in code-related tasks. However, most existing models are solely pre-trained on extensive raw code data without instruction fine-tuning. In this paper, we introduce WizardCoder, which empowers Code LLMs with complex instruction fine-tuning, by adapting the Evol-Instruct method to the domain of code. Through comprehensive experiments on four prominent code generation benchmarks, namely HumanEval, HumanEval+, MBPP, and DS-1000, we unveil the exceptional capabilities of our model. It surpasses all other open-source Code LLMs by a substantial margin. Moreover, our model even outperforms the largest closed LLMs, Anthropic's Claude and Google's Bard, on HumanEval and HumanEval+. Our code, model weights, and data are public at https://github.com/nlpxucan/WizardLM"", ""tasks and observe that FIAT performs better than both ICL and fine-tuning at scales ranging from 100-10,000 training examples. We hope that FIAT provides a practical way of harnessing the full potential of LLMs without needing to make a hard choice between learning paradigms."", ""Title: Improving Sampling Methods for Fine-tuning SentenceBERT in Text Streams.\nPublished_date: 2024-03-18.""]"
Contrast the data sources used for training in the 'Text Injection for Neural Contextual Biasing' paper with the data sources used in the 'Cheetah: Natural Language Generation for 517 African Languages' paper.,"abs-2406.02921v2,abs-2401.01053v3",Comparative & Contrastive Questions,"Title: Text Injection for Neural Contextual Biasing 
Summary: Neural contextual biasing effectively improves automatic speech recognition
(ASR) for crucial phrases within a speaker's context, particularly those that
are infrequent in the training data. This work proposes contextual text
injection (CTI) to enhance contextual ASR. CTI leverages not only the paired
speech-text data, but also a much larger corpus of unpaired text to optimize
the ASR model and its biasing component. Unpaired text is converted into
speech-like representations and used to guide the model's attention towards
relevant bias phrases. Moreover, we introduce a contextual text-injected (CTI)
minimum word error rate (MWER) training, which minimizes the expected WER
caused by contextual biasing when unpaired text is injected into the model.
Experiments show that CTI with 100 billion text sentences can achieve up to
43.3% relative WER reduction from a strong neural biasing model. CTI-MWER
provides a further relative improvement of 23.5%. 

Title: Cheetah: Natural Language Generation for 517 African Languages 
Summary: Low-resource African languages pose unique challenges for natural language
processing (NLP) tasks, including natural language generation (NLG). In this
paper, we develop Cheetah, a massively multilingual NLG language model for
African languages. Cheetah supports 517 African languages and language
varieties, allowing us to address the scarcity of NLG resources and provide a
solution to foster linguistic diversity. We demonstrate the effectiveness of
Cheetah through comprehensive evaluations across six generation downstream
tasks. In five of the six tasks, Cheetah significantly outperforms other
models, showcasing its remarkable performance for generating coherent and
contextually appropriate text in a wide range of African languages. We
additionally conduct a detailed human evaluation to delve deeper into the
linguistic capabilities of Cheetah. The introduction of Cheetah has
far-reaching benefits for linguistic diversity. By leveraging pretrained models
and adapting them to specific languages, our approach facilitates the
development of practical NLG applications for African communities. The findings
of this study contribute to advancing NLP research in low-resource settings,
enabling greater accessibility and inclusion for African languages in a rapidly
expanding digital landscape. We publicly release our models for research. 

","No Answer. The provided documents do not contain information about the data sources used for training in the 'Cheetah: Natural Language Generation for 517 African Languages' paper, only details on a text injection method and a Japanese conversation dataset.","abs-2406.02921v2, abs-2310.17312v1, abs-2402.17011v2, abs-2403.19259v1, abs-2410.03447v1","[""Title: Text Injection for Neural Contextual Biasing.\nPublished_date: 2024-06-05."", ""Title: An Ensemble Method Based on the Combination of Transformers with\n  Convolutional Neural Networks to Detect Artificially Generated Text.\nPublished_date: 2023-10-26."", ""Title: DiffuCOMET: Contextual Commonsense Knowledge Diffusion.\nPublished_date: 2024-02-26."", ""Title: J-CRe3: A Japanese Conversation Dataset for Real-world Reference\n  Resolution.\nPublished_date: 2024-03-28."", ""Title: How Language Models Prioritize Contextual Grammatical Cues?.\nPublished_date: 2024-10-04.""]"
