Question,Source Article Index,Question Type,Summary,qwen2.5:3b,documentIDs,context_retrieved
What does CTI stand for in the context of the 'Text Injection for Neural Contextual Biasing' paper?,abs-2406.02921v2,Direct Fact Retrieval & Definition Questions,"Title: Text Injection for Neural Contextual Biasing 
Summary: Neural contextual biasing effectively improves automatic speech recognition
(ASR) for crucial phrases within a speaker's context, particularly those that
are infrequent in the training data. This work proposes contextual text
injection (CTI) to enhance contextual ASR. CTI leverages not only the paired
speech-text data, but also a much larger corpus of unpaired text to optimize
the ASR model and its biasing component. Unpaired text is converted into
speech-like representations and used to guide the model's attention towards
relevant bias phrases. Moreover, we introduce a contextual text-injected (CTI)
minimum word error rate (MWER) training, which minimizes the expected WER
caused by contextual biasing when unpaired text is injected into the model.
Experiments show that CTI with 100 billion text sentences can achieve up to
43.3% relative WER reduction from a strong neural biasing model. CTI-MWER
provides a further relative improvement of 23.5%. 

","CTI stands for Contextual Text-Injection, a method proposed to enhance neural contextual biasing in automatic speech recognition (ASR) models. This technique leverages both paired and unpaired text data to guide the model's attention towards relevant context phrases, leading to significant improvements in reducing word error rates.","abs-2406.02921v2, abs-2301.13714v1, abs-2402.17011v2, abs-2310.17312v1","[""Published_date: 2024-06-05.\nSummary: Neural contextual biasing effectively improves automatic speech recognition (ASR) for crucial phrases within a speaker's context, particularly those that are infrequent in the training data. This work proposes contextual text injection (CTI) to enhance contextual ASR. CTI leverages not only the paired speech-text data, but also a much larger corpus of unpaired text to optimize the ASR model and its biasing component. Unpaired text is converted into speech-like representations and used to guide the model's attention towards relevant bias phrases. Moreover, we introduce a contextual text-injected (CTI) minimum word error rate (MWER) training, which minimizes the expected WER caused by contextual biasing when unpaired text is injected into the model. Experiments show that CTI with 100 billion text sentences can achieve up to 43.3% relative WER reduction from a strong neural biasing model. CTI-MWER provides a further relative improvement of 23.5%."", ""Title: Text Injection for Neural Contextual Biasing.\nPublished_date: 2024-06-05."", ""Title: Recursive Neural Networks with Bottlenecks Diagnose\n  (Non-)Compositionality.\nPublished_date: 2023-01-31."", ""Title: DiffuCOMET: Contextual Commonsense Knowledge Diffusion.\nPublished_date: 2024-02-26."", ""Title: An Ensemble Method Based on the Combination of Transformers with\n  Convolutional Neural Networks to Detect Artificially Generated Text.\nPublished_date: 2023-10-26.""]"
"What is the main problem that the Learnable Singular value Increment (LSI) method, as described in 'Compensate Quantization Errors', aims to solve?",abs-2406.16299v1,Summarization / Purpose Identification Questions,"Title: Compensate Quantization Errors: Make Weights Hierarchical to Compensate
  Each Other 
Summary: Emergent Large Language Models (LLMs) use their extraordinary performance and
powerful deduction capacity to discern from traditional language models.
However, the expenses of computational resources and storage for these LLMs are
stunning, quantization then arises as a trending conversation. To address
accuracy decay caused by quantization, two streams of works in post-training
quantization methods stand out. One uses other weights to compensate existing
quantization error, while the other transfers the quantization difficulty to
other parts in the model. Combining both merits, we introduce Learnable
Singular value Increment (LSI) as an advanced solution. LSI uses Singular Value
Decomposition to extract singular values of the weights and make them learnable
to help weights compensate each other conditioned on activation. Incorporating
LSI with existing techniques, we achieve state-of-the-art performance in
diverse quantization settings, no matter in weight-only, weight-activation or
extremely low bit scenarios. By unleashing the potential of LSI, efficient
finetuning on quantized model is no longer a prohibitive problem. 

","The Learnable Singular Value Increment (LSI) method aims to address the accuracy decay caused by quantization errors in Large Language Models. It does this by using Singular Value Decomposition to make singular values of the weights learnable, allowing them to compensate for each other based on activation, thereby maintaining performance despite quantization.","abs-2406.16299v1, abs-2310.13315v1, abs-2312.05821v4, abs-2401.06081v2","[""Summary: Emergent Large Language Models (LLMs) use their extraordinary performance and powerful deduction capacity to discern from traditional language models. However, the expenses of computational resources and storage for these LLMs are stunning, quantization then arises as a trending conversation. To address accuracy decay caused by quantization, two streams of works in post-training quantization methods stand out. One uses other weights to compensate existing quantization error, while the other transfers the quantization difficulty to other parts in the model. Combining both merits, we introduce Learnable Singular value Increment (LSI) as an advanced solution. LSI uses Singular Value Decomposition to extract singular values of the weights and make them learnable to help weights compensate each other conditioned on activation. Incorporating LSI with existing techniques, we achieve state-of-the-art performance in diverse quantization settings, no matter in weight-only,"", ""Title: Compensate Quantization Errors: Make Weights Hierarchical to Compensate\n  Each Other.\nPublished_date: 2024-06-24."", ""Summary: Quantization is a promising approach for reducing memory overhead and accelerating inference, especially in large pre-trained language model (PLM) scenarios. While having no access to original training data due to security and privacy concerns has emerged the demand for zero-shot quantization. Most of the cutting-edge zero-shot quantization methods primarily 1) apply to computer vision tasks, and 2) neglect of overfitting problem in the generative adversarial learning process, leading to sub-optimal performance. Motivated by this, we propose a novel zero-shot sharpness-aware quantization (ZSAQ) framework for the zero-shot quantization of various PLMs. The key algorithm in solving ZSAQ is the SAM-SGA optimization, which aims to improve the quantization accuracy and model generalization via optimizing a minimax problem. We theoretically prove the convergence rate for the minimax optimization problem and this result can be applied to other nonconvex-PL minimax optimization"", ""Title: ASVD: Activation-aware Singular Value Decomposition for Compressing\n  Large Language Models.\nPublished_date: 2023-12-10."", ""Summary: Reinforcement learning (RL) has been widely used in training large language models (LLMs) for preventing unexpected outputs, eg reducing harmfulness and errors. However, existing RL methods mostly adopt the instance-level reward, which is unable to provide fine-grained supervision for complex reasoning tasks, and can not focus on the few key tokens that lead to the incorrectness. To address it, we propose a new RL method named RLMEC that incorporates a generative model as the reward model, which is trained by the erroneous solution rewriting task under the minimum editing constraint, and can produce token-level rewards for RL training. Based on the generative reward model, we design the token-level RL objective for training and an imitation-based regularization for stabilizing RL process. And the both objectives focus on the learning of the key tokens for the erroneous solution, reducing the effect of other unimportant tokens. The experiment results on mathematical tasks and""]"
Compare the regularization strategies of LR-Drop from 'Layer-wise Regularized Dropout' and TLM from 'Token-Level Masking for Transformers'. How do their core mechanisms differ?,"abs-2402.16361v1,abs-2310.18738v1",Comparative & Contrastive Questions,"Title: Layer-wise Regularized Dropout for Neural Language Models 
Summary: Among the various pre-trained neural language models that are popular today,
dropout is already an indispensable regularization technique. To solve the
inconsistency between training and inference caused by the randomness of
dropout, some studies use consistency training to regularize dropout at the
output layer. In this paper, we propose a novel Layer-wise Regularized Dropout
(LR-Drop), which is specially designed for Transformer-based Language models.
Specifically, LR-Drop layer-wise regularizes each Transformer layer using the
consistency training strategy. Each training sample passes through the two
siamese sub-models sampled by dropout, and then LR-Drop forces the hidden
states, multi-head attention matrices, and output distribution of the two
siamese sub-models to be consistent. The proposed LR-Drop can be regarded as a
""self-distillation"" framework, in which each sub-model generated by dropout is
the other's ""teacher"" model and ""student"" model. Through extensive experiments
on 8 natural language understanding datasets, 6 neural machine translation
datasets, and 1 abstractive summarization dataset (a total of 15 datasets), we
show that LR-Drop achieves superior performances, including state-of-the-art
results. 

Title: TLM: Token-Level Masking for Transformers 
Summary: Structured dropout approaches, such as attention dropout and DropHead, have
been investigated to regularize the multi-head attention mechanism in
Transformers. In this paper, we propose a new regularization scheme based on
token-level rather than structure-level to reduce overfitting. Specifically, we
devise a novel Token-Level Masking (TLM) training strategy for Transformers to
regularize the connections of self-attention, which consists of two masking
techniques that are effective and easy to implement. The underlying idea is to
manipulate the connections between tokens in the multi-head attention via
masking, where the networks are forced to exploit partial neighbors'
information to produce a meaningful representation. The generality and
effectiveness of TLM are thoroughly evaluated via extensive experiments on 4
diversified NLP tasks across 18 datasets, including natural language
understanding benchmark GLUE, ChineseGLUE, Chinese Grammatical Error
Correction, and data-to-text generation. The results indicate that TLM can
consistently outperform attention dropout and DropHead, e.g., it increases by
0.5 points relative to DropHead with BERT-large on GLUE. Moreover, TLM can
establish a new record on the data-to-text benchmark Rotowire (18.93 BLEU). Our
code will be publicly available at https://github.com/Young1993/tlm. 

","The Layer-wise Regularized Dropout (LR-Drop) strategy proposed in ""Layer-wise Regularized Dropout for Neural Language Models"" layer-wise regularizes each Transformer layer using the consistency training strategy, forcing hidden states and output distributions of two siamese sub-models through dropout to be consistent. In contrast, TLM from ""TLM: Token-Level Masking for Transformers"" manipulates connections between tokens in multi-head attention via token-level masking techniques, encouraging partial neighbors' information exploitation to generate meaningful representations.","abs-2310.18738v1, abs-2402.16361v1, abs-2301.02010v1","[""Summary: Structured dropout approaches, such as attention dropout and DropHead, have been investigated to regularize the multi-head attention mechanism in Transformers. In this paper, we propose a new regularization scheme based on token-level rather than structure-level to reduce overfitting. Specifically, we devise a novel Token-Level Masking (TLM) training strategy for Transformers to regularize the connections of self-attention, which consists of two masking techniques that are effective and easy to implement. The underlying idea is to manipulate the connections between tokens in the multi-head attention via masking, where the networks are forced to exploit partial neighbors' information to produce a meaningful representation. The generality and effectiveness of TLM are thoroughly evaluated via extensive experiments on 4 diversified NLP tasks across 18 datasets, including natural language understanding benchmark GLUE, ChineseGLUE, Chinese Grammatical Error Correction, and"", ""Summary: Among the various pre-trained neural language models that are popular today, dropout is already an indispensable regularization technique. To solve the inconsistency between training and inference caused by the randomness of dropout, some studies use consistency training to regularize dropout at the output layer. In this paper, we propose a novel Layer-wise Regularized Dropout (LR-Drop), which is specially designed for Transformer-based Language models. Specifically, LR-Drop layer-wise regularizes each Transformer layer using the consistency training strategy. Each training sample passes through the two siamese sub-models sampled by dropout, and then LR-Drop forces the hidden states, multi-head attention matrices, and output distribution of the two siamese sub-models to be consistent. The proposed LR-Drop can be regarded as a \""self-distillation\"" framework, in which each sub-model generated by dropout is the other's \""teacher\"" model and \""student\"" model. Through extensive"", ""Title: Layer-wise Regularized Dropout for Neural Language Models.\nPublished_date: 2024-02-26."", ""Title: TLM: Token-Level Masking for Transformers.\nPublished_date: 2023-10-28."", ""Title: HIT-SCIR at MMNLU-22: Consistency Regularization for Multilingual Spoken\n  Language Understanding.\nPublished_date: 2023-01-05.\nSummary: Multilingual spoken language understanding (SLU) consists of two sub-tasks, namely intent detection and slot filling. To improve the performance of these two sub-tasks, we propose to use consistency regularization based on a hybrid data augmentation strategy. The consistency regularization enforces the predicted distributions for an example and its semantically equivalent augmentation to be consistent. We conduct experiments on the MASSIVE dataset under both full-dataset and zero-shot settings. Experimental results demonstrate that our proposed method improves the performance on both intent detection and slot filling tasks. Our system\\footnote{The code will be available at \\url{https://github.com/bozheng-hit/MMNLU-22-HIT-SCIR}.} ranked 1st in the MMNLU-22 competition under the full-dataset setting.""]"
"Considering the goal of CORE-GPT to reduce hallucinations and the findings in 'Banishing LLM Hallucinations...', how does the CORE-GPT architecture directly address the issues of generalization and factuality discussed in the other paper?","abs-2307.04683v1,abs-2406.17642v1",Synthesis & Multi-Hop Reasoning Questions,"Title: CORE-GPT: Combining Open Access research and large language models for
  credible, trustworthy question answering 
Summary: In this paper, we present CORE-GPT, a novel question-answering platform that
combines GPT-based language models and more than 32 million full-text open
access scientific articles from CORE. We first demonstrate that GPT3.5 and GPT4
cannot be relied upon to provide references or citations for generated text. We
then introduce CORE-GPT which delivers evidence-based answers to questions,
along with citations and links to the cited papers, greatly increasing the
trustworthiness of the answers and reducing the risk of hallucinations.
CORE-GPT's performance was evaluated on a dataset of 100 questions covering the
top 20 scientific domains in CORE, resulting in 100 answers and links to 500
relevant articles. The quality of the provided answers and and relevance of the
links were assessed by two annotators. Our results demonstrate that CORE-GPT
can produce comprehensive and trustworthy answers across the majority of
scientific domains, complete with links to genuine, relevant scientific
articles. 

Title: Banishing LLM Hallucinations Requires Rethinking Generalization 
Summary: Despite their powerful chat, coding, and reasoning abilities, Large Language
Models (LLMs) frequently hallucinate. Conventional wisdom suggests that
hallucinations are a consequence of a balance between creativity and
factuality, which can be mitigated, but not eliminated, by grounding the LLM in
external knowledge sources. Through extensive systematic experiments, we show
that these traditional approaches fail to explain why LLMs hallucinate in
practice. Specifically, we show that LLMs augmented with a massive Mixture of
Memory Experts (MoME) can easily memorize large datasets of random numbers. We
corroborate these experimental findings with a theoretical construction showing
that simple neural networks trained to predict the next token hallucinate when
the training loss is above a threshold as it usually does in practice when
training on internet scale data. We interpret our findings by comparing against
traditional retrieval methods for mitigating hallucinations. We use our
findings to design a first generation model for removing hallucinations --
Lamini-1 -- that stores facts in a massive mixture of millions of memory
experts that are retrieved dynamically. 

","CORE-GPT addresses the issues of generalization and factuality by providing evidence-based answers with citations and links to the cited papers, thereby ensuring that generated text is not only coherent but also grounded in real scientific literature. This approach directly counters the risk of hallucinations associated with large language models like GPT, which cannot reliably provide references or citations for their outputs.","abs-2307.04683v1, abs-2412.05225v1, abs-2312.11276v3, abs-2312.07254v1","[""Summary: In this paper, we present CORE-GPT, a novel question-answering platform that combines GPT-based language models and more than 32 million full-text open access scientific articles from CORE. We first demonstrate that GPT3.5 and GPT4 cannot be relied upon to provide references or citations for generated text. We then introduce CORE-GPT which delivers evidence-based answers to questions, along with citations and links to the cited papers, greatly increasing the trustworthiness of the answers and reducing the risk of hallucinations. CORE-GPT's performance was evaluated on a dataset of 100 questions covering the top 20 scientific domains in CORE, resulting in 100 answers and links to 500 relevant articles. The quality of the provided answers and and relevance of the links were assessed by two annotators. Our results demonstrate that CORE-GPT can produce comprehensive and trustworthy answers across the majority of scientific domains, complete with links to genuine, relevant"", ""that CORE-GPT can produce comprehensive and trustworthy answers across the majority of scientific domains, complete with links to genuine, relevant scientific articles."", ""second-order approximation to the impulse function. This enables gradient computation concerning both the sign as well as the magnitude of the weights. In contrast to absolute threshold-based EE, the proposed EE mechanism hinges on fractional reduction in entropy among intermediate transformer blocks with soft-routing loss estimation. While binarization results in 18.44 times reduction in model size, early exit reduces the FLOPs during inference by 54.85% and even improves accuracy by 5.98% through resolving the \""overthinking\"" problem inherent in deep networks. Moreover, the proposed BEExformer simplifies training by not requiring knowledge distillation from a full-precision LLM. Extensive evaluation on the GLUE dataset and comparison with the SOTA works showcase its pareto-optimal performance-efficiency trade-off."", ""Title: Compositional Generalization for Multi-label Text Classification: A\n  Data-Augmentation Approach.\nPublished_date: 2023-12-18."", ""Published_date: 2023-12-12.\nSummary: This study describes our system for Task 1 Single-speaker Visual Speech Recognition (VSR) fixed track in the Chinese Continuous Visual Speech Recognition Challenge (CNVSRC) 2023. Specifically, we use intermediate connectionist temporal classification (Inter CTC) residual modules to relax the conditional independence assumption of CTC in our model. Then we use a bi-transformer decoder to enable the model to capture both past and future contextual information. In addition, we use Chinese characters as the modeling units to improve the recognition accuracy of our model. Finally, we use a recurrent neural network language model (RNNLM) for shallow fusion in the inference stage. Experiments show that our system achieves a character error rate (CER) of 38.09% on the Eval set which reaches a relative CER reduction of 21.63% over the official baseline, and obtains a second place in the challenge.""]"
