Question,Source Article Index,Question Type,Summary,qwen2.5:3b,documentIDs,context_retrieved
"Considering the findings in 'Detoxifying Language Models Risks Marginalizing Minority Voices' (abs-2104.06390v1), what potential risks could arise when applying the detoxification techniques to the analysis of anti-Asian violence-provoking speech as studied in 'A Community-Centric Perspective' (abs-2407.15227v1)?","abs-2104.06390v1,abs-2407.15227v1",Synthesis & Multi-Hop Reasoning Questions,"Title: Detoxifying Language Models Risks Marginalizing Minority Voices 
Summary: Language models (LMs) must be both safe and equitable to be responsibly
deployed in practice. With safety in mind, numerous detoxification techniques
(e.g., Dathathri et al. 2020; Krause et al. 2020) have been proposed to
mitigate toxic LM generations. In this work, we show that current
detoxification techniques hurt equity: they decrease the utility of LMs on
language used by marginalized groups (e.g., African-American English and
minority identity mentions). In particular, we perform automatic and human
evaluations of text generation quality when LMs are conditioned on inputs with
different dialects and group identifiers. We find that detoxification makes LMs
more brittle to distribution shift, especially on language used by marginalized
groups. We identify that these failures stem from detoxification methods
exploiting spurious correlations in toxicity datasets. Overall, our results
highlight the tension between the controllability and distributional robustness
of LMs. 

Title: A Community-Centric Perspective for Characterizing and Detecting
  Anti-Asian Violence-Provoking Speech 
Summary: Violence-provoking speech -- speech that implicitly or explicitly promotes
violence against the members of the targeted community, contributed to a
massive surge in anti-Asian crimes during the pandemic. While previous works
have characterized and built tools for detecting other forms of harmful speech,
like fear speech and hate speech, our work takes a community-centric approach
to studying anti-Asian violence-provoking speech. Using data from ~420k Twitter
posts spanning a 3-year duration (January 1, 2020 to February 1, 2023), we
develop a codebook to characterize anti-Asian violence-provoking speech and
collect a community-crowdsourced dataset to facilitate its large-scale
detection using state-of-the-art classifiers. We contrast the capabilities of
natural language processing classifiers, ranging from BERT-based to LLM-based
classifiers, in detecting violence-provoking speech with their capabilities to
detect anti-Asian hateful speech. In contrast to prior work that has
demonstrated the effectiveness of such classifiers in detecting hateful speech
($F_1 = 0.89$), our work shows that accurate and reliable detection of
violence-provoking speech is a challenging task ($F_1 = 0.69$). We discuss the
implications of our findings, particularly the need for proactive interventions
to support Asian communities during public health crises. The resources related
to the study are available at
https://claws-lab.github.io/violence-provoking-speech/. 

","The application of detoxification techniques to analyze anti-Asian violence-provoking speech, as highlighted in ""A Community-Centric Perspective"" (abs-2407.15227v1), could potentially marginalize minority voices if not implemented carefully. Conversely, proper implementation can help mitigate the risks of reinforcing biases or further silencing communities that are already vulnerable and marginalized.","abs-2104.06390v1, abs-2407.15227v1, abs-2402.17493v5, abs-2311.06158v1, abs-2310.06422v2","[""Title: Detoxifying Language Models Risks Marginalizing Minority Voices.\nPublished_date: 2021-04-13."", ""Title: A Community-Centric Perspective for Characterizing and Detecting\n  Anti-Asian Violence-Provoking Speech.\nPublished_date: 2024-07-21."", ""Title: The Foundational Capabilities of Large Language Models in Predicting\n  Postoperative Risks Using Clinical Notes.\nPublished_date: 2024-02-27."", ""Title: Language Models can be Logical Solvers.\nPublished_date: 2023-11-10."", ""Title: Large Language Models for Propaganda Detection.\nPublished_date: 2023-10-10.""]"
How can the concept of 'spurious patterns' from 'Learning the Difference that Makes a Difference with Counterfactually-Augmented Data' (abs-1909.12434v2) be applied to analyze the potential biases in the machine-generated news articles discussed in 'Uncovering Agendas' (abs-2405.00821v1)?,"abs-1909.12434v2,abs-2405.00821v1",Synthesis & Multi-Hop Reasoning Questions,"Title: Learning the Difference that Makes a Difference with
  Counterfactually-Augmented Data 
Summary: Despite alarm over the reliance of machine learning systems on so-called
spurious patterns, the term lacks coherent meaning in standard statistical
frameworks. However, the language of causality offers clarity: spurious
associations are due to confounding (e.g., a common cause), but not direct or
indirect causal effects. In this paper, we focus on natural language
processing, introducing methods and resources for training models less
sensitive to spurious patterns. Given documents and their initial labels, we
task humans with revising each document so that it (i) accords with a
counterfactual target label; (ii) retains internal coherence; and (iii) avoids
unnecessary changes. Interestingly, on sentiment analysis and natural language
inference tasks, classifiers trained on original data fail on their
counterfactually-revised counterparts and vice versa. Classifiers trained on
combined datasets perform remarkably well, just shy of those specialized to
either domain. While classifiers trained on either original or manipulated data
alone are sensitive to spurious features (e.g., mentions of genre), models
trained on the combined data are less sensitive to this signal. Both datasets
are publicly available. 

Title: Uncovering Agendas: A Novel French & English Dataset for Agenda
  Detection on Social Media 
Summary: The behavior and decision making of groups or communities can be dramatically
influenced by individuals pushing particular agendas, e.g., to promote or
disparage a person or an activity, to call for action, etc.. In the examination
of online influence campaigns, particularly those related to important
political and social events, scholars often concentrate on identifying the
sources responsible for setting and controlling the agenda (e.g., public
media). In this article we present a methodology for detecting specific
instances of agenda control through social media where annotated data is
limited or non-existent. By using a modest corpus of Twitter messages centered
on the 2022 French Presidential Elections, we carry out a comprehensive
evaluation of various approaches and techniques that can be applied to this
problem. Our findings demonstrate that by treating the task as a textual
entailment problem, it is possible to overcome the requirement for a large
annotated training dataset. 

","The concept of ""spurious patterns"" from the paper ""Learning the Difference that Makes a Difference with Counterfactually-Augmented Data"" (abs-1909.12434v2) can be applied to analyze biases in machine-generated news articles by identifying and mitigating associations based on confounding factors rather than direct causal effects. This approach involves revising documents so they are coherent and avoid changes that introduce or reinforce spurious patterns, which helps reveal underlying biases not related to true causality but instead due to factors such as common causes.

In the context of machine-generated news articles, this could involve developing methods for training models less sensitive to such confounding factors, thereby enhancing their accuracy in detecting genuine biases and agendas embedded within the text.","abs-2207.12406v1, abs-1909.12434v2, abs-2105.03315v1, abs-2403.03581v1, abs-2408.07479v1","[""Title: UrduFake@FIRE2020: Shared Track on Fake News Identification in Urdu.\nPublished_date: 2022-07-25.\nSummary: This paper gives the overview of the first shared task at FIRE 2020 on fake news detection in the Urdu language. This is a binary classification task in which the goal is to identify fake news using a dataset composed of 900 annotated news articles for training and 400 news articles for testing. The dataset contains news in five domains: (i) Health, (ii) Sports, (iii) Showbiz, (iv) Technology, and (v) Business. 42 teams from 6 different countries (India, China, Egypt, Germany, Pakistan, and the UK) registered for the task. 9 teams submitted their experimental results. The participants used various machine learning methods ranging from feature-based traditional machine learning to neural network techniques. The best performing system achieved an F-score value of 0.90, showing that the BERT-based approach outperforms other machine learning classifiers."", ""Summary: Despite alarm over the reliance of machine learning systems on so-called spurious patterns, the term lacks coherent meaning in standard statistical frameworks. However, the language of causality offers clarity: spurious associations are due to confounding (e.g., a common cause), but not direct or indirect causal effects. In this paper, we focus on natural language processing, introducing methods and resources for training models less sensitive to spurious patterns. Given documents and their initial labels, we task humans with revising each document so that it (i) accords with a counterfactual target label; (ii) retains internal coherence; and (iii) avoids unnecessary changes. Interestingly, on sentiment analysis and natural language inference tasks, classifiers trained on original data fail on their counterfactually-revised counterparts and vice versa. Classifiers trained on combined datasets perform remarkably well, just shy of those specialized to either domain. While"", ""Title: Learning Models for Suicide Prediction from Social Media Posts.\nPublished_date: 2021-04-29.\nSummary: We propose a deep learning architecture and test three other machine learning models to automatically detect individuals that will attempt suicide within (1) 30 days and (2) six months, using their social media post data provided in the CLPsych 2021 shared task. Additionally, we create and extract three sets of handcrafted features for suicide risk detection based on the three-stage theory of suicide and prior work on emotions and the use of pronouns among persons exhibiting suicidal ideations. Extensive experimentations show that some of the traditional machine learning methods outperform the baseline with an F1 score of 0.741 and F2 score of 0.833 on subtask 1 (prediction of a suicide attempt 30 days prior). However, the proposed deep learning method outperforms the baseline with F1 score of 0.737 and F2 score of 0.843 on subtask 2 (prediction of suicide 6 months prior)."", ""Title: Enhancing ASD detection accuracy: a combined approach of machine\n  learning and deep learning models with natural language processing.\nPublished_date: 2024-03-06."", ""Title: A Study on Bias Detection and Classification in Natural Language\n  Processing.\nPublished_date: 2024-08-14.\nSummary: Human biases have been shown to influence the performance of models and algorithms in various fields, including Natural Language Processing. While the study of this phenomenon is garnering focus in recent years, the available resources are still relatively scarce, often focusing on different forms or manifestations of biases. The aim of our work is twofold: 1) gather publicly-available datasets and determine how to better combine them to effectively train models in the task of hate speech detection and classification; 2) analyse the main issues with these datasets, such as scarcity, skewed resources, and reliance on non-persistent data. We discuss these issues in tandem with the development of our experiments, in which we show that the combinations of different datasets greatly impact the models' performance.""]"
"Based on the challenges identified in 'Hurdles to Progress in Long-form Question Answering' (abs-2103.06332v2), how might the 'LongBench' benchmark (abs-2308.14508v2) address the issue of ROUGE-L being an uninformative metric for long-form QA?","abs-2103.06332v2,abs-2308.14508v2",Synthesis & Multi-Hop Reasoning Questions,"Title: Hurdles to Progress in Long-form Question Answering 
Summary: The task of long-form question answering (LFQA) involves retrieving documents
relevant to a given question and using them to generate a paragraph-length
answer. While many models have recently been proposed for LFQA, we show in this
paper that the task formulation raises fundamental challenges regarding
evaluation and dataset creation that currently preclude meaningful modeling
progress. To demonstrate these challenges, we first design a new system that
relies on sparse attention and contrastive retriever learning to achieve
state-of-the-art performance on the ELI5 LFQA dataset. While our system tops
the public leaderboard, a detailed analysis reveals several troubling trends:
(1) our system's generated answers are not actually grounded in the documents
that it retrieves; (2) ELI5 contains significant train / validation overlap, as
at least 81% of ELI5 validation questions occur in paraphrased form in the
training set; (3) ROUGE-L is not an informative metric of generated answer
quality and can be easily gamed; and (4) human evaluations used for other text
generation tasks are unreliable for LFQA. We offer suggestions to mitigate each
of these issues, which we hope will lead to more rigorous LFQA research and
meaningful progress in the future. 

Title: LongBench: A Bilingual, Multitask Benchmark for Long Context
  Understanding 
Summary: Although large language models (LLMs) demonstrate impressive performance for
many language tasks, most of them can only handle texts a few thousand tokens
long, limiting their applications on longer sequence inputs, such as books,
reports, and codebases. Recent works have proposed methods to improve LLMs'
long context capabilities by extending context windows and more sophisticated
memory mechanisms. However, comprehensive benchmarks tailored for evaluating
long context understanding are lacking. In this paper, we introduce LongBench,
the first bilingual, multi-task benchmark for long context understanding,
enabling a more rigorous evaluation of long context understanding. LongBench
comprises 21 datasets across 6 task categories in both English and Chinese,
with an average length of 6,711 words (English) and 13,386 characters
(Chinese). These tasks cover key long-text application areas including
single-doc QA, multi-doc QA, summarization, few-shot learning, synthetic tasks,
and code completion. All datasets in LongBench are standardized into a unified
format, allowing for effortless automatic evaluation of LLMs. Upon
comprehensive evaluation of 8 LLMs on LongBench, we find that: (1) Commercial
model (GPT-3.5-Turbo-16k) outperforms other open-sourced models, but still
struggles on longer contexts. (2) Scaled position embedding and fine-tuning on
longer sequences lead to substantial improvement on long context understanding.
(3) Context compression technique such as retrieval brings improvement for
model with weak ability on long contexts, but the performance still lags behind
models that have strong long context understanding capability. The code and
datasets are available at https://github.com/THUDM/LongBench. 

","The 'Hurdles to Progress in Long-form Question Answering' document highlights that ROUGE-L is not an informative metric for generated answer quality in LFQA, which can be easily gamed. The proposed 'LongBench' benchmark might address this by incorporating a wider range of metrics designed specifically for evaluating long-form QA tasks, including those aligned with real-world scenarios and more comprehensive evaluation methods beyond simple sentence-level ROUGE scores.","abs-2103.06332v2, abs-2402.18264v2, abs-2012.15482v1","[""as at least 81% of ELI5 validation questions occur in paraphrased form in the training set; (3) ROUGE-L is not an informative metric of generated answer quality and can be easily gamed; and (4) human evaluations used for other text generation tasks are unreliable for LFQA. We offer suggestions to mitigate each of these issues, which we hope will lead to more rigorous LFQA research and meaningful progress in the future."", ""Title: Hurdles to Progress in Long-form Question Answering.\nPublished_date: 2021-03-10."", ""Summary: The task of long-form question answering (LFQA) involves retrieving documents relevant to a given question and using them to generate a paragraph-length answer. While many models have recently been proposed for LFQA, we show in this paper that the task formulation raises fundamental challenges regarding evaluation and dataset creation that currently preclude meaningful modeling progress. To demonstrate these challenges, we first design a new system that relies on sparse attention and contrastive retriever learning to achieve state-of-the-art performance on the ELI5 LFQA dataset. While our system tops the public leaderboard, a detailed analysis reveals several troubling trends: (1) our system's generated answers are not actually grounded in the documents that it retrieves; (2) ELI5 contains significant train / validation overlap, as at least 81% of ELI5 validation questions occur in paraphrased form in the training set; (3) ROUGE-L is not an informative metric of generated"", ""Summary: It presents significant challenges to generate comprehensive and accurate Wikipedia articles for newly emerging events under a real-world scenario. Existing attempts fall short either by focusing only on short snippets or by using metrics that are insufficient to evaluate real-world scenarios. In this paper, we construct WIKIGENBENCH, a new benchmark consisting of 1,320 entries, designed to align with real-world scenarios in both generation and evaluation. For generation, we explore a real-world scenario where structured, full-length Wikipedia articles with citations are generated for new events using input documents from web sources. For evaluation, we integrate systematic metrics and LLM-based metrics to assess the verifiability, organization, and other aspects aligned with real-world scenarios. Based on this benchmark, we conduct extensive experiments using various models within three commonly used frameworks: direct RAG, hierarchical structure-based RAG, and RAG with a"", ""architecture to handle long input contexts, and 3) intermediate fine-tuning on re-structured open domain QA datasets to improve few-shot performance. FiD-Ex significantly improves over prior work in terms of explanation metrics and task accuracy, on multiple tasks from the ERASER explainability benchmark, both in the fully supervised and in the few-shot settings.""]"
"What specific computational resources (e.g., GPU model, number of GPUs) were used to train the models in the paper 'Using LLMs to Aid Annotation and Collection of Clinically-Enriched Data in Bipolar Disorder and Schizophrenia'?",abs-2406.12687v1,Negative / Unanswerable Questions,"Title: Using LLMs to Aid Annotation and Collection of Clinically-Enriched Data
  in Bipolar Disorder and Schizophrenia 
Summary: NLP in mental health has been primarily social media focused. Real world
practitioners also have high case loads and often domain specific variables, of
which modern LLMs lack context. We take a dataset made by recruiting 644
participants, including individuals diagnosed with Bipolar Disorder (BD),
Schizophrenia (SZ), and Healthy Controls (HC). Participants undertook tasks
derived from a standardized mental health instrument, and the resulting data
were transcribed and annotated by experts across five clinical variables. This
paper demonstrates the application of contemporary language models in
sequence-to-sequence tasks to enhance mental health research. Specifically, we
illustrate how these models can facilitate the deployment of mental health
instruments, data collection, and data annotation with high accuracy and
scalability. We show that small models are capable of annotation for
domain-specific clinical variables, data collection for mental-health
instruments, and perform better then commercial large models. 

",No Answer,"abs-2406.11674v1, abs-2402.14855v1, abs-2404.00459v2, abs-2410.01627v1, abs-1705.00403v2","[""Summary: The increasing size of large language models (LLMs) challenges their usage on resource-constrained platforms. For example, memory on modern GPUs is insufficient to hold LLMs that are hundreds of Gigabytes in size. Offloading is a popular method to escape this constraint by storing weights of an LLM model to host CPU memory and SSD, then loading each weight to GPU before every use. In our case study of offloaded inference, we found that due to the low bandwidth between storage devices and GPU, the latency of transferring large model weights from its offloaded location to GPU memory becomes the critical bottleneck with actual compute taking nearly 0% of runtime. To effectively reduce the weight transfer latency, we propose a novel sparse format that compresses the unstructured sparse pattern of pruned LLM weights to non-zero values with high compression ratio and low decompression overhead. Endor achieves this by expressing the positions of non-zero elements with a bitmap."", ""Title: An LLM Maturity Model for Reliable and Transparent Text-to-Query.\nPublished_date: 2024-02-20.\nSummary: Recognizing the imperative to address the reliability and transparency issues of Large Language Models (LLM), this work proposes an LLM maturity model tailored for text-to-query applications. This maturity model seeks to fill the existing void in evaluating LLMs in such applications by incorporating dimensions beyond mere correctness or accuracy. Moreover, this work introduces a real-world use case from the law enforcement domain and showcases QueryIQ, an LLM-powered, domain-specific text-to-query assistant to expedite user workflows and reveal hidden relationship in data."", ""Title: NumeroLogic: Number Encoding for Enhanced LLMs' Numerical Reasoning.\nPublished_date: 2024-03-30."", ""based routing strategy to combine the two approaches that along with negative data augmentation results in achieving the best of both worlds ( i.e. within 2% of native LLM accuracy with 50% less latency). To better understand LLM OOS detection capabilities, we perform controlled experiments revealing that this capability is significantly influenced by the scope of intent labels and the size of the label space. We also introduce a two-step approach utilizing internal LLM representations, demonstrating empirical gains in OOS detection accuracy and F1-score by >5% for the Mistral-7B model."", ""Title: Dependency Parsing with Dilated Iterated Graph CNNs.\nPublished_date: 2017-05-01.\nSummary: Dependency parses are an effective way to inject linguistic knowledge into many downstream tasks, and many practitioners wish to efficiently parse sentences at scale. Recent advances in GPU hardware have enabled neural networks to achieve significant gains over the previous best models, these models still fail to leverage GPUs' capability for massive parallelism due to their requirement of sequential processing of the sentence. In response, we propose Dilated Iterated Graph Convolutional Neural Networks (DIG-CNNs) for graph-based dependency parsing, a graph convolutional architecture that allows for efficient end-to-end GPU parsing. In experiments on the English Penn TreeBank benchmark, we show that DIG-CNNs perform on par with some of the best neural network parsers.""]"
