Question,Source Article Index,Question Type,Summary,qwen2.5:3b,documentIDs,context_retrieved
What are the two novel zero-shot methods for detecting machine-generated text introduced in the paper 'DetectLLM: Leveraging Log Rank Information' a a a a a?,abs-2306.05540v1,Direct Fact Retrieval & Definition Questions,"Title: DetectLLM: Leveraging Log Rank Information for Zero-Shot Detection of
  Machine-Generated Text 
Summary: With the rapid progress of large language models (LLMs) and the huge amount
of text they generated, it becomes more and more impractical to manually
distinguish whether a text is machine-generated. Given the growing use of LLMs
in social media and education, it prompts us to develop methods to detect
machine-generated text, preventing malicious usage such as plagiarism,
misinformation, and propaganda. Previous work has studied several zero-shot
methods, which require no training data. These methods achieve good
performance, but there is still a lot of room for improvement. In this paper,
we introduce two novel zero-shot methods for detecting machine-generated text
by leveraging the log rank information. One is called DetectLLM-LRR, which is
fast and efficient, and the other is called DetectLLM-NPR, which is more
accurate, but slower due to the need for perturbations. Our experiments on
three datasets and seven language models show that our proposed methods improve
over the state of the art by 3.9 and 1.75 AUROC points absolute. Moreover,
DetectLLM-NPR needs fewer perturbations than previous work to achieve the same
level of performance, which makes it more practical for real-world use. We also
investigate the efficiency--performance trade-off based on users preference on
these two measures and we provide intuition for using them in practice
effectively. We release the data and the code of both methods in
https://github.com/mbzuai-nlp/DetectLLM 

","Two novel zero-shot methods for detecting machine-generated text, DetectLLM-LRR and DetectLLM-NPR, have been introduced. DetectLLM-LRR is fast and efficient, while DetectLLM-NPR offers higher accuracy but operates slower due to the necessity of perturbations. Both methods leverage log rank information without requiring any training data.","abs-2306.05540v1, abs-2312.14423v1, abs-1908.09805v2, abs-2110.12552v1, abs-2204.05211v1","[""Summary: With the rapid progress of large language models (LLMs) and the huge amount of text they generated, it becomes more and more impractical to manually distinguish whether a text is machine-generated. Given the growing use of LLMs in social media and education, it prompts us to develop methods to detect machine-generated text, preventing malicious usage such as plagiarism, misinformation, and propaganda. Previous work has studied several zero-shot methods, which require no training data. These methods achieve good performance, but there is still a lot of room for improvement. In this paper, we introduce two novel zero-shot methods for detecting machine-generated text by leveraging the log rank information. One is called DetectLLM-LRR, which is fast and efficient, and the other is called DetectLLM-NPR, which is more accurate, but slower due to the need for perturbations. Our experiments on three datasets and seven language models show that our proposed methods improve over the"", ""Title: Efficacy of Machine-Generated Instructions.\nPublished_date: 2023-12-22.\nSummary: Large \""instruction-tuned\"" language models (i.e., finetuned to respond to instructions) have demonstrated a remarkable ability to generalize zero-shot to new tasks. Nevertheless, they depend heavily on human-written instruction data that is often limited in quantity, diversity, and creativity, therefore hindering the generality of the tuned model. We conducted a quantitative study to figure out the efficacy of machine-generated annotations, where we compare the results of a fine-tuned BERT model with human v/s machine-generated annotations. Applying our methods to the vanilla GPT-3 model, we saw that machine generated annotations were 78.54% correct and the fine-tuned model achieved a 96.01% model performance compared to the performance with human-labelled annotations. This result shows that machine-generated annotations are a resource and cost effective way to fine-tune down-stream models."", ""Summary: Recent developments in neural language models (LMs) have raised concerns about their potential misuse for automatically spreading misinformation. In light of these concerns, several studies have proposed to detect machine-generated fake news by capturing their stylistic differences from human-written text. These approaches, broadly termed stylometry, have found success in source attribution and misinformation detection in human-written texts. However, in this work, we show that stylometry is limited against machine-generated misinformation. While humans speak differently when trying to deceive, LMs generate stylistically consistent text, regardless of underlying motive. Thus, though stylometry can successfully prevent impersonation by identifying text provenance, it fails to distinguish legitimate LM applications from those that introduce false information. We create two benchmarks demonstrating the stylistic similarity between malicious and legitimate uses of LMs, employed"", ""Capabilities and Robustness of Char-Based Models.\nPublished_date: 2021-10-24.\nSummary: This work explores the capacities of character-based Neural Machine Translation to translate noisy User-Generated Content (UGC) with a strong focus on exploring the limits of such approaches to handle productive UGC phenomena, which almost by definition, cannot be seen at training time. Within a strict zero-shot scenario, we first study the detrimental impact on translation performance of various user-generated content phenomena on a small annotated dataset we developed, and then show that such models are indeed incapable of handling unknown letters, which leads to catastrophic translation failure once such characters are encountered. We further confirm this behavior with a simple, yet insightful, copy task experiment and highlight the importance of reducing the vocabulary size hyper-parameter to increase the robustness of character-based models for machine translation."", ""Title: Entities, Dates, and Languages: Zero-Shot on Historical Texts with T0.\nPublished_date: 2022-04-11.\nSummary: In this work, we explore whether the recently demonstrated zero-shot abilities of the T0 model extend to Named Entity Recognition for out-of-distribution languages and time periods. Using a historical newspaper corpus in 3 languages as test-bed, we use prompts to extract possible named entities. Our results show that a naive approach for prompt-based zero-shot multilingual Named Entity Recognition is error-prone, but highlights the potential of such an approach for historical languages lacking labeled datasets. Moreover, we also find that T0-like models can be probed to predict the publication date and language of a document, which could be very relevant for the study of historical texts.""]"
What is the full name of the benchmark dataset introduced in the paper 'MERA: A Comprehensive LLM Evaluation in Russian'?,abs-2401.04531v3,Direct Fact Retrieval & Definition Questions,"Title: MERA: A Comprehensive LLM Evaluation in Russian 
Summary: Over the past few years, one of the most notable advancements in AI research
has been in foundation models (FMs), headlined by the rise of language models
(LMs). As the models' size increases, LMs demonstrate enhancements in
measurable aspects and the development of new qualitative features. However,
despite researchers' attention and the rapid growth in LM application, the
capabilities, limitations, and associated risks still need to be better
understood. To address these issues, we introduce an open Multimodal Evaluation
of Russian-language Architectures (MERA), a new instruction benchmark for
evaluating foundation models oriented towards the Russian language. The
benchmark encompasses 21 evaluation tasks for generative models in 11 skill
domains and is designed as a black-box test to ensure the exclusion of data
leakage. The paper introduces a methodology to evaluate FMs and LMs in zero-
and few-shot fixed instruction settings that can be extended to other
modalities. We propose an evaluation methodology, an open-source code base for
the MERA assessment, and a leaderboard with a submission system. We evaluate
open LMs as baselines and find that they are still far behind the human level.
We publicly release MERA to guide forthcoming research, anticipate
groundbreaking model features, standardize the evaluation procedure, and
address potential societal drawbacks. 

",No Answer. The provided documents do not contain information about a paper titled 'MERA: A Comprehensive LLM Evaluation in Russian'.,"abs-2401.07078v1, abs-2403.01116v1, abs-2112.03414v1, abs-2301.07695v5, abs-2308.14508v2","[""Title: PUB: A Pragmatics Understanding Benchmark for Assessing LLMs' Pragmatics\n  Capabilities.\nPublished_date: 2024-01-13."", ""Title: MulCogBench: A Multi-modal Cognitive Benchmark Dataset for Evaluating\n  Chinese and English Computational Language Models.\nPublished_date: 2024-03-02."", ""Title: JUSTICE: A Benchmark Dataset for Supreme Court's Judgment Prediction.\nPublished_date: 2021-12-06."", ""Title: EHRSQL: A Practical Text-to-SQL Benchmark for Electronic Health Records.\nPublished_date: 2023-01-16."", ""Title: LongBench: A Bilingual, Multitask Benchmark for Long Context\n  Understanding.\nPublished_date: 2023-08-28.""]"
What does the acronym HSP stand for in the context of the prompting method designed to improve LLM reasoning?,abs-2402.14310v1,Direct Fact Retrieval & Definition Questions,"Title: Hint-before-Solving Prompting: Guiding LLMs to Effectively Utilize
  Encoded Knowledge 
Summary: Large Language Models (LLMs) have recently showcased remarkable
generalizability in various domains. Despite their extensive knowledge, LLMs
still face challenges in efficiently utilizing encoded knowledge to develop
accurate and logical reasoning processes. To mitigate this problem, we
introduced Hint-before-Solving Prompting (HSP), which guides the model to
generate hints (e.g., specific knowledge or key ideas) for solving the problem
and then generate solutions containing intermediate reasoning steps. Since HSP
is orthogonal to prompting methods (e.g., Chain-of-Thought (CoT)), we applied
HSP to CoT, Least-to-Most, Plan-and-Solve, and Standard promptings. The results
of extensive experiments on 6 reasoning benchmarks and 4 open-source LLMs
demonstrate that HSP can effectively improve the accuracy of reasoning tasks:
(1) By applying high-quality hint-enhanced HSP to CoT prompting,
Llama2-70B-Chat shows an improvement of 9.7. (2) Beyond exploring training-free
LLM capabilities, we built the HSPMATH dataset based on HSP and fine-tuned
Llemma-7B, reaching 64.3 accuracy, surpassing GPT-3.5 and WizardMath-13B. We
make our code and dataset publicly available at
\url{https://github.com/jinlanfu/HSP}. 

","HSP stands for Hint-before-Solving Prompting, a method introduced to guide Large Language Models (LLMs) to generate hints for solving problems and then produce solutions containing intermediate reasoning steps.","abs-2402.14310v1, abs-2404.01242v1, abs-2408.07465v1, abs-2204.03489v1","[""Summary: Large Language Models (LLMs) have recently showcased remarkable generalizability in various domains. Despite their extensive knowledge, LLMs still face challenges in efficiently utilizing encoded knowledge to develop accurate and logical reasoning processes. To mitigate this problem, we introduced Hint-before-Solving Prompting (HSP), which guides the model to generate hints (e.g., specific knowledge or key ideas) for solving the problem and then generate solutions containing intermediate reasoning steps. Since HSP is orthogonal to prompting methods (e.g., Chain-of-Thought (CoT)), we applied HSP to CoT, Least-to-Most, Plan-and-Solve, and Standard promptings. The results of extensive experiments on 6 reasoning benchmarks and 4 open-source LLMs demonstrate that HSP can effectively improve the accuracy of reasoning tasks: (1) By applying high-quality hint-enhanced HSP to CoT prompting, Llama2-70B-Chat shows an improvement of 9.7. (2) Beyond exploring training-free LLM"", ""(1) By applying high-quality hint-enhanced HSP to CoT prompting, Llama2-70B-Chat shows an improvement of 9.7. (2) Beyond exploring training-free LLM capabilities, we built the HSPMATH dataset based on HSP and fine-tuned Llemma-7B, reaching 64.3 accuracy, surpassing GPT-3.5 and WizardMath-13B. We make our code and dataset publicly available at \\url{https://github.com/jinlanfu/HSP}."", ""Summary: Current soft prompt methods yield limited performance when applied to small-sized models (fewer than a billion parameters). Deep prompt-tuning, which entails prepending parameters in each layer for enhanced efficacy, presents a solution for prompting small-sized models, albeit requiring carefully designed implementation. In this paper, we introduce the Lottery Ticket Prompt-learning (LTP) framework that integrates winning tickets with soft prompts. The LTP offers a simpler implementation and requires only a one-time execution. We demonstrate LTP on cross-lingual tasks, where prior works rely on external tools like human-designed multilingual templates and bilingual dictionaries, which may not be feasible in a low-resource regime. Specifically, we select a subset of parameters that have been changed the most during the fine-tuning with the Masked Language Modeling objective. Then, we prepend soft prompts to the original pre-trained language model and only update the selected"", ""Summary: Prompt optimization is essential for enhancing the performance of Large Language Models (LLMs) in a range of Natural Language Processing (NLP) tasks, particularly in scenarios of few-shot learning where training examples are incorporated directly into the prompt. Despite the growing interest in optimizing prompts with few-shot examples, existing methods for prompt optimization are often resource-intensive or perform inadequately. In this work, we propose PrOmpting with Episodic Memory (POEM), a novel prompt optimization technique that is simple, efficient, and demonstrates strong generalization capabilities. We approach prompt optimization as a Reinforcement Learning (RL) challenge, using episodic memory to archive combinations of input data, permutations of few-shot examples, and the rewards observed during training. In the testing phase, we optimize the sequence of examples for each test query by selecting the sequence that yields the highest total rewards from the top-k"", ""Summary: Probing Pre-trained Language Models (PLMs) using prompts has indirectly implied that language models (LMs) can be treated as knowledge bases. To this end, this phenomena has been effective especially when these LMs are fine-tuned towards not just data of a specific domain, but also to the style or linguistic pattern of the prompts themselves. We observe that, satisfying a particular linguistic pattern in prompts is an unsustainable constraint that unnecessarily lengthens the probing task, especially because, they are often manually designed and the range of possible prompt template patterns can vary depending on the prompting objective and domain. We therefore explore an idea of using a position-attention mechanism to capture positional information of each word in a prompt relative to the mask to be filled, hence avoiding the need to re-construct prompts when the prompts linguistic pattern changes. Using our approach, we demonstrate the ability of eliciting answers to rare""]"
"According to the abstract, what new dataset is introduced in 'Hurdles to Progress in Long-form Question Answering' to evaluate LFQA models?",abs-2103.06332v2,Direct Fact Retrieval & Definition Questions,"Title: Hurdles to Progress in Long-form Question Answering 
Summary: The task of long-form question answering (LFQA) involves retrieving documents
relevant to a given question and using them to generate a paragraph-length
answer. While many models have recently been proposed for LFQA, we show in this
paper that the task formulation raises fundamental challenges regarding
evaluation and dataset creation that currently preclude meaningful modeling
progress. To demonstrate these challenges, we first design a new system that
relies on sparse attention and contrastive retriever learning to achieve
state-of-the-art performance on the ELI5 LFQA dataset. While our system tops
the public leaderboard, a detailed analysis reveals several troubling trends:
(1) our system's generated answers are not actually grounded in the documents
that it retrieves; (2) ELI5 contains significant train / validation overlap, as
at least 81% of ELI5 validation questions occur in paraphrased form in the
training set; (3) ROUGE-L is not an informative metric of generated answer
quality and can be easily gamed; and (4) human evaluations used for other text
generation tasks are unreliable for LFQA. We offer suggestions to mitigate each
of these issues, which we hope will lead to more rigorous LFQA research and
meaningful progress in the future. 

",No Answer. The document does not introduce a new dataset for evaluating long-form question answering (LFQA) models; it discusses hurdles and issues related to LFQA research.,"abs-2103.06332v2, abs-2104.04751v1, abs-2303.16634v3, abs-2401.02132v1","[""as at least 81% of ELI5 validation questions occur in paraphrased form in the training set; (3) ROUGE-L is not an informative metric of generated answer quality and can be easily gamed; and (4) human evaluations used for other text generation tasks are unreliable for LFQA. We offer suggestions to mitigate each of these issues, which we hope will lead to more rigorous LFQA research and meaningful progress in the future."", ""Title: NLI Data Sanity Check: Assessing the Effect of Data Corruption on Model\n  Performance.\nPublished_date: 2021-04-10."", ""Title: G-Eval: NLG Evaluation using GPT-4 with Better Human Alignment.\nPublished_date: 2023-03-29."", ""Title: Hurdles to Progress in Long-form Question Answering.\nPublished_date: 2021-03-10."", ""Title: DCR-Consistency: Divide-Conquer-Reasoning for Consistency Evaluation and\n  Improvement of Large Language Models.\nPublished_date: 2024-01-04.""]"
What is the main goal of the 'Exhaustivity and anti-exhaustivity in the RSA framework' paper?,abs-2202.07023v1,Summarization / Purpose Identification Questions,"Title: Exhaustivity and anti-exhaustivity in the RSA framework: Testing the
  effect of prior beliefs 
Summary: During communication, the interpretation of utterances is sensitive to a
listener's probabilistic prior beliefs, something which is captured by one
currently influential model of pragmatics, the Rational Speech Act (RSA)
framework. In this paper we focus on cases when this sensitivity to priors
leads to counterintuitive predictions of the framework. Our domain of interest
is exhaustivity effects, whereby a sentence such as ""Mary came"" is understood
to mean that only Mary came. We show that in the baseline RSA model, under
certain conditions, anti-exhaustive readings are predicted (e.g., ""Mary came""
would be used to convey that both Mary and Peter came). The specific question
we ask is the following: should exhaustive interpretations be derived as purely
pragmatic inferences (as in the classical Gricean view, endorsed in the
baseline RSA model), or should they rather be generated by an encapsulated
semantic mechanism (as argued in some of the recent formal literature)? To
answer this question, we provide a detailed theoretical analysis of different
RSA models and evaluate them against data obtained in a new study which tested
the effects of prior beliefs on both production and comprehension, improving on
previous empirical work. We found no anti-exhaustivity effects, but observed
that message choice is sensitive to priors, as predicted by the RSA framework
overall. The best models turn out to be those which include an encapsulated
exhaustivity mechanism (as other studies concluded on the basis of very
different data). We conclude that, on the one hand, in the division of labor
between semantics and pragmatics, semantics plays a larger role than is often
thought, but, on the other hand, the tradeoff between informativity and cost
which characterizes all RSA models does play a central role for genuine
pragmatic effects. 

","The main goal of the ""Exhaustivity and Anti-Exhaustivity in the RSA Framework"" paper is to provide a detailed theoretical analysis of different RSA models, evaluate them using empirical data on how prior beliefs affect message interpretation, and determine whether exhaustive interpretations should be derived purely pragmatically or generated by an encapsulated semantic mechanism. The study found no anti-exhaustive effects but noted that message choice is sensitive to priors as predicted by the RSA framework.","abs-2202.07023v1, abs-2005.06641v1","[""Title: Exhaustivity and anti-exhaustivity in the RSA framework: Testing the\n  effect of prior beliefs.\nPublished_date: 2022-02-14."", ""baseline RSA model), or should they rather be generated by an encapsulated semantic mechanism (as argued in some of the recent formal literature)? To answer this question, we provide a detailed theoretical analysis of different RSA models and evaluate them against data obtained in a new study which tested the effects of prior beliefs on both production and comprehension, improving on previous empirical work. We found no anti-exhaustivity effects, but observed that message choice is sensitive to priors, as predicted by the RSA framework overall. The best models turn out to be those which include an encapsulated exhaustivity mechanism (as other studies concluded on the basis of very different data). We conclude that, on the one hand, in the division of labor between semantics and pragmatics, semantics plays a larger role than is often thought, but, on the other hand, the tradeoff between informativity and cost which characterizes all RSA models does play a central role for genuine"", ""Summary: During communication, the interpretation of utterances is sensitive to a listener's probabilistic prior beliefs, something which is captured by one currently influential model of pragmatics, the Rational Speech Act (RSA) framework. In this paper we focus on cases when this sensitivity to priors leads to counterintuitive predictions of the framework. Our domain of interest is exhaustivity effects, whereby a sentence such as \""Mary came\"" is understood to mean that only Mary came. We show that in the baseline RSA model, under certain conditions, anti-exhaustive readings are predicted (e.g., \""Mary came\"" would be used to convey that both Mary and Peter came). The specific question we ask is the following: should exhaustive interpretations be derived as purely pragmatic inferences (as in the classical Gricean view, endorsed in the baseline RSA model), or should they rather be generated by an encapsulated semantic mechanism (as argued in some of the recent formal literature)? To"", ""Summary: What computational principles underlie human pragmatic reasoning? A prominent approach to pragmatics is the Rational Speech Act (RSA) framework, which formulates pragmatic reasoning as probabilistic speakers and listeners recursively reasoning about each other. While RSA enjoys broad empirical support, it is not yet clear whether the dynamics of such recursive reasoning may be governed by a general optimization principle. Here, we present a novel analysis of the RSA framework that addresses this question. First, we show that RSA recursion implements an alternating maximization for optimizing a tradeoff between expected utility and communicative effort. On that basis, we study the dynamics of RSA recursion and disconfirm the conjecture that expected utility is guaranteed to improve with recursion depth. Second, we show that RSA can be grounded in Rate-Distortion theory, while maintaining a similar ability to account for human behavior and avoiding a bias of RSA toward random"", ""thought, but, on the other hand, the tradeoff between informativity and cost which characterizes all RSA models does play a central role for genuine pragmatic effects.""]"
