Question,Source Article Index,Question Type,Summary,qwen2.5:3b,documentIDs,context_retrieved
What is the LATC framework and what two types of consistency does it aim to achieve in spatiotemporal traffic data?,abs-2104.14936v1,Direct Fact Retrieval & Definition,"Title: Low-Rank Autoregressive Tensor Completion for Spatiotemporal Traffic
  Data Imputation 
Summary: Spatiotemporal traffic time series (e.g., traffic volume/speed) collected
from sensing systems are often incomplete with considerable corruption and
large amounts of missing values, preventing users from harnessing the full
power of the data. Missing data imputation has been a long-standing research
topic and critical application for real-world intelligent transportation
systems. A widely applied imputation method is low-rank matrix/tensor
completion; however, the low-rank assumption only preserves the global
structure while ignores the strong local consistency in spatiotemporal data. In
this paper, we propose a low-rank autoregressive tensor completion (LATC)
framework by introducing \textit{temporal variation} as a new regularization
term into the completion of a third-order (sensor $\times$ time of day $\times$
day) tensor. The third-order tensor structure allows us to better capture the
global consistency of traffic data, such as the inherent seasonality and
day-to-day similarity. To achieve local consistency, we design the temporal
variation by imposing an AR($p$) model for each time series with coefficients
as learnable parameters. Different from previous spatial and temporal
regularization schemes, the minimization of temporal variation can better
characterize temporal generative mechanisms beyond local smoothness, allowing
us to deal with more challenging scenarios such ""blackout"" missing. To solve
the optimization problem in LATC, we introduce an alternating minimization
scheme that estimates the low-rank tensor and autoregressive coefficients
iteratively. We conduct extensive numerical experiments on several real-world
traffic data sets, and our results demonstrate the effectiveness of LATC in
diverse missing scenarios. 

","The LATC framework aims to address incomplete and corrupted spatiotemporal traffic data by incorporating temporal variation as a new regularization term into the completion of a third-order tensor. This framework ensures both global consistency, such as inherent seasonality and day-to-day similarity in traffic data, and local consistency achieved through an autoregressive model applied to each time series with learnable parameters.","abs-2104.14936v1, abs-2302.04071v2, abs-2304.00040v1, abs-2209.10622v1","[""Summary: Spatiotemporal traffic time series (e.g., traffic volume/speed) collected from sensing systems are often incomplete with considerable corruption and large amounts of missing values, preventing users from harnessing the full power of the data. Missing data imputation has been a long-standing research topic and critical application for real-world intelligent transportation systems. A widely applied imputation method is low-rank matrix/tensor completion; however, the low-rank assumption only preserves the global structure while ignores the strong local consistency in spatiotemporal data. In this paper, we propose a low-rank autoregressive tensor completion (LATC) framework by introducing \\textit{temporal variation} as a new regularization term into the completion of a third-order (sensor $\\times$ time of day $\\times$ day) tensor. The third-order tensor structure allows us to better capture the global consistency of traffic data, such as the inherent seasonality and day-to-day"", ""The third-order tensor structure allows us to better capture the global consistency of traffic data, such as the inherent seasonality and day-to-day similarity. To achieve local consistency, we design the temporal variation by imposing an AR($p$) model for each time series with coefficients as learnable parameters. Different from previous spatial and temporal regularization schemes, the minimization of temporal variation can better characterize temporal generative mechanisms beyond local smoothness, allowing us to deal with more challenging scenarios such \""blackout\"" missing. To solve the optimization problem in LATC, we introduce an alternating minimization scheme that estimates the low-rank tensor and autoregressive coefficients iteratively. We conduct extensive numerical experiments on several real-world traffic data sets, and our results demonstrate the effectiveness of LATC in diverse missing scenarios."", ""Summary: Spatiotemporal graph neural networks have shown to be effective in time series forecasting applications, achieving better performance than standard univariate predictors in several settings. These architectures take advantage of a graph structure and relational inductive biases to learn a single (global) inductive model to predict any number of the input time series, each associated with a graph node. Despite the gain achieved in computational and data efficiency w.r.t. fitting a set of local models, relying on a single global model can be a limitation whenever some of the time series are generated by a different spatiotemporal stochastic process. The main objective of this paper is to understand the interplay between globality and locality in graph-based spatiotemporal forecasting, while contextually proposing a methodological framework to rationalize the practice of including trainable node embeddings in such architectures. We ascribe to trainable node embeddings the role"", ""Summary: Data-driven method for Structural Health Monitoring (SHM), that mine the hidden structural performance from the correlations among monitored time series data, has received widely concerns recently. However, missing data significantly impacts the conduction of this method. Missing data is a frequently encountered issue in time series data in SHM and many other real-world applications, that harms to the standardized data mining and downstream tasks, such as condition assessment. Imputation approaches based on spatiotemporal relations among monitoring data are developed to handle this issue, however, no additional information is added during imputation. This paper thus develops a robust method for damage identification that considers the missing data occasions, based on long-short term memory (LSTM) model and dropout mechanism in the autoencoder (AE) framework. Inputs channels are randomly dropped to simulate the missing data in training, and reconstruction errors are used as"", ""Summary: This paper develops a Deep Graph Operator Network (DeepGraphONet) framework that learns to approximate the dynamics of a complex system (e.g. the power grid or traffic) with an underlying sub-graph structure. We build our DeepGraphONet by fusing the ability of (i) Graph Neural Networks (GNN) to exploit spatially correlated graph information and (ii) Deep Operator Networks~(DeepONet) to approximate the solution operator of dynamical systems. The resulting DeepGraphONet can then predict the dynamics within a given short/medium-term time horizon by observing a finite history of the graph state information. Furthermore, we design our DeepGraphONet to be resolution-independent. That is, we do not require the finite history to be collected at the exact/same resolution. In addition, to disseminate the results from a trained DeepGraphONet, we design a zero-shot learning strategy that enables using it on a different sub-graph. Finally, empirical results on the (i) transient stability""]"
What two algorithms does the Invariant-feature Subspace Recovery (ISR) paper propose for achieving domain generalization?,abs-2201.12919v2,Direct Fact Retrieval & Definition,"Title: Provable Domain Generalization via Invariant-Feature Subspace Recovery 
Summary: Domain generalization asks for models trained over a set of training
environments to perform well in unseen test environments. Recently, a series of
algorithms such as Invariant Risk Minimization (IRM) has been proposed for
domain generalization. However, Rosenfeld et al. (2021) shows that in a simple
linear data model, even if non-convexity issues are ignored, IRM and its
extensions cannot generalize to unseen environments with less than $d_s+1$
training environments, where $d_s$ is the dimension of the spurious-feature
subspace. In this paper, we propose to achieve domain generalization with
Invariant-feature Subspace Recovery (ISR). Our first algorithm, ISR-Mean, can
identify the subspace spanned by invariant features from the first-order
moments of the class-conditional distributions, and achieve provable domain
generalization with $d_s+1$ training environments under the data model of
Rosenfeld et al. (2021). Our second algorithm, ISR-Cov, further reduces the
required number of training environments to $O(1)$ using the information of
second-order moments. Notably, unlike IRM, our algorithms bypass non-convexity
issues and enjoy global convergence guarantees. Empirically, our ISRs can
obtain superior performance compared with IRM on synthetic benchmarks. In
addition, on three real-world image and text datasets, we show that both ISRs
can be used as simple yet effective post-processing methods to improve the
worst-case accuracy of (pre-)trained models against spurious correlations and
group shifts. 

","The ISR paper proposes two algorithms: ISR-Mean and ISR-Cov. ISR-Mean identifies the subspace spanned by invariant features from the first-order moments of class-conditional distributions, while ISR-Cov further reduces the required number of training environments for provable domain generalization to $d_s+1$ compared to ISR-Mean.","abs-2201.12919v2, abs-2103.11163v2, abs-2211.00692v2, abs-2407.17795v2","[""Summary: Domain generalization asks for models trained over a set of training environments to perform well in unseen test environments. Recently, a series of algorithms such as Invariant Risk Minimization (IRM) has been proposed for domain generalization. However, Rosenfeld et al. (2021) shows that in a simple linear data model, even if non-convexity issues are ignored, IRM and its extensions cannot generalize to unseen environments with less than $d_s+1$ training environments, where $d_s$ is the dimension of the spurious-feature subspace. In this paper, we propose to achieve domain generalization with Invariant-feature Subspace Recovery (ISR). Our first algorithm, ISR-Mean, can identify the subspace spanned by invariant features from the first-order moments of the class-conditional distributions, and achieve provable domain generalization with $d_s+1$ training environments under the data model of Rosenfeld et al. (2021). Our second algorithm, ISR-Cov, further reduces the required"", ""Title: Provable Domain Generalization via Invariant-Feature Subspace Recovery.\nPublished_date: 2022-01-30."", ""Summary: Clinical machine learning models experience significantly degraded performance in datasets not seen during training, e.g., new hospitals or populations. Recent developments in domain generalization offer a promising solution to this problem by creating models that learn invariances across environments. In this work, we benchmark the performance of eight domain generalization methods on multi-site clinical time series and medical imaging data. We introduce a framework to induce synthetic but realistic domain shifts and sampling bias to stress-test these methods over existing non-healthcare benchmarks. We find that current domain generalization methods do not consistently achieve significant gains in out-of-distribution performance over empirical risk minimization on real-world medical imaging data, in line with prior work on general imaging datasets. However, a subset of realistic induced-shift scenarios in clinical time series data do exhibit limited performance gains. We"", ""Summary: In this paper, we study the OOD generalization of neural algorithmic reasoning tasks, where the goal is to learn an algorithm (e.g., sorting, breadth-first search, and depth-first search) from input-output pairs using deep neural networks. First, we argue that OOD generalization in this setting is significantly different than common OOD settings. For example, some phenomena in OOD generalization of image classifications such as \\emph{accuracy on the line} are not observed here, and techniques such as data augmentation methods do not help as assumptions underlying many augmentation techniques are often violated. Second, we analyze the main challenges (e.g., input distribution shift, non-representative data generation, and uninformative validation metrics) of the current leading benchmark, i.e., CLRS \\citep{deepmind2021clrs}, which contains 30 algorithmic reasoning tasks. We propose several solutions, including a simple-yet-effective fix to the input distribution shift and"", ""algorithm, NSGA-II. This enhancement is achieved through two key components: the genuine initialization method and the substitution of the worst individuals with new randomly generated individuals as a re-initialization approach in each generation. The proposed multi-objective feature selection method undergoes testing on twelve real-world classification problems, with the number of features ranging from 2,400 to nearly 50,000. The results demonstrate that replacing the last front of the population with an equivalent number of new random individuals generated using the genuine initialization method and featuring a limited number of features substantially improves the population's quality and, consequently, enhances the performance of the multi-objective algorithm.""]"
Define the 'goodness' function for a layer in the Forward-Forward algorithm.,abs-2212.13345v1,Direct Fact Retrieval & Definition,"Title: The Forward-Forward Algorithm: Some Preliminary Investigations 
Summary: The aim of this paper is to introduce a new learning procedure for neural
networks and to demonstrate that it works well enough on a few small problems
to be worth further investigation. The Forward-Forward algorithm replaces the
forward and backward passes of backpropagation by two forward passes, one with
positive (i.e. real) data and the other with negative data which could be
generated by the network itself. Each layer has its own objective function
which is simply to have high goodness for positive data and low goodness for
negative data. The sum of the squared activities in a layer can be used as the
goodness but there are many other possibilities, including minus the sum of the
squared activities. If the positive and negative passes could be separated in
time, the negative passes could be done offline, which would make the learning
much simpler in the positive pass and allow video to be pipelined through the
network without ever storing activities or stopping to propagate derivatives. 

","In the Forward-Forward algorithm, the goodness function for each layer can be defined as having high values for positive data and low values for negative data. The sum of the squared activities in a layer is commonly used as this goodness function. However, there are multiple possibilities; other functions such as minus the sum of the squared activities could also be utilized.","abs-2212.13345v1, abs-2301.01452v3, abs-2302.05440v2, abs-2211.16459v2","[""Summary: The aim of this paper is to introduce a new learning procedure for neural networks and to demonstrate that it works well enough on a few small problems to be worth further investigation. The Forward-Forward algorithm replaces the forward and backward passes of backpropagation by two forward passes, one with positive (i.e. real) data and the other with negative data which could be generated by the network itself. Each layer has its own objective function which is simply to have high goodness for positive data and low goodness for negative data. The sum of the squared activities in a layer can be used as the goodness but there are many other possibilities, including minus the sum of the squared activities. If the positive and negative passes could be separated in time, the negative passes could be done offline, which would make the learning much simpler in the positive pass and allow video to be pipelined through the network without ever storing activities or stopping to"", ""Summary: We propose the predictive forward-forward (PFF) algorithm for conducting credit assignment in neural systems. Specifically, we design a novel, dynamic recurrent neural system that learns a directed generative circuit jointly and simultaneously with a representation circuit. Notably, the system integrates learnable lateral competition, noise injection, and elements of predictive coding, an emerging and viable neurobiological process theory of cortical function, with the forward-forward (FF) adaptation scheme. Furthermore, PFF efficiently learns to propagate learning signals and updates synapses with forward passes only, eliminating key structural and computational constraints imposed by backpropagation-based schemes. Besides computational advantages, the PFF process could prove useful for understanding the learning mechanisms behind biological neurons that use local signals despite missing feedback connections. We run experiments on image data and demonstrate that the PFF"", ""Summary: \""Forward-only\"" algorithms, which train neural networks while avoiding a backward pass, have recently gained attention as a way of solving the biologically unrealistic aspects of backpropagation. Here, we first address compelling challenges related to the \""forward-only\"" rules, which include reducing the performance gap with backpropagation and providing an analytical understanding of their dynamics. To this end, we show that the forward-only algorithm with top-down feedback is well-approximated by an \""adaptive-feedback-alignment\"" algorithm, and we analytically track its performance during learning in a prototype high-dimensional setting. Then, we compare different versions of forward-only algorithms, focusing on the Forward-Forward and PEPITA frameworks, and we show that they share the same learning principles. Overall, our work unveils the connections between three key neuro-inspired learning rules, providing a link between \""forward-only\"" algorithms, i.e., Forward-Forward and"", ""the connections between three key neuro-inspired learning rules, providing a link between \""forward-only\"" algorithms, i.e., Forward-Forward and PEPITA, and an approximation of backpropagation, i.e., Feedback Alignment."", ""Summary: Comparison-based learning addresses the problem of learning when, instead of explicit features or pairwise similarities, one only has access to comparisons of the form: \\emph{Object $A$ is more similar to $B$ than to $C$.} Recently, it has been shown that, in Hierarchical Clustering, single and complete linkage can be directly implemented using only such comparisons while several algorithms have been proposed to emulate the behaviour of average linkage. Hence, finding hierarchies (or dendrograms) using only comparisons is a well understood problem. However, evaluating their meaningfulness when no ground-truth nor explicit similarities are available remains an open question.   In this paper, we bridge this gap by proposing a new revenue function that allows one to measure the goodness of dendrograms using only comparisons. We show that this function is closely related to Dasgupta's cost for hierarchical clustering that uses pairwise similarities. On the theoretical side, we""]"
What is the key idea behind Reliability-Aware RAG (RA-RAG)?,abs-2410.22954v1,Direct Fact Retrieval & Definition,"Title: Retrieval-Augmented Generation with Estimation of Source Reliability 
Summary: Retrieval-augmented generation (RAG) addresses key limitations of large
language models (LLMs), such as hallucinations and outdated knowledge, by
incorporating external databases. These databases typically consult multiple
sources to encompass up-to-date and various information. However, standard RAG
methods often overlook the heterogeneous source reliability in the multi-source
database and retrieve documents solely based on relevance, making them prone to
propagating misinformation. To address this, we propose Reliability-Aware RAG
(RA-RAG) which estimates the reliability of multiple sources and incorporates
this information into both retrieval and aggregation processes. Specifically,
it iteratively estimates source reliability and true answers for a set of
queries with no labelling. Then, it selectively retrieves relevant documents
from a few of reliable sources and aggregates them using weighted majority
voting, where the selective retrieval ensures scalability while not
compromising the performance. We also introduce a benchmark designed to reflect
real-world scenarios with heterogeneous source reliability and demonstrate the
effectiveness of RA-RAG compared to a set of baselines. 

","Reliability-Aware RAG (RA-RAG) addresses the limitation of standard RAG methods by incorporating a mechanism to estimate the reliability of multiple sources in a multi-source database. RA-RAG iteratively estimates source reliability and true answers for sets of queries without requiring labelled data, then selectively retrieves relevant documents from a few reliable sources and aggregates them using weighted majority voting, ensuring both accuracy and scalability.","abs-2410.22954v1, abs-2401.02333v3, abs-2310.00841v3, abs-2006.10337v2, abs-2210.03308v1","[""Summary: Retrieval-augmented generation (RAG) addresses key limitations of large language models (LLMs), such as hallucinations and outdated knowledge, by incorporating external databases. These databases typically consult multiple sources to encompass up-to-date and various information. However, standard RAG methods often overlook the heterogeneous source reliability in the multi-source database and retrieve documents solely based on relevance, making them prone to propagating misinformation. To address this, we propose Reliability-Aware RAG (RA-RAG) which estimates the reliability of multiple sources and incorporates this information into both retrieval and aggregation processes. Specifically, it iteratively estimates source reliability and true answers for a set of queries with no labelling. Then, it selectively retrieves relevant documents from a few of reliable sources and aggregates them using weighted majority voting, where the selective retrieval ensures scalability while not"", ""Summary: The conventional use of the Retrieval-Augmented Generation (RAG) architecture has proven effective for retrieving information from diverse documents. However, challenges arise in handling complex table queries, especially within PDF documents containing intricate tabular structures.This research introduces an innovative approach to enhance the accuracy of complex table queries in RAG-based systems. Our methodology involves storing PDFs in the retrieval database and extracting tabular content separately. The extracted tables undergo a process of context enrichment, concatenating headers with corresponding values. To ensure a comprehensive understanding of the enriched data, we employ a fine-tuned version of the Llama-2-chat language model for summarisation within the RAG architecture. Furthermore, we augment the tabular data with contextual sense using the ChatGPT 3.5 API through a one-shot prompt. This enriched data is then fed into the retrieval database alongside other"", ""Title: Drug Discovery with Dynamic Goal-aware Fragments.\nPublished_date: 2023-10-02."", ""Title: Category-Specific CNN for Visual-aware CTR Prediction at JD.com.\nPublished_date: 2020-06-18."", ""Summary: The Generative Flow Network is a probabilistic framework where an agent learns a stochastic policy for object generation, such that the probability of generating an object is proportional to a given reward function. Its effectiveness has been shown in discovering high-quality and diverse solutions, compared to reward-maximizing reinforcement learning-based methods. Nonetheless, GFlowNets only learn from rewards of the terminal states, which can limit its applicability. Indeed, intermediate rewards play a critical role in learning, for example from intrinsic motivation to provide intermediate feedback even in particularly challenging sparse reward tasks. Inspired by this, we propose Generative Augmented Flow Networks (GAFlowNets), a novel learning framework to incorporate intermediate rewards into GFlowNets. We specify intermediate rewards by intrinsic motivation to tackle the exploration problem in sparse reward environments. GAFlowNets can leverage edge-based and state-based""]"
