Question,Source Article Index,Question Type,Summary,qwen2.5:3b,documentIDs,context_retrieved
Contrast the methods for generating synthetic data in 'Generating Datasets with Pretrained Language Models' (abs-2104.07540v3) and 'Synthetic Data Generation for Grammatical Error Correction' (abs-2105.13318v1).,"abs-2104.07540v3,abs-2105.13318v1",Comparative & Contrastive Questions,"Title: Generating Datasets with Pretrained Language Models 
Summary: To obtain high-quality sentence embeddings from pretrained language models
(PLMs), they must either be augmented with additional pretraining objectives or
finetuned on a large set of labeled text pairs. While the latter approach
typically outperforms the former, it requires great human effort to generate
suitable datasets of sufficient size. In this paper, we show how PLMs can be
leveraged to obtain high-quality sentence embeddings without the need for
labeled data, finetuning or modifications to the pretraining objective: We
utilize the generative abilities of large and high-performing PLMs to generate
entire datasets of labeled text pairs from scratch, which we then use for
finetuning much smaller and more efficient models. Our fully unsupervised
approach outperforms strong baselines on several semantic textual similarity
datasets. 

Title: Synthetic Data Generation for Grammatical Error Correction with Tagged
  Corruption Models 
Summary: Synthetic data generation is widely known to boost the accuracy of neural
grammatical error correction (GEC) systems, but existing methods often lack
diversity or are too simplistic to generate the broad range of grammatical
errors made by human writers. In this work, we use error type tags from
automatic annotation tools such as ERRANT to guide synthetic data generation.
We compare several models that can produce an ungrammatical sentence given a
clean sentence and an error type tag. We use these models to build a new, large
synthetic pre-training data set with error tag frequency distributions matching
a given development set. Our synthetic data set yields large and consistent
gains, improving the state-of-the-art on the BEA-19 and CoNLL-14 test sets. We
also show that our approach is particularly effective in adapting a GEC system,
trained on mixed native and non-native English, to a native English test set,
even surpassing real training data consisting of high-quality sentence pairs. 

","In ""Generating Datasets with Pretrained Language Models"" (abs-2104.07540v3), the approach uses pretrained language models to generate entire datasets of labeled text pairs without requiring any human-labeled data or modifications to the pretraining objectives, thereby circumventing the need for large-scale and costly manual annotation. In contrast, ""Synthetic Data Generation for Grammatical Error Correction"" (abs-2105.13318v1) focuses on generating synthetic datasets specifically aimed at improving grammatical error correction models with tagged corruption models, which involves different techniques tailored to the task of correcting grammatical errors rather than general dataset generation.","abs-2104.07540v3, abs-2105.13318v1, abs-1911.03110v1, abs-2204.04596v2, abs-2310.06837v1","[""Title: Generating Datasets with Pretrained Language Models.\nPublished_date: 2021-04-15.\nSummary: To obtain high-quality sentence embeddings from pretrained language models (PLMs), they must either be augmented with additional pretraining objectives or finetuned on a large set of labeled text pairs. While the latter approach typically outperforms the former, it requires great human effort to generate suitable datasets of sufficient size. In this paper, we show how PLMs can be leveraged to obtain high-quality sentence embeddings without the need for labeled data, finetuning or modifications to the pretraining objective: We utilize the generative abilities of large and high-performing PLMs to generate entire datasets of labeled text pairs from scratch, which we then use for finetuning much smaller and more efficient models. Our fully unsupervised approach outperforms strong baselines on several semantic textual similarity datasets."", ""Title: Synthetic Data Generation for Grammatical Error Correction with Tagged\n  Corruption Models.\nPublished_date: 2021-05-27."", ""Title: Pretrained Language Models for Document-Level Neural Machine Translation.\nPublished_date: 2019-11-08."", ""Title: Parameter-Efficient Tuning by Manipulating Hidden States of Pretrained\n  Language Models For Classification Tasks.\nPublished_date: 2022-04-10."", ""Title: Generating and Evaluating Tests for K-12 Students with Language Model\n  Simulations: A Case Study on Sentence Reading Efficiency.\nPublished_date: 2023-10-10.""]"
How do the goals of the RAG systems described in 'Benchmarking Retrieval-Augmented Large Language Models in Biomedical NLP' (abs-2405.08151v2) and 'BordIRlines: A Dataset for Evaluating Cross-lingual Retrieval-Augmented Generation' (abs-2410.01171v1) differ in terms of their application domains and evaluation focus?,"abs-2405.08151v2,abs-2410.01171v1",Comparative & Contrastive Questions,"Title: Benchmarking Retrieval-Augmented Large Language Models in Biomedical
  NLP: Application, Robustness, and Self-Awareness 
Summary: Large language models (LLM) have demonstrated remarkable capabilities in
various biomedical natural language processing (NLP) tasks, leveraging the
demonstration within the input context to adapt to new tasks. However, LLM is
sensitive to the selection of demonstrations. To address the hallucination
issue inherent in LLM, retrieval-augmented LLM (RAL) offers a solution by
retrieving pertinent information from an established database. Nonetheless,
existing research work lacks rigorous evaluation of the impact of
retrieval-augmented large language models on different biomedical NLP tasks.
This deficiency makes it challenging to ascertain the capabilities of RAL
within the biomedical domain. Moreover, the outputs from RAL are affected by
retrieving the unlabeled, counterfactual, or diverse knowledge that is not well
studied in the biomedical domain. However, such knowledge is common in the real
world. Finally, exploring the self-awareness ability is also crucial for the
RAL system. So, in this paper, we systematically investigate the impact of RALs
on 5 different biomedical tasks (triple extraction, link prediction,
classification, question answering, and natural language inference). We analyze
the performance of RALs in four fundamental abilities, including unlabeled
robustness, counterfactual robustness, diverse robustness, and negative
awareness. To this end, we proposed an evaluation framework to assess the RALs'
performance on different biomedical NLP tasks and establish four different
testbeds based on the aforementioned fundamental abilities. Then, we evaluate 3
representative LLMs with 3 different retrievers on 5 tasks over 9 datasets. 

Title: BordIRlines: A Dataset for Evaluating Cross-lingual Retrieval-Augmented
  Generation 
Summary: Large language models excel at creative generation but continue to struggle
with the issues of hallucination and bias. While retrieval-augmented generation
(RAG) provides a framework for grounding LLMs' responses in accurate and
up-to-date information, it still raises the question of bias: which sources
should be selected for inclusion in the context? And how should their
importance be weighted? In this paper, we study the challenge of cross-lingual
RAG and present a dataset to investigate the robustness of existing systems at
answering queries about geopolitical disputes, which exist at the intersection
of linguistic, cultural, and political boundaries. Our dataset is sourced from
Wikipedia pages containing information relevant to the given queries and we
investigate the impact of including additional context, as well as the
composition of this context in terms of language and source, on an LLM's
response. Our results show that existing RAG systems continue to be challenged
by cross-lingual use cases and suffer from a lack of consistency when they are
provided with competing information in multiple languages. We present case
studies to illustrate these issues and outline steps for future research to
address these challenges. We make our dataset and code publicly available at
https://github.com/manestay/bordIRlines. 

","The document ""Benchmarking Retrieval-Augmented Large Language Models in Biomedical NLP"" (abs-2405.08151v2) focuses on the application, robustness, and self-awareness of retrieval-augmented large language models specifically in biomedical Natural Language Processing tasks. In contrast, ""BordIRlines: A Dataset for Evaluating Cross-lingual Retrieval-Augmented Generation"" (abs-2410.01171v1) focuses on the evaluation of cross-lingual retrieval-augmented generation systems, not limited to biomedical applications.","abs-2405.08151v2, abs-2311.05169v1, abs-2203.08308v1, abs-2212.13138v1, abs-2406.12534v4","[""Title: Benchmarking Retrieval-Augmented Large Language Models in Biomedical\n  NLP: Application, Robustness, and Self-Awareness.\nPublished_date: 2024-05-13."", ""Title: Large Language Models and Prompt Engineering for Biomedical Query\n  Focused Multi-Document Summarisation.\nPublished_date: 2023-11-09.\nSummary: This paper reports on the use of prompt engineering and GPT-3.5 for biomedical query-focused multi-document summarisation. Using GPT-3.5 and appropriate prompts, our system achieves top ROUGE-F1 results in the task of obtaining short-paragraph-sized answers to biomedical questions in the 2023 BioASQ Challenge (BioASQ 11b). This paper confirms what has been observed in other domains: 1) Prompts that incorporated few-shot samples generally improved on their counterpart zero-shot variants; 2) The largest improvement was achieved by retrieval augmented generation. The fact that these prompts allow our top runs to rank within the top two runs of BioASQ 11b demonstrate the power of using adequate prompts for Large Language Models in general, and GPT-3.5 in particular, for query-focused summarisation."", ""Title: Multilingual Generative Language Models for Zero-Shot Cross-Lingual\n  Event Argument Extraction.\nPublished_date: 2022-03-15."", ""Title: Large Language Models Encode Clinical Knowledge.\nPublished_date: 2022-12-26."", ""Title: Unified Active Retrieval for Retrieval Augmented Generation.\nPublished_date: 2024-06-18.""]"
Compare the motivations for creating the 'Re-TACRED' dataset (abs-2104.08398v1) and the 'AmbigQA' dataset (abs-2004.10645v2). What specific shortcomings in existing NLP datasets did each aim to address?,"abs-2104.08398v1,abs-2004.10645v2",Comparative & Contrastive Questions,"Title: Re-TACRED: Addressing Shortcomings of the TACRED Dataset 
Summary: TACRED is one of the largest and most widely used sentence-level relation
extraction datasets. Proposed models that are evaluated using this dataset
consistently set new state-of-the-art performance. However, they still exhibit
large error rates despite leveraging external knowledge and unsupervised
pretraining on large text corpora. A recent study suggested that this may be
due to poor dataset quality. The study observed that over 50% of the most
challenging sentences from the development and test sets are incorrectly
labeled and account for an average drop of 8% f1-score in model performance.
However, this study was limited to a small biased sample of 5k (out of a total
of 106k) sentences, substantially restricting the generalizability and broader
implications of its findings. In this paper, we address these shortcomings by:
(i) performing a comprehensive study over the whole TACRED dataset, (ii)
proposing an improved crowdsourcing strategy and deploying it to re-annotate
the whole dataset, and (iii) performing a thorough analysis to understand how
correcting the TACRED annotations affects previously published results. After
verification, we observed that 23.9% of TACRED labels are incorrect. Moreover,
evaluating several models on our revised dataset yields an average f1-score
improvement of 14.3% and helps uncover significant relationships between the
different models (rather than simply offsetting or scaling their scores by a
constant factor). Finally, aside from our analysis we also release Re-TACRED, a
new completely re-annotated version of the TACRED dataset that can be used to
perform reliable evaluation of relation extraction models. 

Title: AmbigQA: Answering Ambiguous Open-domain Questions 
Summary: Ambiguity is inherent to open-domain question answering; especially when
exploring new topics, it can be difficult to ask questions that have a single,
unambiguous answer. In this paper, we introduce AmbigQA, a new open-domain
question answering task which involves finding every plausible answer, and then
rewriting the question for each one to resolve the ambiguity. To study this
task, we construct AmbigNQ, a dataset covering 14,042 questions from NQ-open,
an existing open-domain QA benchmark. We find that over half of the questions
in NQ-open are ambiguous, with diverse sources of ambiguity such as event and
entity references. We also present strong baseline models for AmbigQA which we
show benefit from weakly supervised learning that incorporates NQ-open,
strongly suggesting our new task and data will support significant future
research effort. Our data and baselines are available at
https://nlp.cs.washington.edu/ambigqa. 

","The paper ""Re-TACRED"" aimed to address significant issues in the original TACRED dataset by performing a comprehensive study over the whole dataset, proposing an improved crowdsourcing strategy, and deploying it for re-annotation. The motivation was the poor quality of the dataset, as evidenced by substantial labeling errors that significantly affected model performance (an average drop of 8% f1-score).

In contrast, ""AmbigQA"" dataset's creation aimed to mitigate specific shortcomings in multimodal entity linking datasets. It presented a high-quality human-annotated MEL dataset with diversified contextual topics and entity types from Wikinews and Wikipedia, addressing limitations such as limited contextual diversity and restricted availability of mentions and entities.","abs-2012.15482v1, abs-2204.06347v1, abs-2404.18557v1, abs-2102.02183v1, abs-2104.08398v1","[""Summary: Natural language (NL) explanations of model predictions are gaining popularity as a means to understand and verify decisions made by large black-box pre-trained models, for NLP tasks such as Question Answering (QA) and Fact Verification. Recently, pre-trained sequence to sequence (seq2seq) models have proven to be very effective in jointly making predictions, as well as generating NL explanations. However, these models have many shortcomings; they can fabricate explanations even for incorrect predictions, they are difficult to adapt to long input documents, and their training requires a large amount of labeled data. In this paper, we develop FiD-Ex, which addresses these shortcomings for seq2seq models by: 1) introducing sentence markers to eliminate explanation fabrication by encouraging extractive generation, 2) using the fusion-in-decoder architecture to handle long input contexts, and 3) intermediate fine-tuning on re-structured open domain QA datasets to improve few-shot"", ""Summary: Multimodal Entity Linking (MEL) which aims at linking mentions with multimodal contexts to the referent entities from a knowledge base (e.g., Wikipedia), is an essential task for many multimodal applications. Although much attention has been paid to MEL, the shortcomings of existing MEL datasets including limited contextual topics and entity types, simplified mention ambiguity, and restricted availability, have caused great obstacles to the research and application of MEL. In this paper, we present WikiDiverse, a high-quality human-annotated MEL dataset with diversified contextual topics and entity types from Wikinews, which uses Wikipedia as the corresponding knowledge base. A well-tailored annotation procedure is adopted to ensure the quality of the dataset. Based on WikiDiverse, a sequence of well-designed MEL models with intra-modality and inter-modality attentions are implemented, which utilize the visual information of images more adequately than existing MEL models do."", ""Summary: Automated essay scoring (AES) to evaluate second language (L2) proficiency has been a firmly established technology used in educational contexts for decades. Although holistic scoring has seen advancements in AES that match or even exceed human performance, analytic scoring still encounters issues as it inherits flaws and shortcomings from the human scoring process. The recent introduction of large language models presents new opportunities for automating the evaluation of specific aspects of L2 writing proficiency. In this paper, we perform a series of experiments using GPT-4 in a zero-shot fashion on a publicly available dataset annotated with holistic scores based on the Common European Framework of Reference and aim to extract detailed information about their underlying analytic components. We observe significant correlations between the automatically predicted analytic scores and multiple features associated with the individual proficiency components."", ""Summary: Psycholinguistic studies of human word processing and lexical access provide ample evidence of the preferred nature of word-initial versus word-final segments, e.g., in terms of attention paid by listeners (greater) or the likelihood of reduction by speakers (lower). This has led to the conjecture -- as in Wedel et al. (2019b), but common elsewhere -- that languages have evolved to provide more information earlier in words than later. Information-theoretic methods to establish such tendencies in lexicons have suffered from several methodological shortcomings that leave open the question of whether this high word-initial informativeness is actually a property of the lexicon or simply an artefact of the incremental nature of recognition. In this paper, we point out the confounds in existing methods for comparing the informativeness of segments early in the word versus later in the word, and present several new measures that avoid these confounds. When controlling for these"", ""Summary: TACRED is one of the largest and most widely used sentence-level relation extraction datasets. Proposed models that are evaluated using this dataset consistently set new state-of-the-art performance. However, they still exhibit large error rates despite leveraging external knowledge and unsupervised pretraining on large text corpora. A recent study suggested that this may be due to poor dataset quality. The study observed that over 50% of the most challenging sentences from the development and test sets are incorrectly labeled and account for an average drop of 8% f1-score in model performance. However, this study was limited to a small biased sample of 5k (out of a total of 106k) sentences, substantially restricting the generalizability and broader implications of its findings. In this paper, we address these shortcomings by: (i) performing a comprehensive study over the whole TACRED dataset, (ii) proposing an improved crowdsourcing strategy and deploying it to re-annotate""]"
How could the 'UNcommonsense Reasoning' approach (abs-2311.08469v2) be used to evaluate the robustness of the 'Faithfully Reflecting Updated Information in Text' (FRUIT) system (abs-2112.08634v2) when the new evidence presents an unusual or unexpected update?,"abs-2311.08469v2,abs-2112.08634v2",Synthesis & Multi-Hop Reasoning Questions,"Title: UNcommonsense Reasoning: Abductive Reasoning about Uncommon Situations 
Summary: Language technologies that accurately model the dynamics of events must
perform commonsense reasoning. Existing work evaluating commonsense reasoning
focuses on making inferences about common, everyday situations. To instead
investigate the ability to model unusual, unexpected, and unlikely situations,
we explore the task of uncommonsense abductive reasoning. Given a piece of
context with an unexpected outcome, this task requires reasoning abductively to
generate an explanation that makes the unexpected outcome more likely in the
context. To this end, we curate and release a new English language corpus
called UNcommonsense. We characterize the performance differences between human
explainers and the best-performing large language models, finding that
model-enhanced human-written explanations achieve the highest quality by
trading off between specificity and diversity. Finally, we experiment with
several imitation learning algorithms to train open and accessible language
models on this task. When compared with the vanilla supervised fine-tuning
approach, these methods consistently reduce lose rates on both common and
uncommonsense abductive reasoning judged by human evaluators. 

Title: FRUIT: Faithfully Reflecting Updated Information in Text 
Summary: Textual knowledge bases such as Wikipedia require considerable effort to keep
up to date and consistent. While automated writing assistants could potentially
ease this burden, the problem of suggesting edits grounded in external
knowledge has been under-explored. In this paper, we introduce the novel
generation task of *faithfully reflecting updated information in text* (FRUIT)
where the goal is to update an existing article given new evidence. We release
the FRUIT-WIKI dataset, a collection of over 170K distantly supervised data
produced from pairs of Wikipedia snapshots, along with our data generation
pipeline and a gold evaluation set of 914 instances whose edits are guaranteed
to be supported by the evidence. We provide benchmark results for popular
generation systems as well as EDIT5 -- a T5-based approach tailored to editing
we introduce that establishes the state of the art. Our analysis shows that
developing models that can update articles faithfully requires new capabilities
for neural generation models, and opens doors to many new applications. 

","The UNcommonsense Reasoning approach (abs-2311.08469v2) can be used to evaluate the robustness of the FRUIT system by identifying and processing unusual or unexpected updates in the input text, which is crucial for assessing how well the FRUIT system maintains fidelity while handling perturbations that deviate from expected norms. By using this approach, one could ensure that the FRUIT system continues to reflect updated information accurately despite encountering unforeseen changes in the input data.","abs-2112.08634v2, abs-2104.07623v1, abs-2304.12764v1, abs-2401.04361v1","[""Title: FRUIT: Faithfully Reflecting Updated Information in Text.\nPublished_date: 2021-12-16."", ""without deleting or injecting tokens, and measure the effects on the target side in terms of both robustness and faithfulness. Across several experimental conditions, we observe a strong tendency towards robustness rather than faithfulness. These results allow us to better understand the trade-off between faithfulness and robustness in NMT, and opens up the possibility of developing systems where users have more autonomy and control in selecting which property is best suited for their use case."", ""Summary: Rapid progress in Neural Machine Translation (NMT) systems over the last few years has been driven primarily towards improving translation quality, and as a secondary focus, improved robustness to input perturbations (e.g. spelling and grammatical mistakes). While performance and robustness are important objectives, by over-focusing on these, we risk overlooking other important properties. In this paper, we draw attention to the fact that for some applications, faithfulness to the original (input) text is important to preserve, even if it means introducing unusual language patterns in the (output) translation. We propose a simple, novel way to quantify whether an NMT system exhibits robustness and faithfulness, focusing on the case of word-order perturbations. We explore a suite of functions to perturb the word order of source sentences without deleting or injecting tokens, and measure the effects on the target side in terms of both robustness and faithfulness. Across several"", ""adaptation method to promote the model to make stable predictions for samples with distribution shifts. Extensive experiments on adversarial robustness and cross-lingual transferring demonstrate that our method can achieve higher or comparable performance with less inference time over strong PLM backbones and previous state-of-the-art TTA methods."", ""for improving the robustness of KGD. Specifically, we make use of the entity information in a KGD sample to create both its positive and negative samples which involve semantic-irrelevant and semantic-relevant perturbations, respectively. The contrastive learning framework ensures the KGD model is aware of these two types of perturbations, thus generating informative responses with the potentially noisy inputs in real applications. Experimental results on three benchmark datasets show that our method achieves new state-of-the-art performance in terms of automatic evaluation scores, verifying its effectiveness and potentiality. Furthermore, we show that our method can generate better responses than comparison models in both the noisy and the few-shot settings.""]"
