Question,Source Article Index,Question Type,Summary,qwen2.5:3b,documentIDs,context_retrieved
What is the primary contribution of the paper 'Neural Poetry: Learning to Generate Poems using Syllables'?,abs-1908.08861v2,Summarization / Purpose Identification Questions,"Title: Neural Poetry: Learning to Generate Poems using Syllables 
Summary: Motivated by the recent progresses on machine learning-based models that
learn artistic styles, in this paper we focus on the problem of poem
generation. This is a challenging task in which the machine has to capture the
linguistic features that strongly characterize a certain poet, as well as the
semantics of the poet's production, that are influenced by his personal
experiences and by his literary background. Since poetry is constructed using
syllables, that regulate the form and structure of poems, we propose a
syllable-based neural language model, and we describe a poem generation
mechanism that is designed around the poet style, automatically selecting the
most representative generations. The poetic work of a target author is usually
not enough to successfully train modern deep neural networks, so we propose a
multi-stage procedure that exploits non-poetic works of the same author, and
also other publicly available huge corpora to learn syntax and grammar of the
target language. We focus on the Italian poet Dante Alighieri, widely famous
for his Divine Comedy. A quantitative and qualitative experimental analysis of
the generated tercets is reported, where we included expert judges with strong
background in humanistic studies. The generated tercets are frequently
considered to be real by a generic population of judges, with relative
difference of 56.25\% with respect to the ones really authored by Dante, and
expert judges perceived Dante's style and rhymes in the generated text. 

","The primary contribution of the paper ""Neural Poetry: Learning to Generate Poems using Syllables"" is proposing a syllable-based neural language model and a poem generation mechanism designed around poet style, which automatically selects the most representative generations. This approach addresses the challenge of capturing linguistic features that strongly characterize specific poets while also considering their personal experiences and literary backgrounds.","abs-1908.08861v2, abs-2212.02911v1, abs-1909.09986v1, abs-1804.01041v1, abs-2203.02055v1","[""Summary: Motivated by the recent progresses on machine learning-based models that learn artistic styles, in this paper we focus on the problem of poem generation. This is a challenging task in which the machine has to capture the linguistic features that strongly characterize a certain poet, as well as the semantics of the poet's production, that are influenced by his personal experiences and by his literary background. Since poetry is constructed using syllables, that regulate the form and structure of poems, we propose a syllable-based neural language model, and we describe a poem generation mechanism that is designed around the poet style, automatically selecting the most representative generations. The poetic work of a target author is usually not enough to successfully train modern deep neural networks, so we propose a multi-stage procedure that exploits non-poetic works of the same author, and also other publicly available huge corpora to learn syntax and grammar of the target"", ""Title: Modern French Poetry Generation with RoBERTa and GPT-2.\nPublished_date: 2022-12-06.\nSummary: We present a novel neural model for modern poetry generation in French. The model consists of two pretrained neural models that are fine-tuned for the poem generation task. The encoder of the model is a RoBERTa based one while the decoder is based on GPT-2. This way the model can benefit from the superior natural language understanding performance of RoBERTa and the good natural language generation performance of GPT-2. Our evaluation shows that the model can create French poetry successfully. On a 5 point scale, the lowest score of 3.57 was given by human judges to typicality and emotionality of the output poetry while the best score of 3.79 was given to understandability."", ""Title: Improving Quality and Efficiency in Plan-based Neural Data-to-Text\n  Generation.\nPublished_date: 2019-09-22.\nSummary: We follow the step-by-step approach to neural data-to-text generation we proposed in Moryossef et al (2019), in which the generation process is divided into a text-planning stage followed by a plan-realization stage. We suggest four extensions to that framework: (1) we introduce a trainable neural planning component that can generate effective plans several orders of magnitude faster than the original planner; (2) we incorporate typing hints that improve the model's ability to deal with unseen relations and entities; (3) we introduce a verification-by-reranking stage that substantially improves the faithfulness of the resulting texts; (4) we incorporate a simple but effective referring expression generation module. These extensions result in a generation process that is faster, more fluent, and more accurate."", ""Title: Multi-lingual neural title generation for e-Commerce browse pages.\nPublished_date: 2018-04-03."", ""Summary: Text generation aims to produce human-like natural language output for down-stream tasks. It covers a wide range of applications like machine translation, document summarization, dialogue generation and so on. Recently deep neural network-based end-to-end architectures have been widely adopted. The end-to-end approach conflates all sub-modules, which used to be designed by complex handcrafted rules, into a holistic encode-decode architecture. Given enough training data, it is able to achieve state-of-the-art performance yet avoiding the need of language/domain-dependent knowledge. Nonetheless, deep learning models are known to be extremely data-hungry, and text generated from them usually suffer from low diversity, interpretability and controllability. As a result, it is difficult to trust the output from them in real-life applications. Deep latent-variable models, by specifying the probabilistic distribution over an intermediate latent process, provide a potential way of""]"
What is the main purpose of the DetectLLM framework described in abstract abs-2306.05540v1?,abs-2306.05540v1,Summarization / Purpose identification Questions,"Title: DetectLLM: Leveraging Log Rank Information for Zero-Shot Detection of
  Machine-Generated Text 
Summary: With the rapid progress of large language models (LLMs) and the huge amount
of text they generated, it becomes more and more impractical to manually
distinguish whether a text is machine-generated. Given the growing use of LLMs
in social media and education, it prompts us to develop methods to detect
machine-generated text, preventing malicious usage such as plagiarism,
misinformation, and propaganda. Previous work has studied several zero-shot
methods, which require no training data. These methods achieve good
performance, but there is still a lot of room for improvement. In this paper,
we introduce two novel zero-shot methods for detecting machine-generated text
by leveraging the log rank information. One is called DetectLLM-LRR, which is
fast and efficient, and the other is called DetectLLM-NPR, which is more
accurate, but slower due to the need for perturbations. Our experiments on
three datasets and seven language models show that our proposed methods improve
over the state of the art by 3.9 and 1.75 AUROC points absolute. Moreover,
DetectLLM-NPR needs fewer perturbations than previous work to achieve the same
level of performance, which makes it more practical for real-world use. We also
investigate the efficiency--performance trade-off based on users preference on
these two measures and we provide intuition for using them in practice
effectively. We release the data and the code of both methods in
https://github.com/mbzuai-nlp/DetectLLM 

",No Answer,"abs-2406.12641v2, abs-2309.08173v3, abs-2408.07465v1, abs-2403.15458v1, abs-1904.00785v1","[""Title: DetectBench: Can Large Language Model Detect and Piece Together Implicit\n  Evidence?.\nPublished_date: 2024-06-18."", ""Summary: Large Language Models (LLMs) have gained prominence in the field of Legal Intelligence, offering potential applications in assisting legal professionals and laymen. However, the centralized training of these Legal LLMs raises data privacy concerns, as legal data is distributed among various institutions containing sensitive individual information. This paper addresses this challenge by exploring the integration of Legal LLMs with Federated Learning (FL) methodologies. By employing FL, Legal LLMs can be fine-tuned locally on devices or clients, and their parameters are aggregated and distributed on a central server, ensuring data privacy without directly sharing raw data. However, computation and communication overheads hinder the full fine-tuning of LLMs under the FL setting. Moreover, the distribution shift of legal data reduces the effectiveness of FL methods. To this end, in this paper, we propose the first Federated Legal Large Language Model (FedJudge) framework, which"", ""Summary: Prompt optimization is essential for enhancing the performance of Large Language Models (LLMs) in a range of Natural Language Processing (NLP) tasks, particularly in scenarios of few-shot learning where training examples are incorporated directly into the prompt. Despite the growing interest in optimizing prompts with few-shot examples, existing methods for prompt optimization are often resource-intensive or perform inadequately. In this work, we propose PrOmpting with Episodic Memory (POEM), a novel prompt optimization technique that is simple, efficient, and demonstrates strong generalization capabilities. We approach prompt optimization as a Reinforcement Learning (RL) challenge, using episodic memory to archive combinations of input data, permutations of few-shot examples, and the rewards observed during training. In the testing phase, we optimize the sequence of examples for each test query by selecting the sequence that yields the highest total rewards from the top-k"", ""Title: Fine-Tuning Pre-trained Language Models to Detect In-Game Trash Talks.\nPublished_date: 2024-03-19."", ""are developing a question-answering system for students and enrollees of the Perm National Research Polytechnic University, we have faced the problem of user's intent detection. The subject area of our system is very specific, that is why there is a lack of training data. This aspect makes intent classification task more challenging for using state of the art deep learning methods. In this paper, we propose an approach of the questions embeddings representation based on calculation of Shannon entropy.The goal of the approach is to produce low dimensional question vectors as neural approaches do and to outperform related methods, described above in condition of small dataset. We evaluate and compare our model with existing ones using logistic regression and dataset that contains questions asked by students and enrollees. The data is labeled into six classes. Experimental comparison of proposed approach and other models revealed that proposed model performed better in the given task.""]"
Summarize the main finding of the paper 'Word Order Matters when you Increase Masking'.,abs-2211.04427v1,Summarization / Purpose Identification Questions,"Title: Word Order Matters when you Increase Masking 
Summary: Word order, an essential property of natural languages, is injected in
Transformer-based neural language models using position encoding. However,
recent experiments have shown that explicit position encoding is not always
useful, since some models without such feature managed to achieve state-of-the
art performance on some tasks. To understand better this phenomenon, we examine
the effect of removing position encodings on the pre-training objective itself
(i.e., masked language modelling), to test whether models can reconstruct
position information from co-occurrences alone. We do so by controlling the
amount of masked tokens in the input sentence, as a proxy to affect the
importance of position information for the task. We find that the necessity of
position information increases with the amount of masking, and that masked
language models without position encodings are not able to reconstruct this
information on the task. These findings point towards a direct relationship
between the amount of masking and the ability of Transformers to capture
order-sensitive aspects of language using position encoding. 

","The paper ""Word Order Matters when you Increase Masking"" found that position information is crucial for tasks like masked language modeling. As the amount of masking increases in input sentences, the necessity of positional information for this task also rises. Models without explicit position encoding are not able to reconstruct such information effectively on the task, highlighting a direct relationship between word order and performance in these models.","abs-2211.04427v1, abs-1604.08633v2, abs-2109.00442v1, abs-2307.15933v1, abs-2407.09184v1","[""Summary: Word order, an essential property of natural languages, is injected in Transformer-based neural language models using position encoding. However, recent experiments have shown that explicit position encoding is not always useful, since some models without such feature managed to achieve state-of-the art performance on some tasks. To understand better this phenomenon, we examine the effect of removing position encodings on the pre-training objective itself (i.e., masked language modelling), to test whether models can reconstruct position information from co-occurrences alone. We do so by controlling the amount of masked tokens in the input sentence, as a proxy to affect the importance of position information for the task. We find that the necessity of position information increases with the amount of masking, and that masked language models without position encodings are not able to reconstruct this information on the task. These findings point towards a direct relationship"", ""Title: Word Ordering Without Syntax.\nPublished_date: 2016-04-28.\nSummary: Recent work on word ordering has argued that syntactic structure is important, or even required, for effectively recovering the order of a sentence. We find that, in fact, an n-gram language model with a simple heuristic gives strong results on this task. Furthermore, we show that a long short-term memory (LSTM) language model is even more effective at recovering order, with our basic model outperforming a state-of-the-art syntactic model by 11.5 BLEU points. Additional data and larger beams yield further gains, at the expense of training and search time."", ""Title: Position Masking for Improved Layout-Aware Document Understanding.\nPublished_date: 2021-09-01.\nSummary: Natural language processing for document scans and PDFs has the potential to enormously improve the efficiency of business processes. Layout-aware word embeddings such as LayoutLM have shown promise for classification of and information extraction from such documents. This paper proposes a new pre-training task called that can improve performance of layout-aware word embeddings that incorporate 2-D position embeddings. We compare models pre-trained with only language masking against models pre-trained with both language masking and position masking, and we find that position masking improves performance by over 5% on a form understanding task."", ""Summary: Large-scale language models such as DNABert and LOGO aim to learn optimal gene representations and are trained on the entire Human Reference Genome. However, standard tokenization schemes involve a simple sliding window of tokens like k-mers that do not leverage any gene-based semantics and thus may lead to (trivial) masking of easily predictable sequences and subsequently inefficient Masked Language Modeling (MLM) training. Therefore, we propose a novel masking algorithm, GeneMask, for MLM training of gene sequences, where we randomly identify positions in a gene sequence as mask centers and locally select the span around the mask center with the highest Normalized Pointwise Mutual Information (NPMI) to mask. We observe that in the absence of human-understandable semantics in the genomics domain (in contrast, semantic units like words and phrases are inherently available in NLP), GeneMask-based models substantially outperform the SOTA models (DNABert and LOGO) over four"", ""Summary: Syntactic elements, such as word order and case markers, are fundamental in natural language processing. Recent studies show that syntactic information boosts language model performance and offers clues for people to understand their learning mechanisms. Unlike languages with a fixed word order such as English, Korean allows for varied word sequences, despite its canonical structure, due to case markers that indicate the functions of sentence components. This study explores whether Korean language models can accurately capture this flexibility. We note that incomplete word orders and omitted case markers frequently appear in ordinary Korean communication. To investigate this further, we introduce the Syntactically Incomplete Korean (SIKO) dataset. Through SIKO, we assessed Korean language models' flexibility with incomplete syntax and confirmed the dataset's training value. Results indicate these models reflect Korean's inherent flexibility, accurately handling incomplete""]"
"How do the approaches for handling multilingual machine translation differ between the 'Multi-Way, Multilingual Neural Machine Translation' paper (abs-1601.01073v1) and the 'Lego-MT' paper (abs-2212.10551v3)?","abs-1601.01073v1,abs-2212.10551v3",Comparative & Contrastive Questions,"Title: Multi-Way, Multilingual Neural Machine Translation with a Shared
  Attention Mechanism 
Summary: We propose multi-way, multilingual neural machine translation. The proposed
approach enables a single neural translation model to translate between
multiple languages, with a number of parameters that grows only linearly with
the number of languages. This is made possible by having a single attention
mechanism that is shared across all language pairs. We train the proposed
multi-way, multilingual model on ten language pairs from WMT'15 simultaneously
and observe clear performance improvements over models trained on only one
language pair. In particular, we observe that the proposed model significantly
improves the translation quality of low-resource language pairs. 

Title: Lego-MT: Learning Detachable Models for Massively Multilingual Machine
  Translation 
Summary: Multilingual neural machine translation (MNMT) aims to build a unified model
for many language directions. Existing monolithic models for MNMT encounter two
challenges: parameter interference among languages and inefficient inference
for large models. In this paper, we revisit the classic multi-way structures
and develop a detachable model by assigning each language (or group of
languages) to an individual branch that supports plug-and-play training and
inference. To address the needs of learning representations for all languages
in a unified space, we propose a novel efficient training recipe, upon which we
build an effective detachable model, Lego-MT. For a fair comparison, we collect
data from OPUS and build a translation benchmark covering 433 languages and
1.3B parallel data. Experiments show that Lego-MT with 1.2B parameters brings
an average gain of 3.2 spBLEU. It even outperforms M2M-100 with 12B parameters.
The proposed training recipe brings a 28.2$\times$ speedup over the
conventional multi-way training method.\footnote{
\url{https://github.com/CONE-MT/Lego-MT}.} 

","The 'Multi-Way, Multilingual Neural Machine Translation' paper proposes a single neural translation model that can translate between multiple languages using a shared attention mechanism, which is linearly scalable with the number of languages. In contrast, the 'Lego-MT' approach leverages pre-training to develop a universal multilingual model by using random aligned substitution and fine-tuning it on specific language pairs, aiming for minimal parameter use and effectiveness in under-resourced scenarios.","abs-1601.01073v1, abs-1611.04798v1, abs-2010.03142v3, abs-1909.12406v1","[""Title: Multi-Way, Multilingual Neural Machine Translation with a Shared\n  Attention Mechanism.\nPublished_date: 2016-01-06.\nSummary: We propose multi-way, multilingual neural machine translation. The proposed approach enables a single neural translation model to translate between multiple languages, with a number of parameters that grows only linearly with the number of languages. This is made possible by having a single attention mechanism that is shared across all language pairs. We train the proposed multi-way, multilingual model on ten language pairs from WMT'15 simultaneously and observe clear performance improvements over models trained on only one language pair. In particular, we observe that the proposed model significantly improves the translation quality of low-resource language pairs."", ""Title: Toward Multilingual Neural Machine Translation with Universal Encoder\n  and Decoder.\nPublished_date: 2016-11-15.\nSummary: In this paper, we present our first attempts in building a multilingual Neural Machine Translation framework under a unified approach. We are then able to employ attention-based NMT for many-to-many multilingual translation tasks. Our approach does not require any special treatment on the network architecture and it allows us to learn minimal number of free parameters in a standard way of training. Our approach has shown its effectiveness in an under-resourced translation scenario with considerable improvements up to 2.6 BLEU points. In addition, the approach has achieved interesting and promising results when applied in the translation task that there is no direct parallel corpus between source and target languages."", ""Summary: We investigate the following question for machine translation (MT): can we develop a single universal MT model to serve as the common seed and obtain derivative and improved models on arbitrary language pairs? We propose mRASP, an approach to pre-train a universal multilingual neural machine translation model. Our key idea in mRASP is its novel technique of random aligned substitution, which brings words and phrases with similar meanings across multiple languages closer in the representation space. We pre-train a mRASP model on 32 language pairs jointly with only public datasets. The model is then fine-tuned on downstream language pairs to obtain specialized MT models. We carry out extensive experiments on 42 translation directions across a diverse settings, including low, medium, rich resource, and as well as transferring to exotic language pairs. Experimental results demonstrate that mRASP achieves significant performance improvement compared to directly training on those"", ""Summary: Simultaneous machine translation models start generating a target sequence before they have encoded or read the source sequence. Recent approaches for this task either apply a fixed policy on a state-of-the art Transformer model, or a learnable monotonic attention on a weaker recurrent neural network-based structure. In this paper, we propose a new attention mechanism, Monotonic Multihead Attention (MMA), which extends the monotonic attention mechanism to multihead attention. We also introduce two novel and interpretable approaches for latency control that are specifically designed for multiple attentions heads. We apply MMA to the simultaneous machine translation task and demonstrate better latency-quality tradeoffs compared to MILk, the previous state-of-the-art approach. We also analyze how the latency controls affect the attention span and we motivate the introduction of our model by analyzing the effect of the number of decoder layers and heads on quality and latency."", ""Title: Pre-training Multilingual Neural Machine Translation by Leveraging\n  Alignment Information.\nPublished_date: 2020-10-07.""]"
