Question,Source Article Index,Question Type,Summary,qwen2.5:3b,documentIDs,context_retrieved
Contrast the approaches to model compression in 'Iterative Activation-based Structured Pruning' (abs-2201.09881v1) and 'InstantNet' (abs-2104.10853v2).,"abs-2201.09881v1,abs-2104.10853v2",Comparative & Contrastive,"Title: Iterative Activation-based Structured Pruning 
Summary: Deploying complex deep learning models on edge devices is challenging because
they have substantial compute and memory resource requirements, whereas edge
devices' resource budget is limited. To solve this problem, extensive pruning
techniques have been proposed for compressing networks. Recent advances based
on the Lottery Ticket Hypothesis (LTH) show that iterative model pruning tends
to produce smaller and more accurate models. However, LTH research focuses on
unstructured pruning, which is hardware-inefficient and difficult to accelerate
on hardware platforms.
  In this paper, we investigate iterative pruning in the context of structured
pruning because structurally pruned models map well on commodity hardware. We
find that directly applying a structured weight-based pruning technique
iteratively, called iterative L1-norm based pruning (ILP), does not produce
accurate pruned models. To solve this problem, we propose two activation-based
pruning methods, Iterative Activation-based Pruning (IAP) and Adaptive
Iterative Activation-based Pruning (AIAP). We observe that, with only 1%
accuracy loss, IAP and AIAP achieve 7.75X and 15.88$X compression on LeNet-5,
and 1.25X and 1.71X compression on ResNet-50, whereas ILP achieves 4.77X and
1.13X, respectively. 

Title: InstantNet: Automated Generation and Deployment of Instantaneously
  Switchable-Precision Networks 
Summary: The promise of Deep Neural Network (DNN) powered Internet of Thing (IoT)
devices has motivated a tremendous demand for automated solutions to enable
fast development and deployment of efficient (1) DNNs equipped with
instantaneous accuracy-efficiency trade-off capability to accommodate the
time-varying resources at IoT devices and (2) dataflows to optimize DNNs'
execution efficiency on different devices. Therefore, we propose InstantNet to
automatically generate and deploy instantaneously switchable-precision networks
which operate at variable bit-widths. Extensive experiments show that the
proposed InstantNet consistently outperforms state-of-the-art designs. 

","The document ""Iterative Activation-based Structured Pruning"" (abs-2201.09881v1) focuses on activation-based pruning methods that achieve significant compression ratios without substantial accuracy loss, as demonstrated with models like LeNet-5 and ResNet-50. In contrast, ""InstantNet"" (abs-2104.10853v2) appears to address model compression through different methodologies, possibly involving techniques such as pruning before training or gating mechanisms for summarization in the Value Iteration module, which is not directly comparable without more specific details on its exact approach.","abs-2201.09881v1, abs-2007.00389v1, abs-2004.02569v1, abs-2305.07039v2","[""based pruning (ILP), does not produce accurate pruned models. To solve this problem, we propose two activation-based pruning methods, Iterative Activation-based Pruning (IAP) and Adaptive Iterative Activation-based Pruning (AIAP). We observe that, with only 1% accuracy loss, IAP and AIAP achieve 7.75X and 15.88$X compression on LeNet-5, and 1.25X and 1.71X compression on ResNet-50, whereas ILP achieves 4.77X and 1.13X, respectively."", ""Title: Iterative Activation-based Structured Pruning.\nPublished_date: 2022-01-22."", ""Title: Single Shot Structured Pruning Before Training.\nPublished_date: 2020-07-01.\nSummary: We introduce a method to speed up training by 2x and inference by 3x in deep neural networks using structured pruning applied before training. Unlike previous works on pruning before training which prune individual weights, our work develops a methodology to remove entire channels and hidden units with the explicit aim of speeding up training and inference. We introduce a compute-aware scoring mechanism which enables pruning in units of sensitivity per FLOP removed, allowing even greater speed ups. Our method is fast, easy to implement, and needs just one forward/backward pass on a single batch of data to complete pruning before training begins."", ""Title: Gradient-Based Training and Pruning of Radial Basis Function Networks\n  with an Application in Materials Physics.\nPublished_date: 2020-04-06."", ""Summary: In this paper, we address the challenges faced by Value Iteration Networks (VIN) in handling larger input maps and mitigating the impact of accumulated errors caused by increased iterations. We propose a novel approach, Value Iteration Networks with Gated Summarization Module (GS-VIN), which incorporates two main improvements: (1) employing an Adaptive Iteration Strategy in the Value Iteration module to reduce the number of iterations, and (2) introducing a Gated Summarization module to summarize the iterative process. The adaptive iteration strategy uses larger convolution kernels with fewer iteration times, reducing network depth and increasing training stability while maintaining the accuracy of the planning process. The gated summarization module enables the network to emphasize the entire planning process, rather than solely relying on the final global planning outcome, by temporally and spatially resampling the entire planning process within the VI module. We conduct""]"
How do the goals of domain generalization in 'Invariant-Feature Subspace Recovery' (abs-2201.12919v2) differ from the goals of out-of-distribution detection in satellite imagery (abs-2104.05442v1)?,"abs-2201.12919v2,abs-2104.05442v1",Comparative & Contrastive,"Title: Provable Domain Generalization via Invariant-Feature Subspace Recovery 
Summary: Domain generalization asks for models trained over a set of training
environments to perform well in unseen test environments. Recently, a series of
algorithms such as Invariant Risk Minimization (IRM) has been proposed for
domain generalization. However, Rosenfeld et al. (2021) shows that in a simple
linear data model, even if non-convexity issues are ignored, IRM and its
extensions cannot generalize to unseen environments with less than $d_s+1$
training environments, where $d_s$ is the dimension of the spurious-feature
subspace. In this paper, we propose to achieve domain generalization with
Invariant-feature Subspace Recovery (ISR). Our first algorithm, ISR-Mean, can
identify the subspace spanned by invariant features from the first-order
moments of the class-conditional distributions, and achieve provable domain
generalization with $d_s+1$ training environments under the data model of
Rosenfeld et al. (2021). Our second algorithm, ISR-Cov, further reduces the
required number of training environments to $O(1)$ using the information of
second-order moments. Notably, unlike IRM, our algorithms bypass non-convexity
issues and enjoy global convergence guarantees. Empirically, our ISRs can
obtain superior performance compared with IRM on synthetic benchmarks. In
addition, on three real-world image and text datasets, we show that both ISRs
can be used as simple yet effective post-processing methods to improve the
worst-case accuracy of (pre-)trained models against spurious correlations and
group shifts. 

Title: Out-of-distribution detection in satellite image classification 
Summary: In satellite image analysis, distributional mismatch between the training and
test data may arise due to several reasons, including unseen classes in the
test data and differences in the geographic area. Deep learning based models
may behave in unexpected manner when subjected to test data that has such
distributional shifts from the training data, also called out-of-distribution
(OOD) examples. Predictive uncertainly analysis is an emerging research topic
which has not been explored much in context of satellite image analysis.
Towards this, we adopt a Dirichlet Prior Network based model to quantify
distributional uncertainty of deep learning models for remote sensing. The
approach seeks to maximize the representation gap between the in-domain and OOD
examples for a better identification of unknown examples at test time.
Experimental results on three exemplary test scenarios show the efficacy of the
model in satellite image analysis. 

","The goal of Invariant-Feature Subspace Recovery (ISR) is to identify invariant features across different environments, enabling models trained on a set of training environments to generalize to unseen test environments with $d_s+1$ training environments under a specific data model. On the other hand, out-of-distribution detection in satellite imagery aims to quantify distributional uncertainty by adopting a Dirichlet Prior Network-based approach to identify unknown examples that deviate from the in-domain data, ensuring better identification of unexpected or out-of-distribution samples during testing.","abs-2201.12919v2, abs-2104.05442v1, abs-2103.11163v2, abs-2110.15057v2","[""Summary: Domain generalization asks for models trained over a set of training environments to perform well in unseen test environments. Recently, a series of algorithms such as Invariant Risk Minimization (IRM) has been proposed for domain generalization. However, Rosenfeld et al. (2021) shows that in a simple linear data model, even if non-convexity issues are ignored, IRM and its extensions cannot generalize to unseen environments with less than $d_s+1$ training environments, where $d_s$ is the dimension of the spurious-feature subspace. In this paper, we propose to achieve domain generalization with Invariant-feature Subspace Recovery (ISR). Our first algorithm, ISR-Mean, can identify the subspace spanned by invariant features from the first-order moments of the class-conditional distributions, and achieve provable domain generalization with $d_s+1$ training environments under the data model of Rosenfeld et al. (2021). Our second algorithm, ISR-Cov, further reduces the required"", ""Published_date: 2021-04-09.\nSummary: In satellite image analysis, distributional mismatch between the training and test data may arise due to several reasons, including unseen classes in the test data and differences in the geographic area. Deep learning based models may behave in unexpected manner when subjected to test data that has such distributional shifts from the training data, also called out-of-distribution (OOD) examples. Predictive uncertainly analysis is an emerging research topic which has not been explored much in context of satellite image analysis. Towards this, we adopt a Dirichlet Prior Network based model to quantify distributional uncertainty of deep learning models for remote sensing. The approach seeks to maximize the representation gap between the in-domain and OOD examples for a better identification of unknown examples at test time. Experimental results on three exemplary test scenarios show the efficacy of the model in satellite image analysis."", ""Title: Out-of-distribution detection in satellite image classification.\nPublished_date: 2021-04-09."", ""Summary: Clinical machine learning models experience significantly degraded performance in datasets not seen during training, e.g., new hospitals or populations. Recent developments in domain generalization offer a promising solution to this problem by creating models that learn invariances across environments. In this work, we benchmark the performance of eight domain generalization methods on multi-site clinical time series and medical imaging data. We introduce a framework to induce synthetic but realistic domain shifts and sampling bias to stress-test these methods over existing non-healthcare benchmarks. We find that current domain generalization methods do not consistently achieve significant gains in out-of-distribution performance over empirical risk minimization on real-world medical imaging data, in line with prior work on general imaging datasets. However, a subset of realistic induced-shift scenarios in clinical time series data do exhibit limited performance gains. We"", ""In particular, our solution is unique, matches conditional distributions across domains, recovers target proportions and explicitly controls the target generalization risk. Through an exhaustive comparison on several datasets, we challenge the state-of-the-art in GeTarS.""]"
Both abs-2410.02176v1 and abs-2104.14936v1 deal with low-rank structures. How does the implicit low-rank bias induced by Weight Decay differ from the explicit low-rank assumption used in the LATC framework for tensor completion?,"abs-2410.02176v1,abs-2104.14936v1",Comparative & Contrastive,"Title: Towards Better Generalization: Weight Decay Induces Low-rank Bias for
  Neural Networks 
Summary: We study the implicit bias towards low-rank weight matrices when training
neural networks (NN) with Weight Decay (WD). We prove that when a ReLU NN is
sufficiently trained with Stochastic Gradient Descent (SGD) and WD, its weight
matrix is approximately a rank-two matrix. Empirically, we demonstrate that WD
is a necessary condition for inducing this low-rank bias across both regression
and classification tasks. Our work differs from previous studies as our
theoretical analysis does not rely on common assumptions regarding the training
data distribution, optimality of weight matrices, or specific training
procedures. Furthermore, by leveraging the low-rank bias, we derive improved
generalization error bounds and provide numerical evidence showing that better
generalization can be achieved. Thus, our work offers both theoretical and
empirical insights into the strong generalization performance of SGD when
combined with WD. 

Title: Low-Rank Autoregressive Tensor Completion for Spatiotemporal Traffic
  Data Imputation 
Summary: Spatiotemporal traffic time series (e.g., traffic volume/speed) collected
from sensing systems are often incomplete with considerable corruption and
large amounts of missing values, preventing users from harnessing the full
power of the data. Missing data imputation has been a long-standing research
topic and critical application for real-world intelligent transportation
systems. A widely applied imputation method is low-rank matrix/tensor
completion; however, the low-rank assumption only preserves the global
structure while ignores the strong local consistency in spatiotemporal data. In
this paper, we propose a low-rank autoregressive tensor completion (LATC)
framework by introducing \textit{temporal variation} as a new regularization
term into the completion of a third-order (sensor $\times$ time of day $\times$
day) tensor. The third-order tensor structure allows us to better capture the
global consistency of traffic data, such as the inherent seasonality and
day-to-day similarity. To achieve local consistency, we design the temporal
variation by imposing an AR($p$) model for each time series with coefficients
as learnable parameters. Different from previous spatial and temporal
regularization schemes, the minimization of temporal variation can better
characterize temporal generative mechanisms beyond local smoothness, allowing
us to deal with more challenging scenarios such ""blackout"" missing. To solve
the optimization problem in LATC, we introduce an alternating minimization
scheme that estimates the low-rank tensor and autoregressive coefficients
iteratively. We conduct extensive numerical experiments on several real-world
traffic data sets, and our results demonstrate the effectiveness of LATC in
diverse missing scenarios. 

","The implicit low-rank bias induced by Weight Decay (WD) in neural networks, as studied in abs-2410.02176v1, is derived through theoretical analysis without relying on specific assumptions about the training data distribution or optimality of weight matrices. In contrast, the explicit low-rank assumption used in frameworks like LATC for tensor completion involves an explicit model that incorporates a low-rank structure from the outset, typically based on prior knowledge about the underlying data generation process or the problem domain.","abs-2410.02176v1, abs-2403.13037v1, abs-2006.10814v2, abs-2006.06135v1, abs-2210.12638v1","[""Neural Networks.\nPublished_date: 2024-10-03.\nSummary: We study the implicit bias towards low-rank weight matrices when training neural networks (NN) with Weight Decay (WD). We prove that when a ReLU NN is sufficiently trained with Stochastic Gradient Descent (SGD) and WD, its weight matrix is approximately a rank-two matrix. Empirically, we demonstrate that WD is a necessary condition for inducing this low-rank bias across both regression and classification tasks. Our work differs from previous studies as our theoretical analysis does not rely on common assumptions regarding the training data distribution, optimality of weight matrices, or specific training procedures. Furthermore, by leveraging the low-rank bias, we derive improved generalization error bounds and provide numerical evidence showing that better generalization can be achieved. Thus, our work offers both theoretical and empirical insights into the strong generalization performance of SGD when combined with WD."", ""Summary: Low-rank adaptation (LoRA) is a popular method for fine-tuning large-scale pre-trained models in downstream tasks by learning low-rank incremental matrices. Though LoRA and its variants effectively reduce the number of trainable parameters compared to full fine-tuning methods, they often overfit training data, resulting in sub-optimal generalization on test data. To address this problem, we introduce BiLoRA, an overfitting-alleviating fine-tuning approach based on bi-level optimization (BLO). BiLoRA employs pseudo singular value decomposition to parameterize low-rank incremental matrices and splits the training of pseudo singular vectors and values across two different subsets of training data. This division, embedded within separate levels of the BLO framework, mitigates the risk of overfitting to a single dataset. Tested on ten datasets covering natural language understanding and generation tasks and applied to various well-known large pre-trained models, BiLoRA"", ""Title: FLAMBE: Structural Complexity and Representation Learning of Low Rank\n  MDPs.\nPublished_date: 2020-06-18.\nSummary: In order to deal with the curse of dimensionality in reinforcement learning (RL), it is common practice to make parametric assumptions where values or policies are functions of some low dimensional feature space. This work focuses on the representation learning question: how can we learn such features? Under the assumption that the underlying (unknown) dynamics correspond to a low rank transition matrix, we show how the representation learning question is related to a particular non-linear matrix decomposition problem. Structurally, we make precise connections between these low rank MDPs and latent variable models, showing how they significantly generalize prior formulations for representation learning in RL. Algorithmically, we develop FLAMBE, which engages in exploration and representation learning for provably efficient RL in low rank transition models."", ""algorithm that finds $\\epsilon$-optimal $Q$-function with sample complexity of $\\widetilde{O}(\\frac{1}{\\epsilon^{\\max(d_1, d_2)+2}})$ when the optimal $Q$-function has low rank $r$ and the discounting factor $\\gamma$ is below a certain threshold. Thus, this provides an exponential improvement in sample complexity. To enable our result, we develop a novel Matrix Estimation algorithm that faithfully estimates an unknown low-rank matrix in the $\\ell_\\infty$ sense even in the presence of arbitrary bounded noise, which might be of interest in its own right. Empirical results on several stochastic control tasks confirm the efficacy of our \""low-rank\"" algorithms."", ""Summary: With powerful ability to exploit latent structure of self-representation information, different tensor decompositions have been employed into low rank multi-view clustering (LRMVC) models for achieving significant performance. However, current approaches suffer from a series of problems related to those tensor decomposition, such as the unbalanced matricization scheme, rotation sensitivity, deficient correlations capture and so forth. All these will lead to LRMVC having insufficient access to global information, which is contrary to the target of multi-view clustering. To alleviate these problems, we propose a new tensor decomposition called Tucker-O-Minus Decomposition (TOMD) for multi-view clustering. Specifically, based on the Tucker format, we additionally employ the O-minus structure, which consists of a circle with an efficient bridge linking two weekly correlated factors. In this way, the core tensor in Tucker format is replaced by the O-minus architecture with a more""]"
